,WEO Country Code,ISO,WEO Subject Code,Country,Subject Descriptor,Subject Notes,Units,Scale,Country/Series-specific Notes,1980,1981,1982,1983,1984,1985,1986,1987,1988,1989,1990,1991,1992,1993,1994,1995,1996,1997,1998,1999,2000,2001,2002,2003,2004,2005,2006,2007,2008,2009,2010,2011,2012,2013,2014,2015,2016,2017,2018,2019,2020,2021,2022,2023,2024,2025,2026,Estimates Start After
270,213,ARG,NGDP_R,Argentina,"Gross domestic product, constant prices","Expressed in billions of national currency units; the base year is country-specific. Expenditure-based GDP is total final expenditures at purchasers' prices (including the f.o.b. value of exports of goods and services), less the f.o.b. value of imports of goods and services. [SNA 1993]",National currency,Billions,Source: National Statistics Office Latest actual data: 2020 National accounts manual used: System of National Accounts (SNA) 2008 GDP valuation: Market prices Start/end months of reporting year: January/December Base year: 2004 Chain-weighted: No Primary domestic currency: Argentine peso Data last updated: 09/2021,357.389,336.861,326.255,338.435,345.205,321.209,344.161,352.864,345.959,321.719,317.415,350.738,386.861,411.044,435.006,422.63,445.987,482.16,500.725,483.773,479.956,458.795,408.812,445.423,485.115,528.056,570.549,621.943,647.176,608.873,670.524,710.782,703.486,720.407,702.306,721.487,706.478,726.39,707.755,692.977,624.336,671.162,687.703,701.457,714.079,726.584,739.924,2020.0
271,213,ARG,NGDP_RPCH,Argentina,"Gross domestic product, constant prices","Annual percentages of constant price GDP are year-on-year changes; the base year is country-specific. Expenditure-based GDP is total final expenditures at purchasers' prices (including the f.o.b. value of exports of goods and services), less the f.o.b. value of imports of goods and services. [SNA 1993]",Percent change,,"See notes for:  Gross domestic product, constant prices (National currency).",0.7,-5.744,-3.149,3.733,2.0,-6.951,7.146,2.529,-1.957,-7.007,-1.338,10.498,10.299,6.251,5.83,-2.845,5.527,8.111,3.85,-3.385,-0.789,-4.409,-10.894,8.955,8.911,8.852,8.047,9.008,4.057,-5.919,10.125,6.004,-1.026,2.405,-2.513,2.731,-2.08,2.819,-2.565,-2.088,-9.905,7.5,2.465,2.0,1.799,1.751,1.836,2020.0
273,213,ARG,NGDPD,Argentina,"Gross domestic product, current prices","Values are based upon GDP in national currency converted to U.S. dollars using market exchange rates (yearly average). Exchange rate projections are provided by country economists for the group of other emerging market and developing countries. Exchanges rates for advanced economies are established in the WEO assumptions for each WEO exercise. Expenditure-based GDP is total final expenditures at purchasers' prices (including the f.o.b. value of exports of goods and services), less the f.o.b. value of imports of goods and services. [SNA 1993]",U.S. dollars,Billions,"See notes for:  Gross domestic product, current prices (National currency).",233.696,189.802,94.25,116.267,130.544,98.599,118.565,121.561,142.386,91.352,158.024,211.979,255.787,264.429,287.835,288.497,304.282,327.436,334.244,316.998,317.759,300.421,112.458,142.431,164.911,199.273,232.892,287.921,363.545,334.633,424.729,527.644,579.666,611.471,563.614,642.464,556.774,643.861,524.431,451.815,389.064,455.172,483.765,476.485,488.269,511.523,536.229,2020.0
274,213,ARG,PPPGDP,Argentina,"Gross domestic product, current prices","These data form the basis for the country weights used to generate the World Economic Outlook country group composites for the domestic economy.   The IMF is not a primary source for purchasing power parity (PPP) data. WEO weights have been created from primary sources and are used solely for purposes of generating country group composites. For primary source information, please refer to one of the following sources: the Organization for Economic Cooperation and Development, the World Bank, or the Penn World Tables.   For further information see Box 1.1 in the October 2020 World Economic Outlook, ""Revised Purchasing Power Parity Weights"" in the July 2014 WEO Update, Box A2 in the April 2004 World Economic Outlook, Box A1 in the May 2000 World Economic Outlook, and Annex IV in the May 1993 World Economic Outlook for summaries of the revised PPP-based weights; and Box 1.2 in the September 2003 World Economic Outlook for a discussion on the measurement of global growth. See also Anne Marie Gulde and Marianne Schulze-Ghattas, Purchasing Power Parity Based Weights for the World Economic Outlook, in Staff Studies for the World Economic Outlook (Washington: IMF, December 1993), pp. 106-23.",Purchasing power parity; international dollars,Billions,"See notes for:  Gross domestic product, current prices (National currency).",172.522,177.997,183.044,197.314,208.525,200.165,218.786,229.867,233.316,225.476,230.785,263.638,297.418,323.499,349.671,346.845,372.716,409.894,430.468,421.755,427.907,418.256,378.498,420.534,470.303,527.986,588.077,658.373,698.222,661.108,736.799,797.264,819.698,849.616,839.897,867.177,885.228,1039.33,1036.86,1033.37,942.232,1049.4,1104.86,1153.77,1201.31,1248.9,1298.18,2020.0
276,213,ARG,NGDPRPC,Argentina,"Gross domestic product per capita, constant prices",GDP is expressed in constant national currency per person. Data are derived by dividing constant price GDP by total population.,National currency,Units,"See notes for:  Gross domestic product, constant prices (National currency) Population (Persons).",12786.71,11840.46,11277.39,11534.94,11568.52,10583.48,11195.87,11349.75,10993.31,10097.88,9757.62,10638.09,11575.75,12118.96,12662.81,12151.83,12671.67,13542.17,13906.94,13290.99,13048.0,12347.75,10897.11,11761.97,12690.7,13682.99,14640.5,15802.84,16282.96,15170.84,16439.06,17226.27,16856.72,17070.07,16459.21,16727.44,16207.2,16492.07,15906.58,15420.5,13755.51,14640.77,14853.07,15000.13,15118.86,15231.31,15357.37,2019.0
277,213,ARG,NGDPRPPPPC,Argentina,"Gross domestic product per capita, constant prices",GDP is expressed in constant international dollars per person. Data are derived by dividing constant price purchasing-power parity (PPP) GDP by total population.,Purchasing power parity; 2017 international dollar,Units,"See notes for:  Gross domestic product, constant prices (National currency) Population (Persons).",18295.43,16941.52,16135.87,16504.37,16552.43,15143.02,16019.23,16239.41,15729.4,14448.22,13961.36,15221.16,16562.77,17340.0,18118.16,17387.03,18130.83,19376.36,19898.28,19016.97,18669.29,17667.36,15591.77,16829.23,18158.06,19577.84,20947.87,22610.96,23297.92,21706.68,23521.27,24647.63,24118.87,24424.14,23550.1,23933.89,23189.53,23597.12,22759.4,22063.9,19681.61,20948.25,21252.02,21462.44,21632.31,21793.21,21973.57,2019.0
279,213,ARG,NGDPDPC,Argentina,"Gross domestic product per capita, current prices",GDP is expressed in current U.S. dollars per person. Data are derived by first converting GDP in national currency to U.S. dollars and then dividing it by total population.,U.S. dollars,Units,"See notes for:  Gross domestic product, current prices (National currency) Population (Persons).",8361.21,6671.43,3257.85,3962.74,4374.78,3248.75,3857.03,3909.98,4524.5,2867.31,4857.8,6429.45,7653.71,7796.24,8378.74,8295.12,8645.46,9196.52,9283.18,8709.07,8638.54,8085.36,2997.62,3761.09,4314.1,5163.55,5976.08,7315.73,9146.79,8337.81,10412.97,12787.81,13889.79,14488.83,13208.83,14895.32,12772.87,14618.33,11786.43,10054.02,8571.94,9929.15,10448.39,10189.26,10337.88,10723.0,11129.62,2019.0
280,213,ARG,PPPPC,Argentina,"Gross domestic product per capita, current prices","Expressed in GDP in PPP dollars per person. Data are derived by dividing GDP in PPP dollars by total population. These data form the basis for the country weights used to generate the World Economic Outlook country group composites for the domestic economy.   The IMF is not a primary source for purchasing power parity (PPP) data. WEO weights have been created from primary sources and are used solely for purposes of generating country group composites. For primary source information, please refer to one of the following sources: the Organization for Economic Cooperation and Development, the World Bank, or the Penn World Tables.  For further information see Box 1.1 in the October 2020 World Economic Outlook, ""Revised Purchasing Power Parity Weights"" in the July 2014 WEO Update, Box A2 in the April 2004 World Economic Outlook, Box A1 in the May 2000 World Economic Outlook, and Annex IV in the May 1993 World Economic Outlook for summaries of the revised PPP-based weights; and Box 1.2 in the September 2003 World Economic Outlook for a discussion on the measurement of global growth. See also Anne Marie Gulde and Marianne Schulze-Ghattas, Purchasing Power Parity Based Weights for the World Economic Outlook, in Staff Studies for the World Economic Outlook (Washington: IMF, December 1993), pp. 106-23.",Purchasing power parity; international dollars,Units,"See notes for:  Gross domestic product, current prices (National currency) Population (Persons).",6172.51,6256.47,6327.15,6725.08,6988.09,6595.21,7117.3,7393.59,7413.92,7077.09,7094.54,7996.31,8899.4,9537.83,10178.73,9972.8,10589.85,11512.48,11955.65,11587.12,11633.0,11256.71,10089.08,11104.74,12303.2,13681.19,15090.27,16728.5,17567.28,16472.34,18063.91,19322.23,19641.35,20131.68,19683.77,20105.2,20307.87,23597.12,23303.08,22995.11,20759.46,22891.7,23862.86,24672.55,25434.64,26180.44,26944.12,2019.0
282,213,ARG,PPPSH,Argentina,Gross domestic product based on purchasing-power-parity (PPP) share of world total,"Expressed in percent of world GDP in PPP dollars. These data form the basis for the country weights used to generate the World Economic Outlook country group composites for the domestic economy.   The IMF is not a primary source for purchasing power parity (PPP) data. WEO weights have been created from primary sources and are used solely for purposes of generating country group composites. For primary source information, please refer to one of the following sources: the Organization for Economic Cooperation and Development, the World Bank, or the Penn World Tables.  For further information see Box 1.1 in the October 2020 World Economic Outlook, ""Revised Purchasing Power Parity Weights"" in the July 2014 WEO Update, Box A2 in the April 2004 World Economic Outlook, Box A1 in the May 2000 World Economic Outlook, and Annex IV in the May 1993 World Economic Outlook for summaries of the revised PPP-based weights; and Box 1.2 in the September 2003 World Economic Outlook for a discussion on the measurement of global growth. See also Anne Marie Gulde and Marianne Schulze-Ghattas, Purchasing Power Parity Based Weights for the World Economic Outlook, in Staff Studies for the World Economic Outlook (Washington: IMF, December 1993), pp. 106-23.",Percent,,"See notes for:  Gross domestic product, current prices (National currency).",1.289,1.195,1.155,1.169,1.142,1.027,1.063,1.05,0.985,0.884,0.838,0.904,0.897,0.935,0.961,0.901,0.915,0.951,0.962,0.898,0.85,0.794,0.688,0.72,0.745,0.774,0.794,0.821,0.831,0.784,0.82,0.836,0.817,0.807,0.77,0.779,0.766,0.854,0.804,0.766,0.714,0.726,0.709,0.698,0.688,0.678,0.668,2020.0
284,213,ARG,NID_NGDP,Argentina,Total investment,Expressed as a ratio of total investment in current local currency and GDP in current local currency. Investment or gross capital formation is measured by the total value of the gross fixed capital formation and changes in inventories and acquisitions less disposals of valuables for a unit or sector. [SNA 1993],Percent of GDP,,Source: National Statistics Office Latest actual data: 2020 National accounts manual used: System of National Accounts (SNA) 2008 GDP valuation: Market prices Start/end months of reporting year: January/December Base year: 2004 Chain-weighted: No Primary domestic currency: Argentine peso Data last updated: 09/2021,20.346,18.197,17.618,16.797,15.94,13.95,13.977,15.698,15.063,12.465,11.354,11.895,13.431,17.301,17.509,16.399,17.403,18.415,18.551,15.557,15.337,13.64,9.965,12.877,17.551,18.888,18.68,20.099,19.573,16.053,17.706,18.398,16.502,17.306,17.263,17.071,17.663,18.213,16.614,14.917,17.913,18.946,21.11,21.521,21.693,21.985,22.365,2020.0
285,213,ARG,NGSD_NGDP,Argentina,Gross national savings,"Expressed as a ratio of gross national savings in current local currency and GDP in current local currency. Gross national saving is gross disposable income less final consumption expenditure after taking account of an adjustment for pension funds. [SNA 1993] For many countries, the estimates of national saving are built up from national accounts data on gross domestic investment and from balance of payments-based data on net foreign investment.",Percent of GDP,,Source: National Statistics Office Latest actual data: 2020 National accounts manual used: System of National Accounts (SNA) 2008 GDP valuation: Market prices Start/end months of reporting year: January/December Base year: 2004 Chain-weighted: No Primary domestic currency: Argentine peso Data last updated: 09/2021,20.748,18.216,17.345,16.96,16.305,17.241,16.215,14.533,15.567,15.071,15.472,12.889,12.41,13.999,13.989,17.662,15.051,14.662,14.17,11.742,12.459,12.325,17.631,18.474,19.35,21.362,21.471,22.199,21.065,18.22,17.323,17.386,16.133,15.159,15.634,14.328,14.95,13.375,11.449,14.097,18.765,19.941,21.882,22.356,22.525,22.775,23.229,2020.0
291,213,ARG,TM_RPCH,Argentina,Volume of imports of goods and services,"Percent change of volume of imports refers to the aggregate change in the quantities of total imports whose characteristics are unchanged. The goods and services and their prices are held constant, therefore changes are due to changes in quantities only. [Export and Import Price Index Manual: Theory and Practice, Glossary]",Percent change,,"Source: National Statistics Office Latest actual data: 2020 Base year: 1996 Methodology used to derive volumes: Weighted average of volume changes Formula used to derive volumes: Laspeyres-type Chain-weighted: No Trade System: General trade Excluded items in trade: In transit; Other; Valuation of exports: Free on board (FOB) Valuation of imports: Cost, insurance, freight (CIF) Primary domestic currency: Argentine peso Data last updated: 09/2021",41.493,-8.239,-42.58,-6.924,4.705,-13.038,18.523,11.422,-9.204,-16.419,-0.69,75.576,66.462,13.423,26.7,-11.484,19.483,30.046,9.881,-15.955,-2.407,-16.629,-53.553,48.933,51.165,18.375,12.966,22.202,14.597,-23.858,39.414,21.578,-5.952,3.548,-10.842,2.644,3.568,14.235,-5.591,-21.107,-10.722,23.228,3.014,2.984,3.827,3.719,3.864,2020.0
292,213,ARG,TMG_RPCH,Argentina,Volume of Imports of goods,"Percent change of volume of imports of goods refers to the aggregate change in the quantities of imports of goods whose characteristics are unchanged. The goods and their prices are held constant, therefore changes are due to changes in quantities only. [Export and Import Price Index Manual: Theory and Practice, Glossary]",Percent change,,"Source: National Statistics Office Latest actual data: 2020 Base year: 1996 Methodology used to derive volumes: Weighted average of volume changes Formula used to derive volumes: Laspeyres-type Chain-weighted: No Trade System: General trade Excluded items in trade: In transit; Other; Valuation of exports: Free on board (FOB) Valuation of imports: Cost, insurance, freight (CIF) Primary domestic currency: Argentine peso Data last updated: 09/2021",67.807,-20.509,-24.66,-28.526,14.23,-19.005,17.526,13.253,-15.31,1.044,-24.706,104.504,76.694,13.423,26.7,-11.484,19.483,29.918,9.512,-15.919,-2.423,-17.167,-53.202,49.778,50.389,18.463,12.825,22.306,14.166,-23.579,39.714,21.38,-6.194,3.682,-11.226,3.176,3.37,14.566,-6.317,-20.846,-10.588,23.097,3.248,2.931,3.839,3.714,3.879,2020.0
293,213,ARG,TX_RPCH,Argentina,Volume of exports of goods and services,"Percent change of volume of exports refers to the aggregate change in the quantities of total exports whose characteristics are unchanged. The goods and services and their prices are held constant, therefore changes are due to changes in quantities only. [Export and Import Price Index Manual: Theory and Practice, Glossary]",Percent change,,"Source: National Statistics Office Latest actual data: 2020 Base year: 1996 Methodology used to derive volumes: Weighted average of volume changes Formula used to derive volumes: Laspeyres-type Chain-weighted: No Trade System: General trade Excluded items in trade: In transit; Other; Valuation of exports: Free on board (FOB) Valuation of imports: Cost, insurance, freight (CIF) Primary domestic currency: Argentine peso Data last updated: 09/2021",43.237,5.204,3.947,2.582,-2.591,15.554,-9.975,-3.519,18.728,7.472,16.833,-5.105,2.105,2.385,17.375,25.559,6.395,15.133,12.705,-2.148,1.867,6.132,0.238,5.016,0.003,11.55,4.559,5.96,-0.951,-10.783,13.701,2.292,-5.837,-3.688,-7.786,-1.633,6.807,-0.132,-0.264,12.155,-13.124,6.751,6.839,5.664,4.662,3.673,3.561,2020.0
294,213,ARG,TXG_RPCH,Argentina,Volume of exports of goods,"Percent change of volume of exports of goods refers to the aggregate change in the quantities of exports of goods whose characteristics are unchanged. The goods and their prices are held constant, therefore changes are due to changes in quantities only. [Export and Import Price Index Manual: Theory and Practice, Glossary]",Percent change,,"Source: National Statistics Office Latest actual data: 2020 Base year: 1996 Methodology used to derive volumes: Weighted average of volume changes Formula used to derive volumes: Laspeyres-type Chain-weighted: No Trade System: General trade Excluded items in trade: In transit; Other; Valuation of exports: Free on board (FOB) Valuation of imports: Cost, insurance, freight (CIF) Primary domestic currency: Argentine peso Data last updated: 09/2021",33.17,7.866,6.747,5.649,8.069,2.649,-12.726,-9.557,20.386,34.631,4.835,-0.251,5.175,2.385,17.375,25.559,6.395,15.102,12.768,-2.228,1.897,6.236,0.035,5.168,-0.078,11.555,4.501,6.026,-1.03,-10.748,14.073,2.125,-6.01,-3.473,-7.735,-1.626,6.545,-0.097,-0.524,12.402,-13.167,6.802,6.981,5.668,4.654,3.674,3.563,2020.0
295,213,ARG,LUR,Argentina,Unemployment rate,"Unemployment rate can be defined by either the national definition, the ILO harmonized definition, or the OECD harmonized definition. The OECD harmonized unemployment rate gives the number of unemployed persons as a percentage of the labor force (the total number of people employed plus unemployed). [OECD Main Economic Indicators, OECD, monthly] As defined by the International Labour Organization, unemployed workers are those who are currently not working but are willing and able to work for pay, currently available to work, and have actively searched for work. [ILO, http://www.ilo.org/public/english/bureau/stat/res/index.htm]",Percent of total labor force,,"Source: National Statistics Office. Since 1972 to 2002, the data are compiled two times a year for each district, in May and October.Since 2003 to the present, the survey is developed throughout all weeks of the year each of the 31 urban groups. The elaborated data base gathers quarterly information, that is to say 4 yearly estimations are issued; January-February-March /April-May-June / July-August-September / October-November-December.The data relate to the employment status of respondents during the reference week, which is the previous week before the date of the appointment. Latest actual data: 2020 Notes: Argentina's authorities discontinued the publication of labor market data in December 2015 and released new series starting in the second quarter of 2016. Employment type: National definition Primary domestic currency: Argentine peso Data last updated: 09/2021",3.0,5.0,4.5,5.0,5.0,6.25,6.3,6.0,6.5,8.0,7.6,6.48,7.112,11.606,13.348,18.904,18.76,16.808,14.789,16.061,17.134,19.209,22.45,17.25,13.625,11.575,10.175,8.475,7.875,8.675,7.75,7.15,7.2,7.075,7.25,6.533,8.467,8.35,9.2,9.825,11.55,9.985,9.21,9.197,9.15,9.145,9.145,2020.0
297,213,ARG,LP,Argentina,Population,"For census purposes, the total population of the country consists of all persons falling within the scope of the census. In the broadest sense, the total may comprise either all usual residents of the country or all persons present in the country at the time of the census. [Principles and Recommendations for Population and Housing Censuses, Revision 1, paragraph 2.42]",Persons,Millions,Source: National Statistics Office Latest actual data: 2019 Notes: Based on the National Census of 2010 Primary domestic currency: Argentine peso Data last updated: 09/2021,27.95,28.45,28.93,29.34,29.84,30.35,30.74,31.09,31.47,31.86,32.53,32.97,33.42,33.917,34.353,34.779,35.196,35.604,36.005,36.399,36.784,37.156,37.516,37.87,38.226,38.592,38.971,39.356,39.746,40.134,40.788,41.261,41.733,42.203,42.67,43.132,43.59,44.045,44.495,44.939,45.388,45.842,46.3,46.763,47.231,47.703,48.18,2019.0
313,213,ARG,BCA,Argentina,Current account balance,"Current account is all transactions other than those in financial and capital items. The major classifications are goods and services, income and current transfers. The focus of the BOP is on transactions (between an economy and the rest of the world) in goods, services, and income.",U.S. dollars,Billions,"Source: National Statistics Office Latest actual data: 2020 BOP Manual used: Balance of Payments and International Investment Position Manual, sixth edition (BPM6) Primary domestic currency: Argentine peso Data last updated: 09/2021",-2.573,-5.721,-2.917,-2.436,-2.495,-0.952,-2.859,-4.235,-1.572,1.095,4.665,-0.429,-6.468,-8.043,-10.981,-5.104,-7.157,-12.288,-14.641,-12.094,-9.144,-3.952,8.621,7.972,2.966,4.929,6.499,6.046,5.424,7.251,-1.623,-5.341,-2.139,-13.125,-9.178,-17.623,-15.105,-31.149,-27.085,-3.709,3.313,4.526,3.733,3.976,4.064,4.042,4.635,2020.0
314,213,ARG,BCA_NGDPD,Argentina,Current account balance,"Current account is all transactions other than those in financial and capital items. The major classifications are goods and services, income and current transfers. The focus of the BOP is on transactions (between an economy and the rest of the world) in goods, services, and income.",Percent of GDP,,"See notes for:  Gross domestic product, current prices (National currency) Current account balance (U.S. dollars).",-1.101,-3.014,-3.095,-2.095,-1.911,-0.966,-2.411,-3.484,-1.104,1.199,2.952,-0.202,-2.529,-3.042,-3.815,-1.769,-2.352,-3.753,-4.38,-3.815,-2.878,-1.316,7.666,5.597,1.798,2.473,2.791,2.1,1.492,2.167,-0.382,-1.012,-0.369,-2.146,-1.628,-2.743,-2.713,-4.838,-5.165,-0.821,0.852,0.994,0.772,0.834,0.832,0.79,0.864,2020.0
