,WEO Country Code,ISO,WEO Subject Code,Country,Subject Descriptor,Subject Notes,Units,Scale,Country/Series-specific Notes,1980,1981,1982,1983,1984,1985,1986,1987,1988,1989,1990,1991,1992,1993,1994,1995,1996,1997,1998,1999,2000,2001,2002,2003,2004,2005,2006,2007,2008,2009,2010,2011,2012,2013,2014,2015,2016,2017,2018,2019,2020,2021,2022,2023,2024,2025,2026,Estimates Start After
519,912,AZE,TXG_RPCH,Azerbaijan,Volume of exports of goods,"Percent change of volume of exports of goods refers to the aggregate change in the quantities of exports of goods whose characteristics are unchanged. The goods and their prices are held constant, therefore changes are due to changes in quantities only. [Export and Import Price Index Manual: Theory and Practice, Glossary]",Percent change,,"Source: National Statistics Office Latest actual data: 2020 Base year: 2016 Methodology used to derive volumes: Deflation by survey-based price indexes Formula used to derive volumes: Laspeyres-type Chain-weighted: No Trade System: General trade Excluded items in trade: In transit; Re-exports; Re-imports; Oil coverage: Primary or unrefined products; Valuation of exports: Free on board (FOB) Valuation of imports: Cost, insurance, freight (CIF) Primary domestic currency: Azerbaijan manat Data last updated: 08/2021",,,,,,,,,,,,,,-60.379,-16.819,-7.501,-0.562,7.996,18.963,13.227,15.31,32.859,7.996,-1.387,11.055,47.774,42.195,47.674,7.295,4.623,-1.296,0.137,-5.689,-1.665,-4.159,-1.419,-0.909,-5.822,8.132,5.51,-9.992,3.786,-0.495,-2.65,-3.206,-0.327,1.215,2020.0
520,912,AZE,LUR,Azerbaijan,Unemployment rate,"Unemployment rate can be defined by either the national definition, the ILO harmonized definition, or the OECD harmonized definition. The OECD harmonized unemployment rate gives the number of unemployed persons as a percentage of the labor force (the total number of people employed plus unemployed). [OECD Main Economic Indicators, OECD, monthly] As defined by the International Labour Organization, unemployed workers are those who are currently not working but are willing and able to work for pay, currently available to work, and have actively searched for work. [ILO, http://www.ilo.org/public/english/bureau/stat/res/index.htm]",Percent of total labor force,,Source: National Statistics Office Latest actual data: 2020 Employment type: Harmonized ILO definition Primary domestic currency: Azerbaijan manat Data last updated: 08/2021,,,,,,,,,,,,,,,,,,,,,11.777,10.913,10.037,9.167,7.987,7.256,6.615,6.326,5.856,5.742,5.631,5.424,5.185,4.973,4.913,4.958,5.043,4.961,4.944,4.848,7.157,6.373,6.302,6.232,6.162,6.094,6.026,2020.0
521,912,AZE,LE,Azerbaijan,Employment,"Employment can be defined by either the national definition, the ILO harmonized definition, or the OECD harmonized definition. Persons who during a specified brief period such as one week or one day, (a) performed some work for wage or salary in cash or in kind, (b) had a formal attachment to their job but were temporarily not at work during the reference period, (c) performed some work for profit or family gain in cash or in kind, (d) were with an enterprise such as a business, farm or service but who were temporarily not at work during the reference period for any specific reason. [Current International Recommendations on Labour Statistics, 1988 Edition, ILO, Geneva, page 47]",Persons,Millions,,,,,,,,,,,,,,,,,,,,,,,,,,,,,,,,,,,,,,,,,,,,,,,,,
522,912,AZE,LP,Azerbaijan,Population,"For census purposes, the total population of the country consists of all persons falling within the scope of the census. In the broadest sense, the total may comprise either all usual residents of the country or all persons present in the country at the time of the census. [Principles and Recommendations for Population and Housing Censuses, Revision 1, paragraph 2.42]",Persons,Millions,Source: National Statistics Office Latest actual data: 2020 Notes: Data prior to 2005 cannot be confirmed at this time. Primary domestic currency: Azerbaijan manat Data last updated: 08/2021,,,,,,,,,,,,,7.459,7.487,7.597,7.644,7.726,7.8,7.877,7.953,8.033,8.114,8.191,8.269,8.349,8.447,8.553,8.666,8.78,8.922,8.998,9.111,9.235,9.357,9.477,9.593,9.706,9.81,9.898,9.982,10.067,10.188,10.31,10.434,10.559,10.686,10.814,2020.0
523,912,AZE,GGR,Azerbaijan,General government revenue,"Revenue consists of taxes, social contributions, grants receivable, and other revenue. Revenue increases government's net worth, which is the difference between its assets and liabilities (GFSM 2001, paragraph 4.20). Note: Transactions that merely change the composition of the balance sheet do not change the net worth position, for example, proceeds from sales of nonfinancial and financial assets or incurrence of liabilities.",National currency,Billions,"Source: Ministry of Finance or Treasury Latest actual data: 2020 Notes: Since the general government accounts for Azerbaijan are not available, all general government series are equal to the central government series. Central government includes state budget and main extrabudgetary funds, including operations of the oil fund and the social protection fund. Fiscal assumptions: WEO Oil and GAS assumptions. Start/end months of reporting year: January/December GFS Manual used: Government Finance Statistics Manual (GFSM) 2001 Basis of recording: Cash General government includes: Central Government; Valuation of public debt: Face value Instruments included in gross and net debt: Securities Other than Shares; Loans;. Treasury bills (Manat); treasury bonds (Manat); sovereign external debt (US dollar). Primary domestic currency: Azerbaijan manat Data last updated: 08/2021",,,,,,,,,,,,,,,0.127,0.375,0.481,0.605,0.674,0.697,0.867,2.049,2.578,1.663,2.218,3.161,4.867,8.056,19.52,14.37,19.444,23.226,22.085,22.937,23.084,18.416,20.699,24.076,30.925,33.92,24.479,30.734,33.395,32.63,31.415,31.178,31.504,2020.0
524,912,AZE,GGR_NGDP,Azerbaijan,General government revenue,"Revenue consists of taxes, social contributions, grants receivable, and other revenue. Revenue increases government's net worth, which is the difference between its assets and liabilities (GFSM 2001, paragraph 4.20). Note: Transactions that merely change the composition of the balance sheet do not change the net worth position, for example, proceeds from sales of nonfinancial and financial assets or incurrence of liabilities.",Percent of GDP,,See notes for:  General government revenue (National currency).,,,,,,,,,,,,,,,17.868,17.572,17.586,19.159,20.353,18.472,18.384,38.549,42.532,23.267,25.997,25.239,25.962,28.405,48.633,40.363,45.789,44.594,40.342,39.423,39.117,33.866,34.255,34.229,38.612,41.418,33.796,34.341,35.897,34.291,32.08,30.794,29.988,2020.0
525,912,AZE,GGX,Azerbaijan,General government total expenditure,"Total expenditure consists of total expense and the net acquisition of nonfinancial assets. Note: Apart from being on an accrual basis, total expenditure differs from the GFSM 1986 definition of total expenditure in the sense that it also takes the disposals of nonfinancial assets into account.",National currency,Billions,"Source: Ministry of Finance or Treasury Latest actual data: 2020 Notes: Since the general government accounts for Azerbaijan are not available, all general government series are equal to the central government series. Central government includes state budget and main extrabudgetary funds, including operations of the oil fund and the social protection fund. Fiscal assumptions: WEO Oil and GAS assumptions. Start/end months of reporting year: January/December GFS Manual used: Government Finance Statistics Manual (GFSM) 2001 Basis of recording: Cash General government includes: Central Government; Valuation of public debt: Face value Instruments included in gross and net debt: Securities Other than Shares; Loans;. Treasury bills (Manat); treasury bonds (Manat); sovereign external debt (US dollar). Primary domestic currency: Azerbaijan manat Data last updated: 08/2021",,,,,,,,,,,,,,,0.172,0.398,0.54,0.638,0.62,0.736,0.861,0.892,1.403,1.548,2.066,2.817,4.743,7.393,12.619,12.285,13.571,17.57,20.056,21.981,21.466,21.034,21.395,24.964,26.543,26.484,29.187,32.376,32.706,33.549,34.38,35.25,36.909,2020.0
526,912,AZE,GGX_NGDP,Azerbaijan,General government total expenditure,"Total expenditure consists of total expense and the net acquisition of nonfinancial assets. Note: Apart from being on an accrual basis, total expenditure differs from the GFSM 1986 definition of total expenditure in the sense that it also takes the disposals of nonfinancial assets into account.",Percent of GDP,,See notes for:  General government total expenditure (National currency).,,,,,,,,,,,,,,,24.284,18.665,19.75,20.191,18.721,19.505,18.24,16.785,23.139,21.662,24.216,22.498,25.299,26.068,31.439,34.506,31.958,33.735,36.636,37.779,36.374,38.68,35.407,35.492,33.141,32.339,40.296,36.176,35.156,35.256,35.108,34.816,35.133,2020.0
527,912,AZE,GGXCNL,Azerbaijan,General government net lending/borrowing,"Net lending (+)/ borrowing (-) is calculated as revenue minus total expenditure. This is a core GFS balance that measures the extent to which general government is either putting financial resources at the disposal of other sectors in the economy and nonresidents (net lending), or utilizing the financial resources generated by other sectors and nonresidents (net borrowing). This balance may be viewed as an indicator of the financial impact of general government activity on the rest of the economy and nonresidents (GFSM 2001, paragraph 4.17). Note: Net lending (+)/borrowing (-) is also equal to net acquisition of financial assets minus net incurrence of liabilities.",National currency,Billions,"Source: Ministry of Finance or Treasury Latest actual data: 2020 Notes: Since the general government accounts for Azerbaijan are not available, all general government series are equal to the central government series. Central government includes state budget and main extrabudgetary funds, including operations of the oil fund and the social protection fund. Fiscal assumptions: WEO Oil and GAS assumptions. Start/end months of reporting year: January/December GFS Manual used: Government Finance Statistics Manual (GFSM) 2001 Basis of recording: Cash General government includes: Central Government; Valuation of public debt: Face value Instruments included in gross and net debt: Securities Other than Shares; Loans;. Treasury bills (Manat); treasury bonds (Manat); sovereign external debt (US dollar). Primary domestic currency: Azerbaijan manat Data last updated: 08/2021",,,,,,,,,,,,,,,-0.045,-0.023,-0.059,-0.033,0.054,-0.039,0.007,1.157,1.176,0.115,0.152,0.343,0.124,0.663,6.901,2.085,5.873,5.656,2.029,0.956,1.618,-2.618,-0.696,-0.888,4.382,7.436,-4.708,-1.642,0.689,-0.919,-2.966,-4.072,-5.405,2020.0
528,912,AZE,GGXCNL_NGDP,Azerbaijan,General government net lending/borrowing,"Net lending (+)/ borrowing (-) is calculated as revenue minus total expenditure. This is a core GFS balance that measures the extent to which general government is either putting financial resources at the disposal of other sectors in the economy and nonresidents (net lending), or utilizing the financial resources generated by other sectors and nonresidents (net borrowing). This balance may be viewed as an indicator of the financial impact of general government activity on the rest of the economy and nonresidents (GFSM 2001, paragraph 4.17). Note: Net lending (+)/borrowing (-) is also equal to net acquisition of financial assets minus net incurrence of liabilities.",Percent of GDP,,See notes for:  General government net lending/borrowing (National currency).,,,,,,,,,,,,,,,-6.416,-1.093,-2.164,-1.032,1.631,-1.033,0.145,21.764,19.393,1.605,1.781,2.741,0.663,2.337,17.194,5.857,13.831,10.86,3.705,1.643,2.742,-4.814,-1.152,-1.263,5.471,9.079,-6.5,-1.834,0.741,-0.966,-3.029,-4.022,-5.145,2020.0
529,912,AZE,GGSB,Azerbaijan,General government structural balance,"The structural budget balance refers to the general government cyclically adjusted balance adjusted for nonstructural elements beyond the economic cycle. These include temporary financial sector and asset price movements as well as one-off, or temporary, revenue or expenditure items. The cyclically adjusted balance is the fiscal balance adjusted for the effects of the economic cycle; see, for example, A. Fedelino. A. Ivanova and M. Horton ""Computing Cyclically Adjusted Balances and Automatic Stabilizers"" IMF Technical Guidance Note No. 5, http://www.imf.org/external/pubs/ft/tnm/2009/tnm0905.pdf.",National currency,Billions,,,,,,,,,,,,,,,,,,,,,,,,,,,,,,,,,,,,,,,,,,,,,,,,,
530,912,AZE,GGSB_NPGDP,Azerbaijan,General government structural balance,"The structural budget balance refers to the general government cyclically adjusted balance adjusted for nonstructural elements beyond the economic cycle. These include temporary financial sector and asset price movements as well as one-off, or temporary, revenue or expenditure items. The cyclically adjusted balance is the fiscal balance adjusted for the effects of the economic cycle; see, for example, A. Fedelino. A. Ivanova and M. Horton ""Computing Cyclically Adjusted Balances and Automatic Stabilizers"" IMF Technical Guidance Note No. 5, http://www.imf.org/external/pubs/ft/tnm/2009/tnm0905.pdf.",Percent of potential GDP,,,,,,,,,,,,,,,,,,,,,,,,,,,,,,,,,,,,,,,,,,,,,,,,,,
531,912,AZE,GGXONLB,Azerbaijan,General government primary net lending/borrowing,Primary net lending/borrowing is net lending (+)/borrowing (-) plus net interest payable/paid (interest expense minus interest revenue).,National currency,Billions,"Source: Ministry of Finance or Treasury Latest actual data: 2020 Notes: Since the general government accounts for Azerbaijan are not available, all general government series are equal to the central government series. Central government includes state budget and main extrabudgetary funds, including operations of the oil fund and the social protection fund. Fiscal assumptions: WEO Oil and GAS assumptions. Start/end months of reporting year: January/December GFS Manual used: Government Finance Statistics Manual (GFSM) 2001 Basis of recording: Cash General government includes: Central Government; Valuation of public debt: Face value Instruments included in gross and net debt: Securities Other than Shares; Loans;. Treasury bills (Manat); treasury bonds (Manat); sovereign external debt (US dollar). Primary domestic currency: Azerbaijan manat Data last updated: 08/2021",,,,,,,,,,,,,,,-0.045,-0.021,-0.05,-0.029,0.057,-0.024,0.025,1.171,1.193,0.131,0.17,0.364,0.159,0.722,6.961,2.149,5.875,5.695,2.087,1.018,1.706,-2.416,-0.438,-0.584,4.924,8.003,-4.103,-1.014,1.272,-0.295,-2.247,-3.303,-4.484,2020.0
532,912,AZE,GGXONLB_NGDP,Azerbaijan,General government primary net lending/borrowing,Primary net lending/borrowing is net lending (+)/borrowing (-) plus net interest payable/paid (interest expense minus interest revenue).,Percent of GDP,,See notes for:  General government primary net lending/borrowing (National currency).,,,,,,,,,,,,,,,-6.407,-0.993,-1.839,-0.912,1.732,-0.633,0.539,22.024,19.672,1.833,1.99,2.908,0.85,2.545,17.342,6.036,13.836,10.935,3.813,1.749,2.891,-4.443,-0.725,-0.83,6.148,9.772,-5.665,-1.133,1.367,-0.309,-2.295,-3.262,-4.269,2020.0
533,912,AZE,GGXWDN,Azerbaijan,General government net debt,"Net debt is calculated as gross debt minus financial assets corresponding to debt instruments. These financial assets are: monetary gold and SDRs, currency and deposits, debt securities, loans, insurance, pension, and standardized guarantee schemes, and other accounts receivable.",National currency,Billions,,,,,,,,,,,,,,,,,,,,,,,,,,,,,,,,,,,,,,,,,,,,,,,,,
534,912,AZE,GGXWDN_NGDP,Azerbaijan,General government net debt,"Net debt is calculated as gross debt minus financial assets corresponding to debt instruments. These financial assets are: monetary gold and SDRs, currency and deposits, debt securities, loans, insurance, pension, and standardized guarantee schemes, and other accounts receivable.",Percent of GDP,,,,,,,,,,,,,,,,,,,,,,,,,,,,,,,,,,,,,,,,,,,,,,,,,,
535,912,AZE,GGXWDG,Azerbaijan,General government gross debt,"Gross debt consists of all liabilities that require payment or payments of interest and/or principal by the debtor to the creditor at a date or dates in the future. This includes debt liabilities in the form of SDRs, currency and deposits, debt securities, loans, insurance, pensions and standardized guarantee schemes, and other accounts payable. Thus, all liabilities in the GFSM 2001 system are debt, except for equity and investment fund shares and financial derivatives and employee stock options. Debt can be valued at current market, nominal, or face values (GFSM 2001, paragraph 7.110).",National currency,Billions,"Source: Ministry of Finance or Treasury Latest actual data: 2020 Notes: Since the general government accounts for Azerbaijan are not available, all general government series are equal to the central government series. Central government includes state budget and main extrabudgetary funds, including operations of the oil fund and the social protection fund. Fiscal assumptions: WEO Oil and GAS assumptions. Start/end months of reporting year: January/December GFS Manual used: Government Finance Statistics Manual (GFSM) 2001 Basis of recording: Cash General government includes: Central Government; Valuation of public debt: Face value Instruments included in gross and net debt: Securities Other than Shares; Loans;. Treasury bills (Manat); treasury bonds (Manat); sovereign external debt (US dollar). Primary domestic currency: Azerbaijan manat Data last updated: 08/2021",,,,,,,,,,,,,,,,0.41,0.457,0.394,0.473,0.959,1.077,1.296,1.395,1.56,0.828,0.858,0.993,1.135,1.293,1.683,2.115,2.587,3.192,3.595,5.035,9.778,12.453,15.832,14.966,14.46,15.479,25.846,26.901,29.434,30.743,34.873,40.39,2020.0
536,912,AZE,GGXWDG_NGDP,Azerbaijan,General government gross debt,"Gross debt consists of all liabilities that require payment or payments of interest and/or principal by the debtor to the creditor at a date or dates in the future. This includes debt liabilities in the form of SDRs, currency and deposits, debt securities, loans, insurance, pensions and standardized guarantee schemes, and other accounts payable. Thus, all liabilities in the GFSM 2001 system are debt, except for equity and investment fund shares and financial derivatives and employee stock options. Debt can be valued at current market, nominal, or face values (GFSM 2001, paragraph 7.110).",Percent of GDP,,See notes for:  General government gross debt (National currency).,,,,,,,,,,,,,,,,19.209,16.721,12.466,14.291,25.414,22.837,24.387,23.018,21.828,9.71,6.855,5.297,4.003,3.221,4.726,4.981,4.967,5.831,6.179,8.533,17.98,20.608,22.509,18.685,17.656,21.37,28.88,28.916,30.932,31.394,34.444,38.446,2020.0
537,912,AZE,NGDP_FY,Azerbaijan,"Gross domestic product corresponding to fiscal year, current prices","Gross domestic product corresponding to fiscal year is the country's GDP based on the same period during the year as their fiscal data. In the case of countries whose fiscal data are based on a fiscal calendar (e.g., July to June), this series would be the country's GDP over that same period. For countries whose fiscal data are based on a calendar year (i.e., January to December), this series will be the same as their GDP in current prices.",National currency,Billions,"Source: Ministry of Finance or Treasury Latest actual data: 2020 Notes: Since the general government accounts for Azerbaijan are not available, all general government series are equal to the central government series. Central government includes state budget and main extrabudgetary funds, including operations of the oil fund and the social protection fund. Fiscal assumptions: WEO Oil and GAS assumptions. Start/end months of reporting year: January/December GFS Manual used: Government Finance Statistics Manual (GFSM) 2001 Basis of recording: Cash General government includes: Central Government; Valuation of public debt: Face value Instruments included in gross and net debt: Securities Other than Shares; Loans;. Treasury bills (Manat); treasury bonds (Manat); sovereign external debt (US dollar). Primary domestic currency: Azerbaijan manat Data last updated: 08/2021",,,,,,,,,,,,,0.005,0.031,0.709,2.134,2.732,3.158,3.312,3.775,4.718,5.316,6.063,7.147,8.53,12.523,18.746,28.361,40.137,35.602,42.465,52.082,54.744,58.182,59.014,54.38,60.425,70.338,80.092,81.896,72.432,89.496,93.032,95.158,97.927,101.246,105.055,2020.0
538,912,AZE,BCA,Azerbaijan,Current account balance,"Current account is all transactions other than those in financial and capital items. The major classifications are goods and services, income and current transfers. The focus of the BOP is on transactions (between an economy and the rest of the world) in goods, services, and income.",U.S. dollars,Billions,"Source: Central Bank Latest actual data: 2020 Notes: Data prior to 2005 cannot be confirmed at this time. BOP Manual used: Balance of Payments and International Investment Position Manual, sixth edition (BPM6) Primary domestic currency: Azerbaijan manat Data last updated: 08/2021",,,,,,,,,,,,,-0.198,-0.16,-0.123,-0.318,-0.823,-0.916,-1.364,-0.6,-0.187,-0.052,-0.768,-2.021,-2.589,0.167,3.708,9.019,16.454,10.173,15.04,17.146,14.916,12.318,10.431,-0.222,-1.363,1.685,6.051,4.365,-0.228,4.114,4.23,3.446,2.901,2.738,2.672,2020.0
539,912,AZE,BCA_NGDPD,Azerbaijan,Current account balance,"Current account is all transactions other than those in financial and capital items. The major classifications are goods and services, income and current transfers. The focus of the BOP is on transactions (between an economy and the rest of the world) in goods, services, and income.",Percent of GDP,,"See notes for:  Gross domestic product, current prices (National currency) Current account balance (U.S. dollars).",,,,,,,,,,,,,-16.598,-12.199,-5.461,-13.165,-25.894,-23.11,-31.883,-13.09,-3.539,-0.945,-12.329,-27.772,-29.824,1.261,17.632,27.256,33.593,22.969,28.423,25.983,21.405,16.61,13.863,-0.438,-3.604,4.071,12.844,9.061,-0.534,7.815,7.73,6.156,5.036,4.597,4.323,2020.0
