,WEO Country Code,ISO,WEO Subject Code,Country,Subject Descriptor,Subject Notes,Units,Scale,Country/Series-specific Notes,1980,1981,1982,1983,1984,1985,1986,1987,1988,1989,1990,1991,1992,1993,1994,1995,1996,1997,1998,1999,2000,2001,2002,2003,2004,2005,2006,2007,2008,2009,2010,2011,2012,2013,2014,2015,2016,2017,2018,2019,2020,2021,2022,2023,2024,2025,2026,Estimates Start After
2250,248,ECU,NGDP_R,Ecuador,"Gross domestic product, constant prices","Expressed in billions of national currency units; the base year is country-specific. Expenditure-based GDP is total final expenditures at purchasers' prices (including the f.o.b. value of exports of goods and services), less the f.o.b. value of imports of goods and services. [SNA 1993]",National currency,Billions,Source: Central Bank Latest actual data: 2020 Notes: The national accounts have been updated from 2002 onwards. Prior to 2002 the data are adjusted to produce smooth series with the use of splicing technique. These estimates continue to serve as proxies for historical series when complete information is unavailable. National accounts manual used: System of National Accounts (SNA) 2008 GDP valuation: Market prices Start/end months of reporting year: January/December Base year: 2007 Chain-weighted: No Primary domestic currency: US dollar Data last updated: 09/2021,24.536,25.493,25.799,25.077,26.13,27.28,28.124,26.444,29.217,29.3,30.181,31.725,32.871,33.529,34.956,35.744,36.363,37.936,39.176,37.319,37.726,39.241,40.849,41.961,45.407,47.809,49.915,51.008,54.25,54.558,56.481,60.925,64.362,67.546,70.105,70.175,69.314,70.956,71.871,71.879,66.308,68.162,70.552,72.334,74.211,76.254,78.353,2020.0
2251,248,ECU,NGDP_RPCH,Ecuador,"Gross domestic product, constant prices","Annual percentages of constant price GDP are year-on-year changes; the base year is country-specific. Expenditure-based GDP is total final expenditures at purchasers' prices (including the f.o.b. value of exports of goods and services), less the f.o.b. value of imports of goods and services. [SNA 1993]",Percent change,,"See notes for:  Gross domestic product, constant prices (National currency).",4.9,3.9,1.2,-2.8,4.2,4.4,3.094,-5.972,10.486,0.285,3.008,5.113,3.614,2.0,4.258,2.253,1.732,4.328,3.267,-4.739,1.092,4.016,4.097,2.723,8.211,5.291,4.404,2.19,6.357,0.566,3.525,7.868,5.642,4.947,3.789,0.099,-1.226,2.368,1.289,0.012,-7.75,2.796,3.506,2.526,2.595,2.752,2.753,2020.0
2252,248,ECU,NGDP,Ecuador,"Gross domestic product, current prices","Expressed in billions of national currency units. Expenditure-based GDP is total final expenditures at purchasers' prices (including the f.o.b. value of exports of goods and services), less the f.o.b. value of imports of goods and services. [SNA 1993]",National currency,Billions,Source: Central Bank Latest actual data: 2020 Notes: The national accounts have been updated from 2002 onwards. Prior to 2002 the data are adjusted to produce smooth series with the use of splicing technique. These estimates continue to serve as proxies for historical series when complete information is unavailable. National accounts manual used: System of National Accounts (SNA) 2008 GDP valuation: Market prices Start/end months of reporting year: January/December Base year: 2007 Chain-weighted: No Primary domestic currency: US dollar Data last updated: 09/2021,16.84,17.243,17.214,15.129,16.101,18.83,13.816,12.91,12.277,12.049,12.236,13.73,15.012,17.537,21.147,22.968,24.035,27.009,27.474,19.74,18.319,24.468,28.549,32.433,36.592,41.507,46.802,51.008,61.763,62.52,69.555,79.277,87.925,95.13,101.726,99.29,99.938,104.296,107.562,108.108,98.808,104.483,109.975,114.076,118.502,123.202,128.089,2020.0
2253,248,ECU,NGDPD,Ecuador,"Gross domestic product, current prices","Values are based upon GDP in national currency converted to U.S. dollars using market exchange rates (yearly average). Exchange rate projections are provided by country economists for the group of other emerging market and developing countries. Exchanges rates for advanced economies are established in the WEO assumptions for each WEO exercise. Expenditure-based GDP is total final expenditures at purchasers' prices (including the f.o.b. value of exports of goods and services), less the f.o.b. value of imports of goods and services. [SNA 1993]",U.S. dollars,Billions,"See notes for:  Gross domestic product, current prices (National currency).",16.84,17.243,17.214,15.129,16.101,18.83,13.816,12.91,12.277,12.049,12.236,13.73,15.012,17.537,21.147,22.968,24.035,27.009,27.474,19.74,18.319,24.468,28.549,32.433,36.592,41.507,46.802,51.008,61.763,62.52,69.555,79.277,87.925,95.13,101.726,99.29,99.938,104.296,107.562,108.108,98.808,104.483,109.975,114.076,118.502,123.202,128.089,2020.0
2254,248,ECU,PPPGDP,Ecuador,"Gross domestic product, current prices","These data form the basis for the country weights used to generate the World Economic Outlook country group composites for the domestic economy.   The IMF is not a primary source for purchasing power parity (PPP) data. WEO weights have been created from primary sources and are used solely for purposes of generating country group composites. For primary source information, please refer to one of the following sources: the Organization for Economic Cooperation and Development, the World Bank, or the Penn World Tables.   For further information see Box 1.1 in the October 2020 World Economic Outlook, ""Revised Purchasing Power Parity Weights"" in the July 2014 WEO Update, Box A2 in the April 2004 World Economic Outlook, Box A1 in the May 2000 World Economic Outlook, and Annex IV in the May 1993 World Economic Outlook for summaries of the revised PPP-based weights; and Box 1.2 in the September 2003 World Economic Outlook for a discussion on the measurement of global growth. See also Anne Marie Gulde and Marianne Schulze-Ghattas, Purchasing Power Parity Based Weights for the World Economic Outlook, in Staff Studies for the World Economic Outlook (Washington: IMF, December 1993), pp. 106-23.",Purchasing power parity; international dollars,Billions,"See notes for:  Gross domestic product, current prices (National currency).",26.044,29.62,31.828,32.148,34.707,37.38,39.312,37.879,43.327,45.154,48.253,52.435,55.568,58.023,61.786,64.503,66.821,70.915,74.056,71.54,73.96,78.663,83.162,87.112,96.795,105.113,113.128,118.73,128.699,130.258,136.471,150.267,159.56,175.196,186.847,179.31,181.967,195.011,202.244,205.887,192.219,204.713,217.724,228.534,239.808,251.761,264.052,2020.0
2255,248,ECU,NGDP_D,Ecuador,"Gross domestic product, deflator",The GDP deflator is derived by dividing current price GDP by constant price GDP and is considered to be an alternate measure of inflation. Data are expressed in the base year of each country's national accounts.,Index,,"See notes for:  Gross domestic product, constant prices (National currency) Gross domestic product, current prices (National currency).",68.634,67.638,66.724,60.332,61.619,69.024,49.127,48.82,42.021,41.123,40.541,43.279,45.671,52.305,60.497,64.258,66.098,71.195,70.129,52.895,48.556,62.353,69.889,77.292,80.586,86.818,93.764,100.0,113.847,114.594,123.148,130.122,136.608,140.837,145.105,141.49,144.181,146.987,149.661,150.402,149.013,153.286,155.877,157.706,159.681,161.568,163.477,2020.0
2256,248,ECU,NGDPRPC,Ecuador,"Gross domestic product per capita, constant prices",GDP is expressed in constant national currency per person. Data are derived by dividing constant price GDP by total population.,National currency,Units,"See notes for:  Gross domestic product, constant prices (National currency) Population (Persons).",3055.52,3086.11,3036.95,2871.62,2912.64,2961.73,2975.8,2728.7,2938.24,2875.59,2893.66,2972.88,3012.25,3007.05,3071.77,3081.91,3081.98,3164.89,3219.57,3022.51,3010.6,3062.26,3119.79,3150.35,3350.59,3484.32,3574.37,3588.31,3748.42,3701.72,3762.34,3990.79,4146.8,4281.92,4374.08,4310.79,4193.55,4229.35,4221.86,4162.57,3786.75,3838.68,3918.22,3961.51,4007.99,4061.23,4115.19,2020.0
2257,248,ECU,NGDPRPPPPC,Ecuador,"Gross domestic product per capita, constant prices",GDP is expressed in constant international dollars per person. Data are derived by dividing constant price purchasing-power parity (PPP) GDP by total population.,Purchasing power parity; 2017 international dollar,Units,"See notes for:  Gross domestic product, constant prices (National currency) Population (Persons).",8397.63,8481.71,8346.59,7892.21,8004.93,8139.87,8178.53,7499.4,8075.31,7903.12,7952.79,8170.49,8278.71,8264.42,8442.29,8470.16,8470.36,8698.2,8848.5,8306.91,8274.16,8416.16,8574.25,8658.24,9208.57,9576.1,9823.6,9861.92,10301.95,10173.61,10340.2,10968.06,11396.85,11768.18,12021.48,11847.54,11525.33,11623.72,11603.14,11440.19,10407.31,10550.02,10768.63,10887.6,11015.33,11161.67,11309.97,2020.0
2258,248,ECU,NGDPPC,Ecuador,"Gross domestic product per capita, current prices",GDP is expressed in current national currency per person. Data are derived by dividing current price GDP by total population.,National currency,Units,"See notes for:  Gross domestic product, current prices (National currency) Population (Persons).",2097.14,2087.38,2026.38,1732.5,1794.73,2044.31,1461.92,1332.15,1234.67,1182.53,1173.13,1286.62,1375.71,1572.84,1858.32,1980.37,2037.13,2253.23,2257.86,1598.77,1461.84,1909.42,2180.39,2434.98,2700.12,3025.01,3351.48,3588.31,4267.47,4241.94,4633.25,5192.88,5664.89,6030.5,6347.0,6099.35,6046.3,6216.61,6318.48,6260.6,5642.74,5884.15,6107.6,6247.54,6400.01,6561.66,6727.38,2020.0
2259,248,ECU,NGDPDPC,Ecuador,"Gross domestic product per capita, current prices",GDP is expressed in current U.S. dollars per person. Data are derived by first converting GDP in national currency to U.S. dollars and then dividing it by total population.,U.S. dollars,Units,"See notes for:  Gross domestic product, current prices (National currency) Population (Persons).",2097.14,2087.38,2026.38,1732.5,1794.73,2044.31,1461.92,1332.15,1234.67,1182.53,1173.13,1286.62,1375.71,1572.84,1858.32,1980.37,2037.13,2253.23,2257.86,1598.77,1461.84,1909.42,2180.39,2434.98,2700.12,3025.01,3351.48,3588.31,4267.47,4241.94,4633.25,5192.88,5664.89,6030.5,6347.0,6099.35,6046.3,6216.61,6318.48,6260.6,5642.74,5884.15,6107.6,6247.54,6400.01,6561.66,6727.38,2020.0
2260,248,ECU,PPPPC,Ecuador,"Gross domestic product per capita, current prices","Expressed in GDP in PPP dollars per person. Data are derived by dividing GDP in PPP dollars by total population. These data form the basis for the country weights used to generate the World Economic Outlook country group composites for the domestic economy.   The IMF is not a primary source for purchasing power parity (PPP) data. WEO weights have been created from primary sources and are used solely for purposes of generating country group composites. For primary source information, please refer to one of the following sources: the Organization for Economic Cooperation and Development, the World Bank, or the Penn World Tables.  For further information see Box 1.1 in the October 2020 World Economic Outlook, ""Revised Purchasing Power Parity Weights"" in the July 2014 WEO Update, Box A2 in the April 2004 World Economic Outlook, Box A1 in the May 2000 World Economic Outlook, and Annex IV in the May 1993 World Economic Outlook for summaries of the revised PPP-based weights; and Box 1.2 in the September 2003 World Economic Outlook for a discussion on the measurement of global growth. See also Anne Marie Gulde and Marianne Schulze-Ghattas, Purchasing Power Parity Based Weights for the World Economic Outlook, in Staff Studies for the World Economic Outlook (Washington: IMF, December 1993), pp. 106-23.",Purchasing power parity; international dollars,Units,"See notes for:  Gross domestic product, current prices (National currency) Population (Persons).",3243.32,3585.7,3746.61,3681.38,3868.73,4058.33,4159.71,3908.64,4357.21,4431.53,4626.26,4913.65,5092.19,5203.87,5429.42,5561.57,5663.54,5916.16,6086.13,5794.13,5902.03,6138.57,6351.35,6540.15,7142.57,7660.58,8101.05,8352.44,8892.44,8837.94,9090.63,9842.96,10280.26,11106.12,11657.9,11014.89,11009.16,11623.72,11880.32,11923.02,10977.26,11528.79,12091.57,12516.05,12951.51,13408.65,13868.35,2020.0
2262,248,ECU,PPPSH,Ecuador,Gross domestic product based on purchasing-power-parity (PPP) share of world total,"Expressed in percent of world GDP in PPP dollars. These data form the basis for the country weights used to generate the World Economic Outlook country group composites for the domestic economy.   The IMF is not a primary source for purchasing power parity (PPP) data. WEO weights have been created from primary sources and are used solely for purposes of generating country group composites. For primary source information, please refer to one of the following sources: the Organization for Economic Cooperation and Development, the World Bank, or the Penn World Tables.  For further information see Box 1.1 in the October 2020 World Economic Outlook, ""Revised Purchasing Power Parity Weights"" in the July 2014 WEO Update, Box A2 in the April 2004 World Economic Outlook, Box A1 in the May 2000 World Economic Outlook, and Annex IV in the May 1993 World Economic Outlook for summaries of the revised PPP-based weights; and Box 1.2 in the September 2003 World Economic Outlook for a discussion on the measurement of global growth. See also Anne Marie Gulde and Marianne Schulze-Ghattas, Purchasing Power Parity Based Weights for the World Economic Outlook, in Staff Studies for the World Economic Outlook (Washington: IMF, December 1993), pp. 106-23.",Percent,,"See notes for:  Gross domestic product, current prices (National currency).",0.195,0.199,0.201,0.19,0.19,0.192,0.191,0.173,0.183,0.177,0.175,0.18,0.168,0.168,0.17,0.168,0.164,0.165,0.165,0.152,0.147,0.149,0.151,0.149,0.153,0.154,0.153,0.148,0.153,0.155,0.152,0.158,0.159,0.166,0.171,0.161,0.157,0.16,0.157,0.153,0.146,0.142,0.14,0.138,0.137,0.137,0.136,2020.0
2263,248,ECU,PPPEX,Ecuador,Implied PPP conversion rate,"Expressed in national currency per current international dollar. These data form the basis for the country weights used to generate the World Economic Outlook country group composites for the domestic economy.   The IMF is not a primary source for purchasing power parity (PPP) data. WEO weights have been created from primary sources and are used solely for purposes of generating country group composites. For primary source information, please refer to one of the following sources: the Organization for Economic Cooperation and Development, the World Bank, or the Penn World Tables.  For further information see Box 1.1 in the October 2020 World Economic Outlook, ""Revised Purchasing Power Parity Weights"" in the July 2014 WEO Update, Box A2 in the April 2004 World Economic Outlook, Box A1 in the May 2000 World Economic Outlook, and Annex IV in the May 1993 World Economic Outlook for summaries of the revised PPP-based weights; and Box 1.2 in the September 2003 World Economic Outlook for a discussion on the measurement of global growth. See also Anne Marie Gulde and Marianne Schulze-Ghattas, Purchasing Power Parity Based Weights for the World Economic Outlook, in Staff Studies for the World Economic Outlook (Washington: IMF, December 1993), pp. 106-23.",National currency per current international dollar,,"See notes for:  Gross domestic product, current prices (National currency).",0.647,0.582,0.541,0.471,0.464,0.504,0.351,0.341,0.283,0.267,0.254,0.262,0.27,0.302,0.342,0.356,0.36,0.381,0.371,0.276,0.248,0.311,0.343,0.372,0.378,0.395,0.414,0.43,0.48,0.48,0.51,0.528,0.551,0.543,0.544,0.554,0.549,0.535,0.532,0.525,0.514,0.51,0.505,0.499,0.494,0.489,0.485,2020.0
2264,248,ECU,NID_NGDP,Ecuador,Total investment,Expressed as a ratio of total investment in current local currency and GDP in current local currency. Investment or gross capital formation is measured by the total value of the gross fixed capital formation and changes in inventories and acquisitions less disposals of valuables for a unit or sector. [SNA 1993],Percent of GDP,,Source: Central Bank Latest actual data: 2020 Notes: The national accounts have been updated from 2002 onwards. Prior to 2002 the data are adjusted to produce smooth series with the use of splicing technique. These estimates continue to serve as proxies for historical series when complete information is unavailable. National accounts manual used: System of National Accounts (SNA) 2008 GDP valuation: Market prices Start/end months of reporting year: January/December Base year: 2007 Chain-weighted: No Primary domestic currency: US dollar Data last updated: 09/2021,20.217,19.762,22.503,14.413,14.541,16.007,17.267,18.408,17.631,16.993,14.614,18.416,17.702,18.861,18.325,17.226,15.778,18.014,21.925,15.952,21.279,22.349,23.702,19.59,20.199,21.637,22.46,22.705,26.388,25.639,28.037,28.142,27.796,28.467,28.314,26.87,24.979,26.28,26.748,25.906,23.117,26.44,27.289,27.399,27.62,27.406,27.72,2020.0
2265,248,ECU,NGSD_NGDP,Ecuador,Gross national savings,"Expressed as a ratio of gross national savings in current local currency and GDP in current local currency. Gross national saving is gross disposable income less final consumption expenditure after taking account of an adjustment for pension funds. [SNA 1993] For many countries, the estimates of national saving are built up from national accounts data on gross domestic investment and from balance of payments-based data on net foreign investment.",Percent of GDP,,Source: Central Bank Latest actual data: 2020 Notes: The national accounts have been updated from 2002 onwards. Prior to 2002 the data are adjusted to produce smooth series with the use of splicing technique. These estimates continue to serve as proxies for historical series when complete information is unavailable. National accounts manual used: System of National Accounts (SNA) 2008 GDP valuation: Market prices Start/end months of reporting year: January/December Base year: 2007 Chain-weighted: No Primary domestic currency: US dollar Data last updated: 09/2021,17.175,14.744,16.512,14.092,13.445,17.204,14.0,10.483,13.77,12.794,12.194,13.872,16.941,15.416,15.055,12.888,15.825,15.543,13.409,19.963,27.352,20.097,19.432,18.397,18.889,22.779,26.177,26.403,29.252,26.14,25.762,27.638,27.629,27.486,27.657,24.633,26.089,26.13,25.509,25.849,25.616,28.149,29.023,29.346,29.576,29.539,29.752,2020.0
2266,248,ECU,PCPI,Ecuador,"Inflation, average consumer prices","Expressed in averages for the year, not end-of-period data. A consumer price index (CPI) measures changes in the prices of goods and services that households consume. Such changes affect the real purchasing power of consumers' incomes and their welfare. As the prices of different goods and services do not all change at the same rate, a price index can only reflect their average movement. A price index is typically assigned a value of unity, or 100, in some reference period and the values of the index for other periods of time are intended to indicate the average proportionate, or percentage, change in prices from this price reference period. Price indices can also be used to measure differences in price levels between different cities, regions or countries at the same point in time. [CPI Manual 2004, Introduction] For euro countries, consumer prices are calculated based on harmonized prices. For more information see http://epp.eurostat.ec.europa.eu/cache/ITY_OFFPUB/KS-BE-04-001/EN/KS-BE-04-001-EN.PDF.]",Index,,"Source: National Statistics Office. Source: INEC and Central Bank Latest actual data: 2020 Notes: The price Ecuador receives for its oil exports is subject to effects of marketing and discounts for the quality of the Ecuadorian mix. These effects are variable over time. Therefore, while the price of Ecuadorian oil moves in tandem with world prices, deviations are to be expected in projection. Harmonized prices: No Frequency of source data: Monthly Base year: 2014. The authorities introduced the series with base in 2014 in 2015, and presents data for this year onwards. Prior years are obtained by splicing the series backwards with the old CPI series. As a result the base year is different from100. Primary domestic currency: US dollar Data last updated: 09/2021",0.051,0.059,0.069,0.102,0.134,0.172,0.211,0.273,0.432,0.76,1.128,1.679,2.591,3.757,4.788,5.884,7.32,9.56,13.011,19.803,38.833,53.463,60.138,64.907,66.686,68.133,70.38,71.982,78.029,82.055,84.972,88.774,93.303,95.842,99.282,103.22,105.004,105.442,105.206,105.486,105.129,105.121,107.368,109.329,110.969,112.412,113.536,2020.0
2267,248,ECU,PCPIPCH,Ecuador,"Inflation, average consumer prices",Annual percentages of average consumer prices are year-on-year changes.,Percent change,,"See notes for:  Inflation, average consumer prices (Index).",13.049,16.387,16.258,48.434,31.23,27.983,23.03,29.504,58.216,75.648,48.519,48.804,54.341,45.0,27.443,22.886,24.4,30.6,36.1,52.2,96.1,37.674,12.485,7.929,2.741,2.17,3.299,2.276,8.4,5.16,3.554,4.475,5.102,2.722,3.589,3.966,1.728,0.417,-0.224,0.266,-0.339,-0.007,2.138,1.826,1.5,1.3,1.0,2020.0
2268,248,ECU,PCPIE,Ecuador,"Inflation, end of period consumer prices","Expressed in end of the period, not annual average data. A consumer price index (CPI) measures changes in the prices of goods and services that households consume. Such changes affect the real purchasing power of consumers' incomes and their welfare. As the prices of different goods and services do not all change at the same rate, a price index can only reflect their average movement. A price index is typically assigned a value of unity, or 100, in some reference period and the values of the index for other periods of time are intended to indicate the average proportionate, or percentage, change in prices from this price reference period. Price indices can also be used to measure differences in price levels between different cities, regions or countries at the same point in time. [CPI Manual 2004, Introduction] For euro countries, consumer prices are calculated based on harmonized prices. For more information see http://epp.eurostat.ec.europa.eu/cache/ITY_OFFPUB/KS-BE-04-001/EN/KS-BE-04-001-EN.PDF.",Index,,"Source: National Statistics Office. Source: INEC and Central Bank Latest actual data: 2020 Notes: The price Ecuador receives for its oil exports is subject to effects of marketing and discounts for the quality of the Ecuadorian mix. These effects are variable over time. Therefore, while the price of Ecuadorian oil moves in tandem with world prices, deviations are to be expected in projection. Harmonized prices: No Frequency of source data: Monthly Base year: 2014. The authorities introduced the series with base in 2014 in 2015, and presents data for this year onwards. Prior years are obtained by splicing the series backwards with the old CPI series. As a result the base year is different from100. Primary domestic currency: US dollar Data last updated: 09/2021",0.053,0.062,0.077,0.118,0.147,0.183,0.233,0.308,0.573,0.883,1.32,1.967,3.152,4.16,5.217,6.405,8.039,10.508,15.068,24.214,46.25,56.62,61.92,65.68,66.96,69.057,71.038,73.396,79.878,83.322,86.095,90.752,94.531,97.084,100.644,104.046,105.211,105.004,105.283,105.215,104.233,106.132,108.422,110.185,111.618,112.845,113.974,2020.0
2269,248,ECU,PCPIEPCH,Ecuador,"Inflation, end of period consumer prices",Annual percentages of end of period consumer prices are year-on-year changes.,Percent change,,"See notes for:  Inflation, end of period consumer prices (Index).",13.53,17.3,24.4,52.5,25.1,24.4,27.3,32.5,85.7,54.2,49.5,49.0,60.2,32.0,25.383,22.774,25.527,30.7,43.4,60.7,91.005,22.422,9.361,6.072,1.949,3.132,2.869,3.319,8.832,4.312,3.328,5.409,4.164,2.701,3.667,3.38,1.12,-0.197,0.266,-0.065,-0.933,1.822,2.157,1.626,1.3,1.1,1.0,2020.0
2271,248,ECU,TM_RPCH,Ecuador,Volume of imports of goods and services,"Percent change of volume of imports refers to the aggregate change in the quantities of total imports whose characteristics are unchanged. The goods and services and their prices are held constant, therefore changes are due to changes in quantities only. [Export and Import Price Index Manual: Theory and Practice, Glossary]",Percent change,,Source: Central Bank Latest actual data: 2020 Base year: 2014 Valuation of exports: Free on board (FOB) Valuation of imports: Free on board (FOB) Primary domestic currency: US dollar Data last updated: 09/2021,-1.061,5.244,-4.988,-33.125,9.195,5.857,-7.484,9.719,-23.134,3.39,-0.839,16.0,1.0,0.8,14.636,7.949,-12.597,20.513,6.532,-31.595,12.822,25.722,19.015,-4.06,10.877,13.162,7.879,6.118,13.43,-9.214,14.293,3.156,0.385,7.604,4.346,-7.82,-7.829,14.807,3.617,0.772,-14.151,13.521,5.372,1.905,2.468,1.831,2.453,2020.0
2272,248,ECU,TMG_RPCH,Ecuador,Volume of Imports of goods,"Percent change of volume of imports of goods refers to the aggregate change in the quantities of imports of goods whose characteristics are unchanged. The goods and their prices are held constant, therefore changes are due to changes in quantities only. [Export and Import Price Index Manual: Theory and Practice, Glossary]",Percent change,,Source: Central Bank Latest actual data: 2020 Base year: 2014 Valuation of exports: Free on board (FOB) Valuation of imports: Free on board (FOB) Primary domestic currency: US dollar Data last updated: 09/2021,-6.343,6.202,-4.486,-33.245,11.225,5.889,-9.235,20.703,-27.399,5.141,-1.442,28.659,-7.932,20.722,29.253,16.223,5.454,-13.509,-8.869,-13.172,19.133,21.488,-2.691,-3.714,8.988,14.18,7.948,5.938,13.212,-8.549,14.428,3.071,0.406,7.715,4.924,-7.503,-10.493,17.12,3.587,0.366,-11.335,12.207,5.288,1.699,2.559,1.858,2.361,2020.0
