,WEO Country Code,ISO,WEO Subject Code,Country,Subject Descriptor,Subject Notes,Units,Scale,Country/Series-specific Notes,1980,1981,1982,1983,1984,1985,1986,1987,1988,1989,1990,1991,1992,1993,1994,1995,1996,1997,1998,1999,2000,2001,2002,2003,2004,2005,2006,2007,2008,2009,2010,2011,2012,2013,2014,2015,2016,2017,2018,2019,2020,2021,2022,2023,2024,2025,2026,Estimates Start After
2273,248,ECU,TX_RPCH,Ecuador,Volume of exports of goods and services,"Percent change of volume of exports refers to the aggregate change in the quantities of total exports whose characteristics are unchanged. The goods and services and their prices are held constant, therefore changes are due to changes in quantities only. [Export and Import Price Index Manual: Theory and Practice, Glossary]",Percent change,,Source: Central Bank Latest actual data: 2020 Base year: 2014 Valuation of exports: Free on board (FOB) Valuation of imports: Free on board (FOB) Primary domestic currency: US dollar Data last updated: 09/2021,-1.855,6.362,-3.783,10.062,3.346,13.813,3.963,-15.791,22.953,-3.83,3.104,10.5,9.6,4.2,11.684,11.26,-2.123,6.986,-4.737,7.631,2.536,-1.587,0.624,7.21,17.178,7.521,5.738,-2.009,3.374,-4.109,1.112,4.451,4.997,4.57,6.178,-0.435,4.693,1.695,0.744,7.487,0.236,-0.832,5.422,5.083,3.557,3.757,2.767,2020.0
2274,248,ECU,TXG_RPCH,Ecuador,Volume of exports of goods,"Percent change of volume of exports of goods refers to the aggregate change in the quantities of exports of goods whose characteristics are unchanged. The goods and their prices are held constant, therefore changes are due to changes in quantities only. [Export and Import Price Index Manual: Theory and Practice, Glossary]",Percent change,,Source: Central Bank Latest actual data: 2020 Base year: 2014 Valuation of exports: Free on board (FOB) Valuation of imports: Free on board (FOB) Primary domestic currency: US dollar Data last updated: 09/2021,-5.449,6.82,-1.63,15.8,7.066,10.309,2.817,-17.48,27.88,-6.546,4.189,14.298,6.342,13.371,13.783,11.357,-0.783,4.546,-5.339,1.295,2.923,1.052,-1.939,10.174,15.364,8.27,6.153,-2.988,2.819,-3.484,0.724,4.55,4.759,4.128,5.779,-0.299,4.256,0.853,-0.118,8.013,5.082,-1.617,5.342,3.997,2.604,2.976,2.867,2020.0
2277,248,ECU,LP,Ecuador,Population,"For census purposes, the total population of the country consists of all persons falling within the scope of the census. In the broadest sense, the total may comprise either all usual residents of the country or all persons present in the country at the time of the census. [Principles and Recommendations for Population and Housing Censuses, Revision 1, paragraph 2.42]",Persons,Millions,Source: National Statistics Office Latest actual data: 2020 Primary domestic currency: US dollar Data last updated: 09/2021,8.03,8.261,8.495,8.733,8.971,9.211,9.451,9.691,9.944,10.189,10.43,10.671,10.912,11.15,11.38,11.598,11.798,11.987,12.168,12.347,12.531,12.815,13.094,13.32,13.552,13.721,13.965,14.215,14.473,14.738,15.012,15.266,15.521,15.775,16.027,16.279,16.529,16.777,17.023,17.268,17.511,17.757,18.006,18.259,18.516,18.776,19.04,2020.0
2292,248,ECU,NGDP_FY,Ecuador,"Gross domestic product corresponding to fiscal year, current prices","Gross domestic product corresponding to fiscal year is the country's GDP based on the same period during the year as their fiscal data. In the case of countries whose fiscal data are based on a fiscal calendar (e.g., July to June), this series would be the country's GDP over that same period. For countries whose fiscal data are based on a calendar year (i.e., January to December), this series will be the same as their GDP in current prices.",National currency,Billions,"Source: Source: Central Bank and Ministry of Finance Latest actual data: 2020 Notes: The fiscal data for Ecuador reflects net lending/borrowing for the nonfinancial public sector. Ecuadorian authorities, with the technical support from the IMF, are undertaking revisions of the historical fiscal data for the net lending/borrowing of the nonfinancial public sector over the period 2012-2017, with the view of correcting recently identified statistical errors in data compilation at the subnational level and the consistency between above the line and financing data by subsectors. Fiscal assumptions: All the fiscal series are based on 1986 methodology. The authorities have adopted a non-standard accounting methodology for budgetary purposes. Staff does not use this methodology. Start/end months of reporting year: January/December GFS Manual used: Government Finance Statistics Manual (GFSM) 1986 Basis of recording: Mixed General government includes: Central Government; State Government; Local Government; Social Security Funds; Nonfinancial Public Corporation; Valuation of public debt: Nominal value. In late 2016, the authorities changed the definition of debt to a consolidated basis; both the historic (since 2001) and projection numbers are now presented on a consolidated basis. The IMF's definition of debt includes advanced oil sales, treasury certificates, central bank loans, and domestic arrears that are excluded from the official debt definition. The debt limit applies only to the official debt definition. Instruments included in gross and net debt: Securities Other than Shares; Loans; Other;. Other includes advanced oil sales, treasury certificates, central bank loans, and domestic arrears that are excluded from the official debt definition. Primary domestic currency: US dollar Data last updated: 09/2021",16.84,17.243,17.214,15.129,16.101,18.83,13.816,12.91,12.277,12.049,12.236,13.73,15.012,17.537,21.147,22.968,24.035,27.009,27.474,19.74,18.319,24.468,28.549,32.433,36.592,41.507,46.802,51.008,61.763,62.52,69.555,79.277,87.925,95.13,101.726,99.29,99.938,104.296,107.562,108.108,98.808,104.483,109.975,114.076,118.502,123.202,128.089,2020.0
2293,248,ECU,BCA,Ecuador,Current account balance,"Current account is all transactions other than those in financial and capital items. The major classifications are goods and services, income and current transfers. The focus of the BOP is on transactions (between an economy and the rest of the world) in goods, services, and income.",U.S. dollars,Billions,"Source: Central Bank Latest actual data: 2020 BOP Manual used: Balance of Payments and International Investment Position Manual, sixth edition (BPM6) Primary domestic currency: US dollar Data last updated: 09/2021",-0.642,-0.998,-1.182,-0.115,-0.273,0.076,-0.582,-1.187,-0.68,-0.715,-0.36,-0.708,-0.122,-0.849,-0.898,-1.0,-0.055,-0.457,-2.099,0.918,1.113,-0.551,-1.219,-0.387,-0.479,0.474,1.74,1.886,1.769,0.313,-1.582,-0.4,-0.146,-0.933,-0.669,-2.221,1.109,-0.157,-1.333,-0.061,2.469,1.786,1.906,2.222,2.318,2.628,2.602,2020.0
2294,248,ECU,BCA_NGDPD,Ecuador,Current account balance,"Current account is all transactions other than those in financial and capital items. The major classifications are goods and services, income and current transfers. The focus of the BOP is on transactions (between an economy and the rest of the world) in goods, services, and income.",Percent of GDP,,"See notes for:  Gross domestic product, current prices (National currency) Current account balance (U.S. dollars).",-3.81,-5.788,-6.866,-0.76,-1.696,0.404,-4.212,-9.194,-5.539,-5.934,-2.942,-5.157,-0.813,-4.841,-4.248,-4.354,-0.228,-1.691,-7.638,4.651,6.074,-2.253,-4.27,-1.193,-1.31,1.142,3.718,3.698,2.865,0.501,-2.275,-0.505,-0.167,-0.981,-0.657,-2.237,1.11,-0.151,-1.239,-0.057,2.499,1.709,1.733,1.948,1.956,2.133,2.032,2020.0
