,WEO Country Code,ISO,WEO Subject Code,Country,Subject Descriptor,Subject Notes,Units,Scale,Country/Series-specific Notes,1980,1981,1982,1983,1984,1985,1986,1987,1988,1989,1990,1991,1992,1993,1994,1995,1996,1997,1998,1999,2000,2001,2002,2003,2004,2005,2006,2007,2008,2009,2010,2011,2012,2013,2014,2015,2016,2017,2018,2019,2020,2021,2022,2023,2024,2025,2026,Estimates Start After
2904,134,DEU,TXG_RPCH,Germany,Volume of exports of goods,"Percent change of volume of exports of goods refers to the aggregate change in the quantities of exports of goods whose characteristics are unchanged. The goods and their prices are held constant, therefore changes are due to changes in quantities only. [Export and Import Price Index Manual: Theory and Practice, Glossary]",Percent change,,"Source: Central Bank Latest actual data: 2020 Base year: 2000 Methodology used to derive volumes: Weighted average of volume changes Formula used to derive volumes: Other Chain-weighted: Yes, from 1991 Trade System: General trade Valuation of exports: Free on board (FOB) Valuation of imports: Cost, insurance, freight (CIF) Primary domestic currency: Euro Data last updated: 09/2021",5.334,7.236,3.731,-0.487,9.153,7.636,-0.817,1.114,6.428,10.375,7.523,16.364,-1.042,-6.585,9.452,7.008,6.006,11.79,7.106,5.496,14.386,6.515,3.094,2.244,9.682,7.408,12.847,9.809,0.667,-16.723,15.906,9.081,3.209,0.575,4.064,3.924,1.922,5.829,2.154,0.507,-8.992,11.516,5.893,4.305,3.55,2.983,2.883,2020.0
2905,134,DEU,LUR,Germany,Unemployment rate,"Unemployment rate can be defined by either the national definition, the ILO harmonized definition, or the OECD harmonized definition. The OECD harmonized unemployment rate gives the number of unemployed persons as a percentage of the labor force (the total number of people employed plus unemployed). [OECD Main Economic Indicators, OECD, monthly] As defined by the International Labour Organization, unemployed workers are those who are currently not working but are willing and able to work for pay, currently available to work, and have actively searched for work. [ILO, http://www.ilo.org/public/english/bureau/stat/res/index.htm]",Percent of total labor force,,Source: National Statistics Office Latest actual data: 2020 Notes: Data until 1990 refers to German federation only (West Germany). Data from 1991 refer to United Germany. Employment type: Harmonized ILO definition Primary domestic currency: Euro Data last updated: 09/2021,3.359,4.831,6.734,8.099,8.058,8.124,7.834,7.843,7.735,6.79,6.155,5.47,6.592,7.775,8.425,8.233,8.908,9.658,9.383,8.558,7.95,7.8,8.6,9.708,10.333,11.008,10.042,8.542,7.425,7.642,6.967,5.833,5.383,5.242,4.992,4.633,4.133,3.758,3.4,3.15,3.833,3.696,3.56,3.459,3.409,3.391,3.384,2020.0
2906,134,DEU,LE,Germany,Employment,"Employment can be defined by either the national definition, the ILO harmonized definition, or the OECD harmonized definition. Persons who during a specified brief period such as one week or one day, (a) performed some work for wage or salary in cash or in kind, (b) had a formal attachment to their job but were temporarily not at work during the reference period, (c) performed some work for profit or family gain in cash or in kind, (d) were with an enterprise such as a business, farm or service but who were temporarily not at work during the reference period for any specific reason. [Current International Recommendations on Labour Statistics, 1988 Edition, ILO, Geneva, page 47]",Persons,Millions,Source: National Statistics Office Latest actual data: 2020 Notes: Data until 1990 refers to German federation only (West Germany). Data from 1991 refer to United Germany. Employment type: Harmonized ILO definition Primary domestic currency: Euro Data last updated: 09/2021,34.528,34.491,34.08,33.595,33.649,33.899,34.369,34.617,34.887,35.395,36.446,37.078,36.564,36.172,35.905,35.762,35.523,35.302,35.551,35.932,36.065,36.186,35.873,35.506,35.428,35.673,36.378,37.172,37.644,37.487,37.756,38.653,39.039,39.406,39.766,40.076,41.065,41.486,41.76,42.192,41.742,41.411,41.919,,,,,2020.0
2907,134,DEU,LP,Germany,Population,"For census purposes, the total population of the country consists of all persons falling within the scope of the census. In the broadest sense, the total may comprise either all usual residents of the country or all persons present in the country at the time of the census. [Principles and Recommendations for Population and Housing Censuses, Revision 1, paragraph 2.42]",Persons,Millions,Source: National Statistics Office Latest actual data: 2020 Notes: Data until 1990 refers to German federation only (West Germany). Data from 1991 refer to United Germany. Primary domestic currency: Euro Data last updated: 09/2021,76.843,76.988,76.933,76.664,76.355,76.166,76.219,76.233,76.697,77.463,78.949,79.973,80.5,80.946,81.147,81.308,81.466,81.51,81.446,81.423,81.457,81.518,81.579,81.549,81.456,81.337,81.174,80.993,80.764,80.483,80.285,80.276,80.426,80.646,80.983,81.687,82.349,82.657,82.906,83.093,83.161,83.291,83.387,83.45,83.478,83.47,83.427,2020.0
2922,134,DEU,NGDP_FY,Germany,"Gross domestic product corresponding to fiscal year, current prices","Gross domestic product corresponding to fiscal year is the country's GDP based on the same period during the year as their fiscal data. In the case of countries whose fiscal data are based on a fiscal calendar (e.g., July to June), this series would be the country's GDP over that same period. For countries whose fiscal data are based on a calendar year (i.e., January to December), this series will be the same as their GDP in current prices.",National currency,Billions,"Source: National Statistics Office. Data of general government gross debt comes from EUROSTAT Latest actual data: 2020 Fiscal assumptions: The IMF staff's projections for 2021 and beyond are based on the 2021 budgets, the 2022 draft budget plan, and data updates from the national statistical agency (Destatis) and Ministry of Finance, adjusted for the differences in the IMF staff's macroeconomic framework and assumptions concerning revenue elasticities. The estimate of gross debt includes portfolios of impaired assets and noncore business transferred to institutions that are winding up as well as other financial sector and EU support operations. Start/end months of reporting year: January/December GFS Manual used: European System of Accounts (ESA) 2010 Basis of recording: Accrual General government includes: Central Government; State Government; Local Government; Social Security Funds;. other refers to special funds Valuation of public debt: Face value Instruments included in gross and net debt: Currency and Deposits; Securities Other than Shares; Loans Primary domestic currency: Euro Data last updated: 09/2021",792.177,826.898,859.552,901.3,945.528,987.172,1043.9,1078.11,1135.15,1207.28,1317.44,1585.8,1702.06,1750.89,1829.55,1894.61,1921.38,1961.15,2014.42,2059.48,2109.09,2172.54,2198.12,2211.57,2262.52,2288.31,2385.08,2499.55,2546.49,2445.73,2564.4,2693.56,2745.31,2811.35,2927.43,3026.18,3134.74,3267.16,3367.86,3473.35,3367.56,3541.84,3773.97,3896.69,4020.35,4143.68,4278.8,2020.0
2923,134,DEU,BCA,Germany,Current account balance,"Current account is all transactions other than those in financial and capital items. The major classifications are goods and services, income and current transfers. The focus of the BOP is on transactions (between an economy and the rest of the world) in goods, services, and income.",U.S. dollars,Billions,"Source: Central Bank. Additional source: IMF Statistics Department Latest actual data: 2020 Notes: Data until 1990 refers to German federation only (West Germany). Data from 1991 refer to United Germany. BOP Manual used: Balance of Payments and International Investment Position Manual, sixth edition (BPM6) Primary domestic currency: Euro Data last updated: 09/2021",-15.215,-4.911,6.007,4.611,9.28,17.594,37.989,43.574,54.677,58.96,50.055,-26.672,-25.281,-21.482,-33.145,-32.238,-16.89,-11.289,-15.932,-31.251,-34.324,-7.161,39.267,35.36,127.156,133.119,172.872,235.055,213.169,198.881,195.436,232.889,251.608,244.845,280.261,288.82,295.118,287.895,312.097,289.558,266.967,287.572,316.691,343.977,350.179,351.779,361.353,2020.0
2924,134,DEU,BCA_NGDPD,Germany,Current account balance,"Current account is all transactions other than those in financial and capital items. The major classifications are goods and services, income and current transfers. The focus of the BOP is on transactions (between an economy and the rest of the world) in goods, services, and income.",Percent of GDP,,"See notes for:  Gross domestic product, current prices (National currency) Current account balance (U.S. dollars).",-1.782,-0.684,0.866,0.666,1.423,2.662,4.024,3.709,4.317,4.689,3.131,-1.422,-1.183,-1.037,-1.5,-1.246,-0.676,-0.51,-0.711,-1.422,-1.761,-0.368,1.891,1.414,4.52,4.673,5.772,6.861,5.692,5.836,5.744,6.213,7.129,6.557,7.204,8.601,8.508,7.803,7.843,7.446,6.946,6.798,6.949,7.205,7.023,6.772,6.684,2020.0
