,WEO Country Code,ISO,WEO Subject Code,Country,Subject Descriptor,Subject Notes,Units,Scale,Country/Series-specific Notes,1980,1981,1982,1983,1984,1985,1986,1987,1988,1989,1990,1991,1992,1993,1994,1995,1996,1997,1998,1999,2000,2001,2002,2003,2004,2005,2006,2007,2008,2009,2010,2011,2012,2013,2014,2015,2016,2017,2018,2019,2020,2021,2022,2023,2024,2025,2026,Estimates Start After
3668,178,IRL,TX_RPCH,Ireland,Volume of exports of goods and services,"Percent change of volume of exports refers to the aggregate change in the quantities of total exports whose characteristics are unchanged. The goods and services and their prices are held constant, therefore changes are due to changes in quantities only. [Export and Import Price Index Manual: Theory and Practice, Glossary]",Percent change,,"Source: National Statistics Office. Central Statistical Office of Ireland (CSO) Latest actual data: 2020 Base year: 2015 Methodology used to derive volumes: For goods - average of unit value indices and producer price indices are used. For services - price surveys are used only for services deflation on a quarterly basis. Formula used to derive volumes: Fisher. Fisher chain-linked estimate is used for the annual data. Chain-weighted: Yes, from 1995 Trade System: General trade Excluded items in trade: In transit; Low valued; Oil coverage: Primary or unrefined products; Secondary or refined products; Valuation of exports: Free on board (FOB) Valuation of imports: Cost, insurance, freight (CIF) Primary domestic currency: Euro Data last updated: 09/2021",7.065,1.705,4.482,10.52,16.246,6.6,2.71,13.879,8.151,11.417,9.173,5.61,13.859,9.812,15.101,20.141,12.421,17.549,22.771,15.772,21.188,14.007,6.477,-1.698,6.519,5.481,6.05,8.903,-3.804,4.649,5.967,3.128,-0.821,2.983,14.601,39.25,4.586,9.637,11.549,10.421,9.498,14.5,4.1,4.5,4.04,4.04,4.04,2020.0
3669,178,IRL,TXG_RPCH,Ireland,Volume of exports of goods,"Percent change of volume of exports of goods refers to the aggregate change in the quantities of exports of goods whose characteristics are unchanged. The goods and their prices are held constant, therefore changes are due to changes in quantities only. [Export and Import Price Index Manual: Theory and Practice, Glossary]",Percent change,,"Source: National Statistics Office. Central Statistical Office of Ireland (CSO) Latest actual data: 2020 Base year: 2015 Methodology used to derive volumes: For goods - average of unit value indices and producer price indices are used. For services - price surveys are used only for services deflation on a quarterly basis. Formula used to derive volumes: Fisher. Fisher chain-linked estimate is used for the annual data. Chain-weighted: Yes, from 1995 Trade System: General trade Excluded items in trade: In transit; Low valued; Oil coverage: Primary or unrefined products; Secondary or refined products; Valuation of exports: Free on board (FOB) Valuation of imports: Cost, insurance, freight (CIF) Primary domestic currency: Euro Data last updated: 09/2021",7.828,0.703,7.209,12.148,18.375,6.536,3.681,14.497,7.106,11.218,8.46,5.6,14.678,10.157,14.843,20.104,9.891,14.936,-0.576,13.857,17.377,11.762,7.344,-6.968,6.996,3.924,2.773,8.776,-5.92,6.308,2.482,-0.635,-2.197,-0.35,16.306,59.148,0.75,3.934,11.312,4.547,16.461,20.0,2.4,4.5,4.0,4.0,4.0,2020.0
3672,178,IRL,LP,Ireland,Population,"For census purposes, the total population of the country consists of all persons falling within the scope of the census. In the broadest sense, the total may comprise either all usual residents of the country or all persons present in the country at the time of the census. [Principles and Recommendations for Population and Housing Censuses, Revision 1, paragraph 2.42]",Persons,Millions,Source: National Statistics Office. Central Statistical Office of Ireland (CSO). Latest actual data: 2020 Primary domestic currency: Euro Data last updated: 09/2021,3.427,3.47,3.506,3.531,3.556,3.567,3.568,3.573,3.558,3.536,3.532,3.552,3.582,3.601,3.613,3.629,3.654,3.692,3.731,3.774,3.828,3.889,3.956,4.021,4.1,4.2,4.321,4.445,4.516,4.547,4.568,4.585,4.605,4.631,4.667,4.714,4.771,4.826,4.886,4.95,4.994,5.042,5.09,5.138,5.187,5.236,5.286,2020.0
3673,178,IRL,GGR,Ireland,General government revenue,"Revenue consists of taxes, social contributions, grants receivable, and other revenue. Revenue increases government's net worth, which is the difference between its assets and liabilities (GFSM 2001, paragraph 4.20). Note: Transactions that merely change the composition of the balance sheet do not change the net worth position, for example, proceeds from sales of nonfinancial and financial assets or incurrence of liabilities.",National currency,Billions,"Source: Ministry of Finance or Treasury. Eurostat Latest actual data: 2020 Fiscal assumptions: Fiscal projections are based on the country's Budget 2021 and Stability Programme Update 2021. Start/end months of reporting year: January/December GFS Manual used: Government Finance Statistics Manual (GFSM) 2001 Basis of recording: Accrual General government includes: Central Government; Local Government; Social Security Funds; Other; Valuation of public debt: Nominal value Instruments included in gross and net debt: Currency and Deposits; Securities Other than Shares; Loans;. Gross debt follows the Maastricht definition of gross debt, and excludes other accounts payable. Net debt is defined as gross debt less currency and deposits, debt securities, and loans. Primary domestic currency: Euro Data last updated: 09/2021",4.934,6.127,7.67,8.84,9.83,12.018,12.396,12.689,13.896,14.151,15.452,16.624,17.987,18.486,20.082,20.959,23.074,26.002,29.154,33.447,38.432,40.451,44.01,48.056,53.316,58.913,67.195,70.764,64.663,55.943,54.864,57.732,59.709,61.302,66.157,70.971,73.708,76.925,83.084,88.132,84.528,85.815,90.73,94.893,99.359,104.11,107.336,2020.0
3675,178,IRL,GGX,Ireland,General government total expenditure,"Total expenditure consists of total expense and the net acquisition of nonfinancial assets. Note: Apart from being on an accrual basis, total expenditure differs from the GFSM 1986 definition of total expenditure in the sense that it also takes the disposals of nonfinancial assets into account.",National currency,Billions,"Source: Ministry of Finance or Treasury. Eurostat Latest actual data: 2020 Fiscal assumptions: Fiscal projections are based on the country's Budget 2021 and Stability Programme Update 2021. Start/end months of reporting year: January/December GFS Manual used: Government Finance Statistics Manual (GFSM) 2001 Basis of recording: Accrual General government includes: Central Government; Local Government; Social Security Funds; Other; Valuation of public debt: Nominal value Instruments included in gross and net debt: Currency and Deposits; Securities Other than Shares; Loans;. Gross debt follows the Maastricht definition of gross debt, and excludes other accounts payable. Net debt is defined as gross debt less currency and deposits, debt securities, and loans. Primary domestic currency: Euro Data last updated: 09/2021",6.325,7.926,9.951,11.022,11.937,14.623,15.12,14.985,15.157,14.878,16.444,17.698,19.148,19.641,20.942,22.096,23.193,25.049,27.488,30.165,33.165,39.28,44.716,47.552,51.287,56.238,62.063,70.236,77.83,79.461,108.628,81.158,74.616,72.81,73.242,76.356,75.805,78.198,83.023,87.06,103.288,108.929,106.196,105.484,109.357,112.294,115.759,2020.0
3677,178,IRL,GGXCNL,Ireland,General government net lending/borrowing,"Net lending (+)/ borrowing (-) is calculated as revenue minus total expenditure. This is a core GFS balance that measures the extent to which general government is either putting financial resources at the disposal of other sectors in the economy and nonresidents (net lending), or utilizing the financial resources generated by other sectors and nonresidents (net borrowing). This balance may be viewed as an indicator of the financial impact of general government activity on the rest of the economy and nonresidents (GFSM 2001, paragraph 4.17). Note: Net lending (+)/borrowing (-) is also equal to net acquisition of financial assets minus net incurrence of liabilities.",National currency,Billions,"Source: Ministry of Finance or Treasury. Eurostat Latest actual data: 2020 Fiscal assumptions: Fiscal projections are based on the country's Budget 2021 and Stability Programme Update 2021. Start/end months of reporting year: January/December GFS Manual used: Government Finance Statistics Manual (GFSM) 2001 Basis of recording: Accrual General government includes: Central Government; Local Government; Social Security Funds; Other; Valuation of public debt: Nominal value Instruments included in gross and net debt: Currency and Deposits; Securities Other than Shares; Loans;. Gross debt follows the Maastricht definition of gross debt, and excludes other accounts payable. Net debt is defined as gross debt less currency and deposits, debt securities, and loans. Primary domestic currency: Euro Data last updated: 09/2021",-1.39,-1.799,-2.281,-2.181,-2.107,-2.605,-2.724,-2.296,-1.261,-0.727,-0.993,-1.074,-1.161,-1.156,-0.86,-1.137,-0.119,0.953,1.666,3.282,5.267,1.171,-0.706,0.504,2.029,2.675,5.132,0.528,-13.167,-23.517,-53.764,-23.425,-14.906,-11.507,-7.085,-5.384,-2.097,-1.273,0.061,1.072,-18.76,-23.114,-15.467,-10.591,-9.998,-8.184,-8.423,2020.0
3681,178,IRL,GGXONLB,Ireland,General government primary net lending/borrowing,Primary net lending/borrowing is net lending (+)/borrowing (-) plus net interest payable/paid (interest expense minus interest revenue).,National currency,Billions,"Source: Ministry of Finance or Treasury. Eurostat Latest actual data: 2020 Fiscal assumptions: Fiscal projections are based on the country's Budget 2021 and Stability Programme Update 2021. Start/end months of reporting year: January/December GFS Manual used: Government Finance Statistics Manual (GFSM) 2001 Basis of recording: Accrual General government includes: Central Government; Local Government; Social Security Funds; Other; Valuation of public debt: Nominal value Instruments included in gross and net debt: Currency and Deposits; Securities Other than Shares; Loans;. Gross debt follows the Maastricht definition of gross debt, and excludes other accounts payable. Net debt is defined as gross debt less currency and deposits, debt securities, and loans. Primary domestic currency: Euro Data last updated: 09/2021",-0.584,-0.695,-0.698,-0.375,-0.078,-0.206,-0.327,0.26,1.31,1.857,2.015,1.957,1.852,1.803,2.055,1.464,2.286,3.288,4.111,5.223,7.013,2.481,0.825,2.093,3.532,4.137,6.496,1.752,-11.865,-21.072,-50.043,-19.225,-9.218,-5.151,-0.546,0.873,3.916,4.491,5.2,5.564,-15.005,-19.475,-11.547,-6.911,-5.86,-4.069,-4.598,2020.0
3688,178,IRL,BCA,Ireland,Current account balance,"Current account is all transactions other than those in financial and capital items. The major classifications are goods and services, income and current transfers. The focus of the BOP is on transactions (between an economy and the rest of the world) in goods, services, and income.",U.S. dollars,Billions,"Source: National Statistics Office. Central Statistical Office of Ireland (CSO) Latest actual data: 2020 BOP Manual used: Balance of Payments and International Investment Position Manual, sixth edition (BPM6) Primary domestic currency: Euro Data last updated: 09/2021",-2.262,-2.58,-1.872,-1.155,-1.027,-0.692,-0.82,-0.088,0.094,-0.494,-0.372,0.34,0.545,1.83,1.496,1.716,2.025,1.947,0.328,-0.114,0.615,0.195,0.317,0.81,-0.19,-7.505,-12.43,-17.587,-17.227,-11.022,-2.659,-3.91,-7.629,3.703,2.783,12.823,-12.586,1.648,18.913,-79.235,-11.293,57.342,48.633,46.046,42.587,41.791,42.629,2020.0
3689,178,IRL,BCA_NGDPD,Ireland,Current account balance,"Current account is all transactions other than those in financial and capital items. The major classifications are goods and services, income and current transfers. The focus of the BOP is on transactions (between an economy and the rest of the world) in goods, services, and income.",Percent of GDP,,"See notes for:  Gross domestic product, current prices (National currency) Current account balance (U.S. dollars).",-10.557,-12.631,-8.782,-5.602,-5.163,-3.271,-2.875,-0.261,0.254,-1.299,-0.772,0.696,0.993,3.563,2.678,2.478,2.666,2.348,0.363,-0.115,0.614,0.179,0.247,0.492,-0.098,-3.54,-5.353,-6.511,-6.255,-4.667,-1.197,-1.637,-3.381,1.554,1.074,4.397,-4.212,0.491,4.91,-19.85,-2.654,11.107,8.834,7.804,6.781,6.253,6.0,2020.0
