,WEO Country Code,ISO,WEO Subject Code,Country,Subject Descriptor,Subject Notes,Units,Scale,Country/Series-specific Notes,1980,1981,1982,1983,1984,1985,1986,1987,1988,1989,1990,1991,1992,1993,1994,1995,1996,1997,1998,1999,2000,2001,2002,2003,2004,2005,2006,2007,2008,2009,2010,2011,2012,2013,2014,2015,2016,2017,2018,2019,2020,2021,2022,2023,2024,2025,2026,Estimates Start After
5310,688,MOZ,NGDP_R,Mozambique,"Gross domestic product, constant prices","Expressed in billions of national currency units; the base year is country-specific. Expenditure-based GDP is total final expenditures at purchasers' prices (including the f.o.b. value of exports of goods and services), less the f.o.b. value of imports of goods and services. [SNA 1993]",National currency,Billions,"Source: National Statistics Office. Instituto Nacional de Estadistica (INE). Latest actual data: 2019. (1) There are discrepancies in the demand side of the national accounts. The reason for the discrepancies is that we don't adopt the authorities data for exports and imports in the national accounts, because the trade data in the national accounts do not include trades related to megaprojects (mainly natural resource projects). The authorities are currently working on addressing this issue supported by STA's TAs   (2) no constant price data on inventories, removed from dataset that was leading to zeros. Notes: Data prior to 1992 cannot be confirmed by national sources at this time. National accounts manual used: System of National Accounts (SNA) 1993 GDP valuation: Market prices Start/end months of reporting year: January/December Base year: 2014 Chain-weighted: No Primary domestic currency: Mozambican metical Data last updated: 09/2021",103.109,108.265,100.795,84.97,79.447,80.241,78.396,89.92,97.293,103.617,104.654,111.51,104.68,115.775,123.339,126.126,140.255,156.105,171.609,191.684,193.947,217.389,237.587,253.929,274.031,292.243,320.574,345.354,370.626,394.043,419.665,450.793,483.513,517.183,555.447,592.792,615.461,638.488,660.476,675.763,667.425,683.832,720.06,810.953,839.668,869.467,990.613,2019.0
5311,688,MOZ,NGDP_RPCH,Mozambique,"Gross domestic product, constant prices","Annual percentages of constant price GDP are year-on-year changes; the base year is country-specific. Expenditure-based GDP is total final expenditures at purchasers' prices (including the f.o.b. value of exports of goods and services), less the f.o.b. value of imports of goods and services. [SNA 1993]",Percent change,,"See notes for:  Gross domestic product, constant prices (National currency).",4.228,5.0,-6.9,-15.7,-6.5,1.0,-2.3,14.7,8.2,6.5,1.0,6.552,-6.125,10.599,6.533,2.26,11.202,11.301,9.932,11.698,1.181,12.087,9.291,6.878,7.916,6.646,9.694,7.73,7.318,6.318,6.502,7.417,7.258,6.964,7.399,6.723,3.824,3.741,3.444,2.315,-1.234,2.458,5.298,12.623,3.541,3.549,13.933,2019.0
5312,688,MOZ,NGDP,Mozambique,"Gross domestic product, current prices","Expressed in billions of national currency units. Expenditure-based GDP is total final expenditures at purchasers' prices (including the f.o.b. value of exports of goods and services), less the f.o.b. value of imports of goods and services. [SNA 1993]",National currency,Billions,"Source: National Statistics Office. Instituto Nacional de Estadistica (INE). Latest actual data: 2019. (1) There are discrepancies in the demand side of the national accounts. The reason for the discrepancies is that we don't adopt the authorities data for exports and imports in the national accounts, because the trade data in the national accounts do not include trades related to megaprojects (mainly natural resource projects). The authorities are currently working on addressing this issue supported by STA's TAs   (2) no constant price data on inventories, removed from dataset that was leading to zeros. Notes: Data prior to 1992 cannot be confirmed by national sources at this time. National accounts manual used: System of National Accounts (SNA) 1993 GDP valuation: Market prices Start/end months of reporting year: January/December Base year: 2014 Chain-weighted: No Primary domestic currency: Mozambican metical Data last updated: 09/2021",0.161,0.126,0.138,0.132,0.145,0.195,0.215,0.693,1.112,1.746,3.29,5.212,6.644,10.575,16.887,26.17,43.558,53.664,62.506,76.349,86.132,111.77,134.42,149.909,172.321,196.989,233.1,270.053,305.123,327.866,377.115,418.037,463.921,510.997,555.447,637.76,752.702,840.526,895.567,962.621,974.511,1056.38,1173.52,1394.35,1523.12,1663.92,2000.03,2019.0
5313,688,MOZ,NGDPD,Mozambique,"Gross domestic product, current prices","Values are based upon GDP in national currency converted to U.S. dollars using market exchange rates (yearly average). Exchange rate projections are provided by country economists for the group of other emerging market and developing countries. Exchanges rates for advanced economies are established in the WEO assumptions for each WEO exercise. Expenditure-based GDP is total final expenditures at purchasers' prices (including the f.o.b. value of exports of goods and services), less the f.o.b. value of imports of goods and services. [SNA 1993]",U.S. dollars,Billions,"See notes for:  Gross domestic product, current prices (National currency).",4.615,3.585,3.662,3.28,3.417,4.516,5.301,2.395,2.105,2.199,3.529,3.633,2.64,2.73,2.797,2.9,3.857,4.649,5.264,5.976,5.656,5.399,5.677,6.303,7.631,8.542,9.177,10.451,12.556,11.914,11.105,14.382,16.351,16.974,17.716,15.951,11.937,13.219,14.845,15.39,14.029,15.833,16.759,19.356,20.498,21.691,25.234,2019.0
5314,688,MOZ,PPPGDP,Mozambique,"Gross domestic product, current prices","These data form the basis for the country weights used to generate the World Economic Outlook country group composites for the domestic economy.   The IMF is not a primary source for purchasing power parity (PPP) data. WEO weights have been created from primary sources and are used solely for purposes of generating country group composites. For primary source information, please refer to one of the following sources: the Organization for Economic Cooperation and Development, the World Bank, or the Penn World Tables.   For further information see Box 1.1 in the October 2020 World Economic Outlook, ""Revised Purchasing Power Parity Weights"" in the July 2014 WEO Update, Box A2 in the April 2004 World Economic Outlook, Box A1 in the May 2000 World Economic Outlook, and Annex IV in the May 1993 World Economic Outlook for summaries of the revised PPP-based weights; and Box 1.2 in the September 2003 World Economic Outlook for a discussion on the measurement of global growth. See also Anne Marie Gulde and Marianne Schulze-Ghattas, Purchasing Power Parity Based Weights for the World Economic Outlook, in Staff Studies for the World Economic Outlook (Washington: IMF, December 1993), pp. 106-23.",Purchasing power parity; international dollars,Billions,"See notes for:  Gross domestic product, current prices (National currency).",2.436,2.8,2.768,2.424,2.349,2.447,2.439,2.867,3.211,3.554,3.724,4.102,3.938,4.459,4.852,5.066,5.736,6.495,7.22,8.178,8.462,9.699,10.765,11.733,13.001,14.3,16.17,17.891,19.569,20.938,22.568,24.745,25.746,27.733,29.941,34.918,37.951,36.776,38.951,40.565,40.548,43.041,46.569,53.695,56.864,60.161,69.964,2019.0
5315,688,MOZ,NGDP_D,Mozambique,"Gross domestic product, deflator",The GDP deflator is derived by dividing current price GDP by constant price GDP and is considered to be an alternate measure of inflation. Data are expressed in the base year of each country's national accounts.,Index,,"See notes for:  Gross domestic product, constant prices (National currency) Gross domestic product, current prices (National currency).",0.156,0.117,0.137,0.155,0.183,0.243,0.274,0.771,1.143,1.685,3.144,4.674,6.347,9.134,13.692,20.749,31.056,34.377,36.423,39.831,44.41,51.415,56.577,59.036,62.884,67.406,72.713,78.196,82.326,83.206,89.861,92.734,95.948,98.804,100.0,107.586,122.299,131.643,135.594,142.449,146.011,154.479,162.976,171.939,181.396,191.373,201.898,2019.0
5316,688,MOZ,NGDPRPC,Mozambique,"Gross domestic product per capita, constant prices",GDP is expressed in constant national currency per person. Data are derived by dividing constant price GDP by total population.,National currency,Units,"See notes for:  Gross domestic product, constant prices (National currency) Population (Persons).",8865.66,9087.89,8268.75,6830.5,6287.28,6286.34,6120.57,7032.49,7626.06,8091.34,8058.15,8366.58,7582.21,8056.18,8251.18,8145.95,8787.66,9520.24,10206.35,11115.87,10950.08,11930.11,12661.75,13135.78,13763.11,14259.98,15207.42,15934.52,16637.46,17211.09,17834.13,18637.44,19447.35,20233.48,21130.75,21921.16,22115.08,22286.57,22392.05,22253.9,21353.89,21261.41,21761.01,23827.18,23990.68,24162.18,26781.34,2015.0
5317,688,MOZ,NGDPRPPPPC,Mozambique,"Gross domestic product per capita, constant prices",GDP is expressed in constant international dollars per person. Data are derived by dividing constant price purchasing-power parity (PPP) GDP by total population.,Purchasing power parity; 2017 international dollar,Units,"See notes for:  Gross domestic product, constant prices (National currency) Population (Persons).",510.643,523.444,476.263,393.422,362.134,362.08,352.532,405.056,439.245,466.044,464.132,481.897,436.719,464.019,475.25,469.19,506.151,548.346,587.864,640.251,630.702,687.149,729.29,756.593,792.726,821.345,875.915,917.795,958.283,991.323,1027.21,1073.48,1120.13,1165.41,1217.09,1262.61,1273.78,1283.66,1289.74,1281.78,1229.94,1224.61,1253.39,1372.4,1381.81,1391.69,1542.55,2015.0
5318,688,MOZ,NGDPPC,Mozambique,"Gross domestic product per capita, current prices",GDP is expressed in current national currency per person. Data are derived by dividing current price GDP by total population.,National currency,Units,"See notes for:  Gross domestic product, current prices (National currency) Population (Persons).",13.849,10.616,11.346,10.594,11.475,15.277,16.764,54.212,87.198,136.349,253.347,391.056,481.24,735.859,1129.71,1690.21,2729.12,3272.76,3717.51,4427.52,4862.94,6133.83,7163.66,7754.81,8654.76,9612.07,11057.82,12460.16,13697.02,14320.6,16025.92,17283.18,18659.34,19991.47,21130.75,23584.05,27046.49,29338.75,30362.31,31700.57,31178.93,32844.45,35465.13,40968.25,43518.1,46239.79,54071.02,2015.0
5319,688,MOZ,NGDPDPC,Mozambique,"Gross domestic product per capita, current prices",GDP is expressed in current U.S. dollars per person. Data are derived by first converting GDP in national currency to U.S. dollars and then dividing it by total population.,U.S. dollars,Units,"See notes for:  Gross domestic product, current prices (National currency) Population (Persons).",396.816,300.914,300.392,263.659,270.38,353.788,413.827,187.301,164.966,171.727,271.733,272.614,191.23,189.937,187.082,187.295,241.649,283.513,313.064,346.574,319.358,296.268,302.546,326.075,383.27,416.811,435.334,482.198,563.649,520.403,471.904,594.586,657.645,664.078,673.969,589.86,428.927,461.415,503.302,506.817,448.844,492.273,506.47,568.707,585.666,602.799,682.197,2015.0
5320,688,MOZ,PPPPC,Mozambique,"Gross domestic product per capita, current prices","Expressed in GDP in PPP dollars per person. Data are derived by dividing GDP in PPP dollars by total population. These data form the basis for the country weights used to generate the World Economic Outlook country group composites for the domestic economy.   The IMF is not a primary source for purchasing power parity (PPP) data. WEO weights have been created from primary sources and are used solely for purposes of generating country group composites. For primary source information, please refer to one of the following sources: the Organization for Economic Cooperation and Development, the World Bank, or the Penn World Tables.  For further information see Box 1.1 in the October 2020 World Economic Outlook, ""Revised Purchasing Power Parity Weights"" in the July 2014 WEO Update, Box A2 in the April 2004 World Economic Outlook, Box A1 in the May 2000 World Economic Outlook, and Annex IV in the May 1993 World Economic Outlook for summaries of the revised PPP-based weights; and Box 1.2 in the September 2003 World Economic Outlook for a discussion on the measurement of global growth. See also Anne Marie Gulde and Marianne Schulze-Ghattas, Purchasing Power Parity Based Weights for the World Economic Outlook, in Staff Studies for the World Economic Outlook (Washington: IMF, December 1993), pp. 106-23.",Purchasing power parity; international dollars,Units,"See notes for:  Gross domestic product, current prices (National currency) Population (Persons).",209.442,235.004,227.034,194.888,185.863,191.712,190.415,224.196,251.693,277.521,286.726,307.769,285.272,310.288,324.586,327.166,359.402,396.077,429.401,474.256,477.767,532.254,573.7,606.925,652.98,697.771,767.092,825.49,878.434,914.545,959.042,1023.07,1035.52,1084.99,1139.05,1291.27,1363.68,1283.66,1320.55,1335.88,1297.3,1338.23,1407.37,1577.66,1624.7,1671.86,1891.48,2015.0
5322,688,MOZ,PPPSH,Mozambique,Gross domestic product based on purchasing-power-parity (PPP) share of world total,"Expressed in percent of world GDP in PPP dollars. These data form the basis for the country weights used to generate the World Economic Outlook country group composites for the domestic economy.   The IMF is not a primary source for purchasing power parity (PPP) data. WEO weights have been created from primary sources and are used solely for purposes of generating country group composites. For primary source information, please refer to one of the following sources: the Organization for Economic Cooperation and Development, the World Bank, or the Penn World Tables.  For further information see Box 1.1 in the October 2020 World Economic Outlook, ""Revised Purchasing Power Parity Weights"" in the July 2014 WEO Update, Box A2 in the April 2004 World Economic Outlook, Box A1 in the May 2000 World Economic Outlook, and Annex IV in the May 1993 World Economic Outlook for summaries of the revised PPP-based weights; and Box 1.2 in the September 2003 World Economic Outlook for a discussion on the measurement of global growth. See also Anne Marie Gulde and Marianne Schulze-Ghattas, Purchasing Power Parity Based Weights for the World Economic Outlook, in Staff Studies for the World Economic Outlook (Washington: IMF, December 1993), pp. 106-23.",Percent,,"See notes for:  Gross domestic product, current prices (National currency).",0.018,0.019,0.017,0.014,0.013,0.013,0.012,0.013,0.014,0.014,0.014,0.014,0.012,0.013,0.013,0.013,0.014,0.015,0.016,0.017,0.017,0.018,0.02,0.02,0.021,0.021,0.022,0.022,0.023,0.025,0.025,0.026,0.026,0.026,0.027,0.031,0.033,0.03,0.03,0.03,0.031,0.03,0.03,0.032,0.033,0.033,0.036,2019.0
5323,688,MOZ,PPPEX,Mozambique,Implied PPP conversion rate,"Expressed in national currency per current international dollar. These data form the basis for the country weights used to generate the World Economic Outlook country group composites for the domestic economy.   The IMF is not a primary source for purchasing power parity (PPP) data. WEO weights have been created from primary sources and are used solely for purposes of generating country group composites. For primary source information, please refer to one of the following sources: the Organization for Economic Cooperation and Development, the World Bank, or the Penn World Tables.  For further information see Box 1.1 in the October 2020 World Economic Outlook, ""Revised Purchasing Power Parity Weights"" in the July 2014 WEO Update, Box A2 in the April 2004 World Economic Outlook, Box A1 in the May 2000 World Economic Outlook, and Annex IV in the May 1993 World Economic Outlook for summaries of the revised PPP-based weights; and Box 1.2 in the September 2003 World Economic Outlook for a discussion on the measurement of global growth. See also Anne Marie Gulde and Marianne Schulze-Ghattas, Purchasing Power Parity Based Weights for the World Economic Outlook, in Staff Studies for the World Economic Outlook (Washington: IMF, December 1993), pp. 106-23.",National currency per current international dollar,,"See notes for:  Gross domestic product, current prices (National currency).",0.066,0.045,0.05,0.054,0.062,0.08,0.088,0.242,0.346,0.491,0.884,1.271,1.687,2.372,3.48,5.166,7.594,8.263,8.657,9.336,10.178,11.524,12.487,12.777,13.254,13.775,14.415,15.094,15.593,15.659,16.71,16.894,18.019,18.426,18.551,18.264,19.834,22.856,22.992,23.73,24.034,24.543,25.2,25.968,26.785,27.658,28.587,2019.0
5324,688,MOZ,NID_NGDP,Mozambique,Total investment,Expressed as a ratio of total investment in current local currency and GDP in current local currency. Investment or gross capital formation is measured by the total value of the gross fixed capital formation and changes in inventories and acquisitions less disposals of valuables for a unit or sector. [SNA 1993],Percent of GDP,,"Source: National Statistics Office. Instituto Nacional de Estadistica (INE). Latest actual data: 2019. (1) There are discrepancies in the demand side of the national accounts. The reason for the discrepancies is that we don't adopt the authorities data for exports and imports in the national accounts, because the trade data in the national accounts do not include trades related to megaprojects (mainly natural resource projects). The authorities are currently working on addressing this issue supported by STA's TAs   (2) no constant price data on inventories, removed from dataset that was leading to zeros. Notes: Data prior to 1992 cannot be confirmed by national sources at this time. National accounts manual used: System of National Accounts (SNA) 1993 GDP valuation: Market prices Start/end months of reporting year: January/December Base year: 2014 Chain-weighted: No Primary domestic currency: Mozambican metical Data last updated: 09/2021",17.198,34.875,31.347,25.0,21.66,15.972,14.857,35.158,42.425,41.222,43.538,26.036,28.688,28.577,24.528,34.008,21.505,21.456,23.953,40.425,37.665,30.573,36.402,29.889,25.322,22.515,21.595,20.512,20.992,18.327,21.94,28.828,49.529,53.988,52.855,41.249,46.602,33.186,50.048,60.058,57.801,59.855,48.802,65.402,69.851,71.205,56.694,2019.0
5325,688,MOZ,NGSD_NGDP,Mozambique,Gross national savings,"Expressed as a ratio of gross national savings in current local currency and GDP in current local currency. Gross national saving is gross disposable income less final consumption expenditure after taking account of an adjustment for pension funds. [SNA 1993] For many countries, the estimates of national saving are built up from national accounts data on gross domestic investment and from balance of payments-based data on net foreign investment.",Percent of GDP,,"Source: National Statistics Office. Instituto Nacional de Estadistica (INE). Latest actual data: 2019. (1) There are discrepancies in the demand side of the national accounts. The reason for the discrepancies is that we don't adopt the authorities data for exports and imports in the national accounts, because the trade data in the national accounts do not include trades related to megaprojects (mainly natural resource projects). The authorities are currently working on addressing this issue supported by STA's TAs   (2) no constant price data on inventories, removed from dataset that was leading to zeros. Notes: Data prior to 1992 cannot be confirmed by national sources at this time. National accounts manual used: System of National Accounts (SNA) 1993 GDP valuation: Market prices Start/end months of reporting year: January/December Base year: 2014 Chain-weighted: No Primary domestic currency: Mozambican metical Data last updated: 09/2021",8.961,23.142,17.275,11.69,11.48,8.58,6.189,15.934,24.882,20.01,31.54,10.797,9.696,6.251,1.371,18.001,6.956,12.045,9.255,26.126,25.345,18.545,21.091,16.935,19.041,13.611,13.363,12.989,11.855,8.035,6.816,5.683,8.002,13.483,16.519,3.835,14.383,13.627,19.741,40.42,30.623,25.871,25.803,27.771,30.997,31.648,29.816,2019.0
5326,688,MOZ,PCPI,Mozambique,"Inflation, average consumer prices","Expressed in averages for the year, not end-of-period data. A consumer price index (CPI) measures changes in the prices of goods and services that households consume. Such changes affect the real purchasing power of consumers' incomes and their welfare. As the prices of different goods and services do not all change at the same rate, a price index can only reflect their average movement. A price index is typically assigned a value of unity, or 100, in some reference period and the values of the index for other periods of time are intended to indicate the average proportionate, or percentage, change in prices from this price reference period. Price indices can also be used to measure differences in price levels between different cities, regions or countries at the same point in time. [CPI Manual 2004, Introduction] For euro countries, consumer prices are calculated based on harmonized prices. For more information see http://epp.eurostat.ec.europa.eu/cache/ITY_OFFPUB/KS-BE-04-001/EN/KS-BE-04-001-EN.PDF.]",Index,,"Source: National Statistics Office. Instituto Nacional de Estadistica (INE). Latest actual data: 2019. August 2020 is latest actual Harmonized prices: No Frequency of source data: Monthly Base year: 2016. We are replacing CPI with National CPI, as before it used to be Maputo only CPI - Backward inflation for Maputo has been applied to the historical period. Authorities report CPI index as average Jan-Dec 2016=100. Primary domestic currency: Mozambican metical Data last updated: 09/2021",0.058,0.061,0.072,0.092,0.119,0.156,0.219,0.579,0.918,1.305,1.876,2.499,3.626,5.158,8.414,12.424,18.449,19.807,20.101,20.679,23.308,25.42,29.682,33.676,37.931,40.369,45.716,50.473,57.793,59.981,67.435,74.964,76.915,80.193,82.246,85.168,100.001,115.114,119.617,122.943,126.806,134.638,143.316,151.2,159.517,168.292,177.55,2019.0
5327,688,MOZ,PCPIPCH,Mozambique,"Inflation, average consumer prices",Annual percentages of average consumer prices are year-on-year changes.,Percent change,,"See notes for:  Inflation, average consumer prices (Index).",2.0,4.2,17.695,28.198,30.044,30.785,40.491,164.115,58.507,42.076,43.723,33.258,45.076,42.255,63.123,47.668,48.491,7.36,1.487,2.874,12.713,9.061,16.769,13.455,12.634,6.428,13.245,10.404,14.505,3.785,12.428,11.165,2.602,4.261,2.561,3.552,17.417,15.113,3.911,2.781,3.142,6.176,6.445,5.501,5.501,5.501,5.501,2019.0
5328,688,MOZ,PCPIE,Mozambique,"Inflation, end of period consumer prices","Expressed in end of the period, not annual average data. A consumer price index (CPI) measures changes in the prices of goods and services that households consume. Such changes affect the real purchasing power of consumers' incomes and their welfare. As the prices of different goods and services do not all change at the same rate, a price index can only reflect their average movement. A price index is typically assigned a value of unity, or 100, in some reference period and the values of the index for other periods of time are intended to indicate the average proportionate, or percentage, change in prices from this price reference period. Price indices can also be used to measure differences in price levels between different cities, regions or countries at the same point in time. [CPI Manual 2004, Introduction] For euro countries, consumer prices are calculated based on harmonized prices. For more information see http://epp.eurostat.ec.europa.eu/cache/ITY_OFFPUB/KS-BE-04-001/EN/KS-BE-04-001-EN.PDF.",Index,,"Source: National Statistics Office. Instituto Nacional de Estadistica (INE). Latest actual data: 2019. August 2020 is latest actual Harmonized prices: No Frequency of source data: Monthly Base year: 2016. We are replacing CPI with National CPI, as before it used to be Maputo only CPI - Backward inflation for Maputo has been applied to the historical period. Authorities report CPI index as average Jan-Dec 2016=100. Primary domestic currency: Mozambican metical Data last updated: 09/2021",0.062,0.068,0.084,0.109,0.141,0.189,0.267,0.763,1.155,1.482,2.181,2.948,4.555,6.543,10.244,16.036,19.137,20.323,20.129,21.38,23.826,29.052,31.701,36.08,39.352,43.739,47.839,53.84,60.21,61.56,72.3,76.74,78.29,81.06,82.62,91.34,110.66,116.91,121.03,125.27,129.68,139.202,146.86,154.938,163.461,172.453,181.94,2019.0
5331,688,MOZ,TM_RPCH,Mozambique,Volume of imports of goods and services,"Percent change of volume of imports refers to the aggregate change in the quantities of total imports whose characteristics are unchanged. The goods and services and their prices are held constant, therefore changes are due to changes in quantities only. [Export and Import Price Index Manual: Theory and Practice, Glossary]",Percent change,,"Source: Central Bank Latest actual data: 2019 Base year: 2005 Methodology used to derive volumes: Deflation by unit value indexes (from customs data) Formula used to derive volumes: Trade change (percent)=(Trade value(t)/Trade value(t-1))/(Trade price(t)/Trade price(t-1))-1 Chain-weighted: No Trade System: General trade Excluded items in trade: Other; Oil coverage: Other; Valuation of exports: Free on board (FOB) Valuation of imports: Cost, insurance, freight (CIF) Primary domestic currency: Mozambican metical Data last updated: 09/2021",13.4,3.447,10.811,-21.696,-14.864,-14.9,34.103,6.637,7.016,6.371,4.597,6.311,-3.336,15.433,6.253,-28.469,9.904,0.356,44.425,15.15,-11.242,9.886,30.596,1.789,-4.93,8.977,6.395,0.726,8.387,11.625,-5.623,43.074,65.373,8.275,-1.873,1.397,-20.997,-2.135,19.512,-6.689,-7.209,0.316,0.536,41.636,9.655,4.914,-5.0,2019.0
