,WEO Country Code,ISO,WEO Subject Code,Country,Subject Descriptor,Subject Notes,Units,Scale,Country/Series-specific Notes,1980,1981,1982,1983,1984,1985,1986,1987,1988,1989,1990,1991,1992,1993,1994,1995,1996,1997,1998,1999,2000,2001,2002,2003,2004,2005,2006,2007,2008,2009,2010,2011,2012,2013,2014,2015,2016,2017,2018,2019,2020,2021,2022,2023,2024,2025,2026,Estimates Start After
5332,688,MOZ,TMG_RPCH,Mozambique,Volume of Imports of goods,"Percent change of volume of imports of goods refers to the aggregate change in the quantities of imports of goods whose characteristics are unchanged. The goods and their prices are held constant, therefore changes are due to changes in quantities only. [Export and Import Price Index Manual: Theory and Practice, Glossary]",Percent change,,"Source: Central Bank Latest actual data: 2019 Base year: 2005 Methodology used to derive volumes: Deflation by unit value indexes (from customs data) Formula used to derive volumes: Trade change (percent)=(Trade value(t)/Trade value(t-1))/(Trade price(t)/Trade price(t-1))-1 Chain-weighted: No Trade System: General trade Excluded items in trade: Other; Oil coverage: Other; Valuation of exports: Free on board (FOB) Valuation of imports: Cost, insurance, freight (CIF) Primary domestic currency: Mozambican metical Data last updated: 09/2021",22.1,1.779,11.217,-23.348,-14.085,-19.046,28.654,7.591,8.336,7.999,5.665,5.192,-4.159,15.789,2.227,-33.769,4.741,1.911,20.034,44.586,-11.788,-3.289,52.305,5.0,-0.427,8.811,6.913,-0.949,11.792,8.185,-8.456,35.64,49.583,18.895,-1.645,3.271,-33.532,3.39,10.387,12.248,-7.669,-8.337,1.551,15.968,4.203,4.208,-0.495,2019.0
5333,688,MOZ,TX_RPCH,Mozambique,Volume of exports of goods and services,"Percent change of volume of exports refers to the aggregate change in the quantities of total exports whose characteristics are unchanged. The goods and services and their prices are held constant, therefore changes are due to changes in quantities only. [Export and Import Price Index Manual: Theory and Practice, Glossary]",Percent change,,"Source: Central Bank Latest actual data: 2019 Base year: 2005 Methodology used to derive volumes: Deflation by unit value indexes (from customs data) Formula used to derive volumes: Trade change (percent)=(Trade value(t)/Trade value(t-1))/(Trade price(t)/Trade price(t-1))-1 Chain-weighted: No Trade System: General trade Excluded items in trade: Other; Oil coverage: Other; Valuation of exports: Free on board (FOB) Valuation of imports: Cost, insurance, freight (CIF) Primary domestic currency: Mozambican metical Data last updated: 09/2021",-11.3,8.064,-7.251,-37.559,-27.838,-1.949,-4.522,7.641,-13.894,13.545,25.942,39.98,-0.35,3.505,2.724,3.763,22.877,1.365,12.147,18.105,11.697,46.726,23.792,10.172,15.62,11.667,13.571,-4.168,13.408,-0.515,-17.62,26.302,40.287,8.648,-3.198,-1.955,-5.713,34.7,5.457,-2.941,-18.554,-9.847,24.324,27.791,2.981,2.175,24.761,2019.0
5334,688,MOZ,TXG_RPCH,Mozambique,Volume of exports of goods,"Percent change of volume of exports of goods refers to the aggregate change in the quantities of exports of goods whose characteristics are unchanged. The goods and their prices are held constant, therefore changes are due to changes in quantities only. [Export and Import Price Index Manual: Theory and Practice, Glossary]",Percent change,,"Source: Central Bank Latest actual data: 2019 Base year: 2005 Methodology used to derive volumes: Deflation by unit value indexes (from customs data) Formula used to derive volumes: Trade change (percent)=(Trade value(t)/Trade value(t-1))/(Trade price(t)/Trade price(t-1))-1 Chain-weighted: No Trade System: General trade Excluded items in trade: Other; Oil coverage: Other; Valuation of exports: Free on board (FOB) Valuation of imports: Cost, insurance, freight (CIF) Primary domestic currency: Mozambican metical Data last updated: 09/2021",-6.3,9.132,-11.31,-45.625,-25.588,-13.939,-0.781,6.5,-14.404,8.489,25.455,34.222,-12.724,-2.024,12.264,-3.567,35.809,3.031,17.428,16.883,20.32,105.091,18.21,21.087,27.6,9.238,16.472,-6.102,11.615,-6.368,-4.207,24.899,30.037,13.24,-5.527,-4.11,0.896,33.364,4.885,-6.946,-19.452,-12.504,29.166,32.914,2.942,2.042,28.191,2019.0
5337,688,MOZ,LP,Mozambique,Population,"For census purposes, the total population of the country consists of all persons falling within the scope of the census. In the broadest sense, the total may comprise either all usual residents of the country or all persons present in the country at the time of the census. [Principles and Recommendations for Population and Housing Censuses, Revision 1, paragraph 2.42]",Persons,Millions,Source: International Financial Institution. Human Development Indicators. Latest actual data: 2015 Notes: Data prior to 1992 cannot be confirmed by national sources at this time. Primary domestic currency: Mozambican metical Data last updated: 09/2021,11.63,11.913,12.19,12.44,12.636,12.764,12.809,12.786,12.758,12.806,12.987,13.328,13.806,14.371,14.948,15.483,15.96,16.397,16.814,17.244,17.712,18.222,18.764,19.331,19.911,20.494,21.08,21.673,22.277,22.895,23.532,24.188,24.863,25.561,26.286,27.042,27.83,28.649,29.496,30.366,31.255,32.163,33.089,34.035,35.0,35.985,36.989,2015.0
5338,688,MOZ,GGR,Mozambique,General government revenue,"Revenue consists of taxes, social contributions, grants receivable, and other revenue. Revenue increases government's net worth, which is the difference between its assets and liabilities (GFSM 2001, paragraph 4.20). Note: Transactions that merely change the composition of the balance sheet do not change the net worth position, for example, proceeds from sales of nonfinancial and financial assets or incurrence of liabilities.",National currency,Billions,"Source: Ministry of Finance or Treasury Latest actual data: 2020 Fiscal assumptions: Fiscal projections assume an increase in non-LNG revenue broadly in line with non-LNG GDP while primary spending increases to reflect additional spending to address COVID, security issues, and wage increases in 2021 and 2022. Primary spending is then assumed to increase in line with a fraction of non-LNG GDP and/or inflation. Start/end months of reporting year: January/December GFS Manual used: Government Finance Statistics Manual (GFSM) 2001 Basis of recording: Mix accrual and cash basis General government includes: Central Government; State Government; Valuation of public debt: Nominal value. Authorities report on stock of debt on a nominal basis. Data for the DSA are calculated discounting maturities over the relevant period Instruments included in gross and net debt: OT's BT's, other financing , leasing and captures State-owned Enterprises debt not previously reported. Primary domestic currency: Mozambican metical Data last updated: 09/2021",0.021,0.021,0.032,0.026,0.025,0.022,0.026,0.108,0.229,0.398,0.545,0.847,1.353,2.025,3.383,4.503,5.829,8.291,9.142,12.281,14.39,19.107,21.491,25.007,26.168,30.524,41.321,52.326,60.903,72.033,89.967,104.383,116.787,151.431,168.988,165.979,180.061,227.554,230.704,285.759,273.467,298.177,346.59,380.117,406.552,447.821,541.418,2020.0
5339,688,MOZ,GGR_NGDP,Mozambique,General government revenue,"Revenue consists of taxes, social contributions, grants receivable, and other revenue. Revenue increases government's net worth, which is the difference between its assets and liabilities (GFSM 2001, paragraph 4.20). Note: Transactions that merely change the composition of the balance sheet do not change the net worth position, for example, proceeds from sales of nonfinancial and financial assets or incurrence of liabilities.",Percent of GDP,,See notes for:  General government revenue (National currency).,12.738,16.403,23.436,19.568,17.479,11.357,12.127,15.641,20.575,22.817,16.549,16.259,20.362,19.145,20.032,17.207,13.383,15.45,14.626,16.085,16.706,17.095,15.988,16.682,15.185,15.495,17.727,19.376,19.96,21.97,23.857,24.97,25.174,29.634,30.424,26.025,23.922,27.073,25.761,29.685,28.062,28.226,29.534,27.261,26.692,26.914,27.07,2020.0
5340,688,MOZ,GGX,Mozambique,General government total expenditure,"Total expenditure consists of total expense and the net acquisition of nonfinancial assets. Note: Apart from being on an accrual basis, total expenditure differs from the GFSM 1986 definition of total expenditure in the sense that it also takes the disposals of nonfinancial assets into account.",National currency,Billions,"Source: Ministry of Finance or Treasury Latest actual data: 2020 Fiscal assumptions: Fiscal projections assume an increase in non-LNG revenue broadly in line with non-LNG GDP while primary spending increases to reflect additional spending to address COVID, security issues, and wage increases in 2021 and 2022. Primary spending is then assumed to increase in line with a fraction of non-LNG GDP and/or inflation. Start/end months of reporting year: January/December GFS Manual used: Government Finance Statistics Manual (GFSM) 2001 Basis of recording: Mix accrual and cash basis General government includes: Central Government; State Government; Valuation of public debt: Nominal value. Authorities report on stock of debt on a nominal basis. Data for the DSA are calculated discounting maturities over the relevant period Instruments included in gross and net debt: OT's BT's, other financing , leasing and captures State-owned Enterprises debt not previously reported. Primary domestic currency: Mozambican metical Data last updated: 09/2021",0.023,0.03,0.037,0.047,0.045,0.041,0.052,0.159,0.301,0.472,0.69,0.958,1.483,2.307,4.098,5.182,6.773,9.309,9.851,12.533,15.527,24.294,26.231,29.134,31.845,34.734,48.649,58.447,66.862,86.701,103.158,122.808,133.121,164.185,223.948,208.458,218.599,244.306,280.727,287.181,323.314,375.756,442.875,482.47,508.588,540.177,581.223,2020.0
5341,688,MOZ,GGX_NGDP,Mozambique,General government total expenditure,"Total expenditure consists of total expense and the net acquisition of nonfinancial assets. Note: Apart from being on an accrual basis, total expenditure differs from the GFSM 1986 definition of total expenditure in the sense that it also takes the disposals of nonfinancial assets into account.",Percent of GDP,,See notes for:  General government total expenditure (National currency).,14.213,23.816,27.045,35.338,30.873,21.047,24.23,22.882,27.047,27.049,20.965,18.388,22.324,21.818,24.264,19.801,15.549,17.346,15.76,16.415,18.027,21.736,19.514,19.434,18.48,17.632,20.87,21.643,21.913,26.444,27.354,29.377,28.695,32.13,40.319,32.686,29.042,29.066,31.346,29.833,33.177,35.57,37.739,34.602,33.391,32.464,29.061,2020.0
5342,688,MOZ,GGXCNL,Mozambique,General government net lending/borrowing,"Net lending (+)/ borrowing (-) is calculated as revenue minus total expenditure. This is a core GFS balance that measures the extent to which general government is either putting financial resources at the disposal of other sectors in the economy and nonresidents (net lending), or utilizing the financial resources generated by other sectors and nonresidents (net borrowing). This balance may be viewed as an indicator of the financial impact of general government activity on the rest of the economy and nonresidents (GFSM 2001, paragraph 4.17). Note: Net lending (+)/borrowing (-) is also equal to net acquisition of financial assets minus net incurrence of liabilities.",National currency,Billions,"Source: Ministry of Finance or Treasury Latest actual data: 2020 Fiscal assumptions: Fiscal projections assume an increase in non-LNG revenue broadly in line with non-LNG GDP while primary spending increases to reflect additional spending to address COVID, security issues, and wage increases in 2021 and 2022. Primary spending is then assumed to increase in line with a fraction of non-LNG GDP and/or inflation. Start/end months of reporting year: January/December GFS Manual used: Government Finance Statistics Manual (GFSM) 2001 Basis of recording: Mix accrual and cash basis General government includes: Central Government; State Government; Valuation of public debt: Nominal value. Authorities report on stock of debt on a nominal basis. Data for the DSA are calculated discounting maturities over the relevant period Instruments included in gross and net debt: OT's BT's, other financing , leasing and captures State-owned Enterprises debt not previously reported. Primary domestic currency: Mozambican metical Data last updated: 09/2021",-0.002,-0.009,-0.005,-0.021,-0.019,-0.019,-0.026,-0.05,-0.072,-0.074,-0.145,-0.111,-0.13,-0.283,-0.715,-0.679,-0.944,-1.018,-0.709,-0.252,-1.138,-5.187,-4.741,-4.126,-5.678,-4.21,-7.328,-6.121,-5.958,-14.668,-13.191,-18.425,-16.334,-12.754,-54.96,-42.479,-38.538,-16.752,-50.023,-1.422,-49.847,-77.579,-96.285,-102.353,-102.036,-92.355,-39.805,2020.0
5343,688,MOZ,GGXCNL_NGDP,Mozambique,General government net lending/borrowing,"Net lending (+)/ borrowing (-) is calculated as revenue minus total expenditure. This is a core GFS balance that measures the extent to which general government is either putting financial resources at the disposal of other sectors in the economy and nonresidents (net lending), or utilizing the financial resources generated by other sectors and nonresidents (net borrowing). This balance may be viewed as an indicator of the financial impact of general government activity on the rest of the economy and nonresidents (GFSM 2001, paragraph 4.17). Note: Net lending (+)/borrowing (-) is also equal to net acquisition of financial assets minus net incurrence of liabilities.",Percent of GDP,,See notes for:  General government net lending/borrowing (National currency).,-1.475,-7.413,-3.609,-15.77,-13.395,-9.689,-12.103,-7.24,-6.472,-4.232,-4.416,-2.13,-1.962,-2.673,-4.232,-2.594,-2.166,-1.896,-1.134,-0.33,-1.321,-4.641,-3.527,-2.753,-3.295,-2.137,-3.144,-2.266,-1.953,-4.474,-3.498,-4.408,-3.521,-2.496,-9.895,-6.661,-5.12,-1.993,-5.586,-0.148,-5.115,-7.344,-8.205,-7.341,-6.699,-5.55,-1.99,2020.0
5346,688,MOZ,GGXONLB,Mozambique,General government primary net lending/borrowing,Primary net lending/borrowing is net lending (+)/borrowing (-) plus net interest payable/paid (interest expense minus interest revenue).,National currency,Billions,"Source: Ministry of Finance or Treasury Latest actual data: 2020 Fiscal assumptions: Fiscal projections assume an increase in non-LNG revenue broadly in line with non-LNG GDP while primary spending increases to reflect additional spending to address COVID, security issues, and wage increases in 2021 and 2022. Primary spending is then assumed to increase in line with a fraction of non-LNG GDP and/or inflation. Start/end months of reporting year: January/December GFS Manual used: Government Finance Statistics Manual (GFSM) 2001 Basis of recording: Mix accrual and cash basis General government includes: Central Government; State Government; Valuation of public debt: Nominal value. Authorities report on stock of debt on a nominal basis. Data for the DSA are calculated discounting maturities over the relevant period Instruments included in gross and net debt: OT's BT's, other financing , leasing and captures State-owned Enterprises debt not previously reported. Primary domestic currency: Mozambican metical Data last updated: 09/2021",-0.002,-0.009,-0.005,-0.021,-0.019,-0.019,-0.025,-0.042,-0.057,-0.043,-0.101,-0.065,-0.017,-0.084,-0.564,-0.335,-0.471,-0.488,-0.246,0.072,-1.028,-4.71,-3.467,-2.808,-4.357,-2.962,-5.948,-4.845,-4.701,-13.306,-10.518,-14.843,-12.209,-8.777,-49.244,-34.857,-20.059,8.131,-10.39,29.746,-19.172,-30.273,-35.325,-34.356,-23.536,-5.656,59.059,2020.0
5347,688,MOZ,GGXONLB_NGDP,Mozambique,General government primary net lending/borrowing,Primary net lending/borrowing is net lending (+)/borrowing (-) plus net interest payable/paid (interest expense minus interest revenue).,Percent of GDP,,See notes for:  General government primary net lending/borrowing (National currency).,-1.468,-7.404,-3.599,-15.729,-13.355,-9.641,-11.73,-6.046,-5.089,-2.474,-3.057,-1.247,-0.255,-0.795,-3.341,-1.279,-1.081,-0.909,-0.393,0.094,-1.194,-4.214,-2.579,-1.873,-2.528,-1.504,-2.552,-1.794,-1.541,-4.058,-2.789,-3.551,-2.632,-1.718,-8.866,-5.466,-2.665,0.967,-1.16,3.09,-1.967,-2.866,-3.01,-2.464,-1.545,-0.34,2.953,2020.0
5352,688,MOZ,NGDP_FY,Mozambique,"Gross domestic product corresponding to fiscal year, current prices","Gross domestic product corresponding to fiscal year is the country's GDP based on the same period during the year as their fiscal data. In the case of countries whose fiscal data are based on a fiscal calendar (e.g., July to June), this series would be the country's GDP over that same period. For countries whose fiscal data are based on a calendar year (i.e., January to December), this series will be the same as their GDP in current prices.",National currency,Billions,"Source: Ministry of Finance or Treasury Latest actual data: 2020 Fiscal assumptions: Fiscal projections assume an increase in non-LNG revenue broadly in line with non-LNG GDP while primary spending increases to reflect additional spending to address COVID, security issues, and wage increases in 2021 and 2022. Primary spending is then assumed to increase in line with a fraction of non-LNG GDP and/or inflation. Start/end months of reporting year: January/December GFS Manual used: Government Finance Statistics Manual (GFSM) 2001 Basis of recording: Mix accrual and cash basis General government includes: Central Government; State Government; Valuation of public debt: Nominal value. Authorities report on stock of debt on a nominal basis. Data for the DSA are calculated discounting maturities over the relevant period Instruments included in gross and net debt: OT's BT's, other financing , leasing and captures State-owned Enterprises debt not previously reported. Primary domestic currency: Mozambican metical Data last updated: 09/2021",0.161,0.126,0.138,0.132,0.145,0.195,0.215,0.693,1.112,1.746,3.29,5.212,6.644,10.575,16.887,26.17,43.558,53.664,62.506,76.349,86.132,111.77,134.42,149.909,172.321,196.989,233.1,270.053,305.123,327.866,377.115,418.037,463.921,510.997,555.447,637.76,752.702,840.526,895.567,962.621,974.511,1056.38,1173.52,1394.35,1523.12,1663.92,2000.03,2020.0
5353,688,MOZ,BCA,Mozambique,Current account balance,"Current account is all transactions other than those in financial and capital items. The major classifications are goods and services, income and current transfers. The focus of the BOP is on transactions (between an economy and the rest of the world) in goods, services, and income.",U.S. dollars,Billions,"Source: Central Bank. Data provided by Bank de Mozambique (BOM). Latest actual data: 2019 Notes: Data prior to 1992 cannot be confirmed by national sources at this time. BOP Manual used: Balance of Payments and International Investment Position Manual, sixth edition (BPM6) Primary domestic currency: Mozambican metical Data last updated: 09/2021",-0.367,-0.407,-0.497,-0.415,-0.308,-0.301,-0.409,-0.389,-0.359,-0.46,-0.517,-0.554,-0.501,-0.609,-0.648,-0.464,-0.561,-0.438,-0.774,-0.855,-0.697,-0.649,-0.869,-0.817,-0.479,-0.761,-0.755,-0.786,-1.147,-1.226,-1.679,-3.329,-6.79,-6.875,-6.437,-5.968,-3.846,-2.586,-4.499,-3.022,-3.813,-5.381,-3.854,-7.284,-7.964,-8.58,-6.782,2019.0
5354,688,MOZ,BCA_NGDPD,Mozambique,Current account balance,"Current account is all transactions other than those in financial and capital items. The major classifications are goods and services, income and current transfers. The focus of the BOP is on transactions (between an economy and the rest of the world) in goods, services, and income.",Percent of GDP,,"See notes for:  Gross domestic product, current prices (National currency) Current account balance (U.S. dollars).",-7.952,-11.356,-13.559,-12.662,-9.027,-6.668,-7.722,-16.234,-17.034,-20.927,-14.663,-15.239,-18.992,-22.326,-23.157,-16.007,-14.548,-9.411,-14.698,-14.299,-12.32,-12.029,-15.31,-12.954,-6.281,-8.904,-8.232,-7.523,-9.137,-10.292,-15.124,-23.146,-41.527,-40.505,-36.336,-37.414,-32.219,-19.559,-30.307,-19.638,-27.178,-33.984,-22.999,-37.631,-38.854,-39.557,-26.878,2019.0
