,WEO Country Code,ISO,WEO Subject Code,Country,Subject Descriptor,Subject Notes,Units,Scale,Country/Series-specific Notes,1980,1981,1982,1983,1984,1985,1986,1987,1988,1989,1990,1991,1992,1993,1994,1995,1996,1997,1998,1999,2000,2001,2002,2003,2004,2005,2006,2007,2008,2009,2010,2011,2012,2013,2014,2015,2016,2017,2018,2019,2020,2021,2022,2023,2024,2025,2026,Estimates Start After
6300,359,PRI,NGDP_R,Puerto Rico,"Gross domestic product, constant prices","Expressed in billions of national currency units; the base year is country-specific. Expenditure-based GDP is total final expenditures at purchasers' prices (including the f.o.b. value of exports of goods and services), less the f.o.b. value of imports of goods and services. [SNA 1993]",National currency,Billions,Source: National Statistics Office. Puerto Rico Planning Board Latest actual data: FY2019/20. FY(t/t+1)=CY(t+1) National accounts manual used: Other GDP valuation: Market prices Start/end months of reporting year: July/June Base year: 1954 Chain-weighted: No Primary domestic currency: US dollar Data last updated: 09/2021,4.662,4.712,4.569,4.59,4.926,5.027,5.438,5.705,6.077,6.377,6.618,6.77,7.079,7.408,7.718,8.069,8.256,8.659,9.223,9.63,9.945,10.887,11.123,11.384,11.61,11.379,11.219,11.088,10.884,10.671,10.627,10.589,10.592,10.56,10.434,10.325,10.194,9.9,9.489,9.63,9.254,9.198,9.171,9.143,9.116,9.089,9.052,2020.0
6302,359,PRI,NGDP,Puerto Rico,"Gross domestic product, current prices","Expressed in billions of national currency units. Expenditure-based GDP is total final expenditures at purchasers' prices (including the f.o.b. value of exports of goods and services), less the f.o.b. value of imports of goods and services. [SNA 1993]",National currency,Billions,Source: National Statistics Office. Puerto Rico Planning Board Latest actual data: FY2019/20. FY(t/t+1)=CY(t+1) National accounts manual used: Other GDP valuation: Market prices Start/end months of reporting year: July/June Base year: 1954 Chain-weighted: No Primary domestic currency: US dollar Data last updated: 09/2021,14.436,15.956,16.764,17.277,19.163,20.289,21.969,23.878,26.178,28.267,30.604,32.287,34.63,36.923,39.691,42.647,45.341,48.187,54.086,57.841,61.702,69.669,72.546,75.834,80.322,83.915,87.276,89.524,93.639,96.386,98.381,100.352,101.565,102.45,102.446,103.376,104.337,103.446,104.925,104.915,103.138,106.576,108.267,109.507,110.463,111.59,112.884,2020.0
6303,359,PRI,NGDPD,Puerto Rico,"Gross domestic product, current prices","Values are based upon GDP in national currency converted to U.S. dollars using market exchange rates (yearly average). Exchange rate projections are provided by country economists for the group of other emerging market and developing countries. Exchanges rates for advanced economies are established in the WEO assumptions for each WEO exercise. Expenditure-based GDP is total final expenditures at purchasers' prices (including the f.o.b. value of exports of goods and services), less the f.o.b. value of imports of goods and services. [SNA 1993]",U.S. dollars,Billions,"See notes for:  Gross domestic product, current prices (National currency).",14.436,15.956,16.764,17.277,19.163,20.289,21.969,23.878,26.178,28.267,30.604,32.287,34.63,36.923,39.691,42.647,45.341,48.187,54.086,57.841,61.702,69.669,72.546,75.834,80.322,83.915,87.276,89.524,93.639,96.386,98.381,100.352,101.565,102.45,102.446,103.376,104.337,103.446,104.925,104.915,103.138,106.576,108.267,109.507,110.463,111.59,112.884,2020.0
6304,359,PRI,PPPGDP,Puerto Rico,"Gross domestic product, current prices","These data form the basis for the country weights used to generate the World Economic Outlook country group composites for the domestic economy.   The IMF is not a primary source for purchasing power parity (PPP) data. WEO weights have been created from primary sources and are used solely for purposes of generating country group composites. For primary source information, please refer to one of the following sources: the Organization for Economic Cooperation and Development, the World Bank, or the Penn World Tables.   For further information see Box 1.1 in the October 2020 World Economic Outlook, ""Revised Purchasing Power Parity Weights"" in the July 2014 WEO Update, Box A2 in the April 2004 World Economic Outlook, Box A1 in the May 2000 World Economic Outlook, and Annex IV in the May 1993 World Economic Outlook for summaries of the revised PPP-based weights; and Box 1.2 in the September 2003 World Economic Outlook for a discussion on the measurement of global growth. See also Anne Marie Gulde and Marianne Schulze-Ghattas, Purchasing Power Parity Based Weights for the World Economic Outlook, in Staff Studies for the World Economic Outlook (Washington: IMF, December 1993), pp. 106-23.",Purchasing power parity; international dollars,Billions,"See notes for:  Gross domestic product, current prices (National currency).",22.184,24.543,25.264,26.377,29.329,30.879,34.073,36.632,40.392,44.05,47.426,50.16,53.645,57.467,61.151,65.274,68.007,72.555,78.154,82.753,87.397,97.827,101.508,105.935,110.94,112.145,113.976,115.696,115.74,114.207,115.102,117.073,118.421,119.192,119.065,118.146,117.009,114.27,112.142,115.845,112.663,116.023,118.858,121.321,123.714,126.023,128.12,2020.0
6305,359,PRI,NGDP_D,Puerto Rico,"Gross domestic product, deflator",The GDP deflator is derived by dividing current price GDP by constant price GDP and is considered to be an alternate measure of inflation. Data are expressed in the base year of each country's national accounts.,Index,,"See notes for:  Gross domestic product, constant prices (National currency) Gross domestic product, current prices (National currency).",309.628,338.597,366.944,376.397,389.017,403.572,404.013,418.53,430.814,443.283,462.448,476.892,489.178,498.407,514.247,528.513,549.186,556.503,586.411,600.615,620.405,639.925,652.2,666.163,691.843,737.438,777.946,807.367,860.347,903.214,925.741,947.68,958.855,970.189,981.836,1001.25,1023.49,1044.91,1105.75,1089.46,1114.52,1158.63,1180.56,1197.67,1211.76,1227.8,1247.03,2020.0
6306,359,PRI,NGDPRPC,Puerto Rico,"Gross domestic product per capita, constant prices",GDP is expressed in constant national currency per person. Data are derived by dividing constant price GDP by total population.,National currency,Units,"See notes for:  Gross domestic product, constant prices (National currency) Population (Persons).",1455.67,1459.19,1402.65,1396.72,1485.14,1501.25,1607.75,1669.51,1759.31,1825.99,1876.01,1906.82,1980.35,2057.66,2127.96,2207.63,2240.59,2330.34,2460.76,2546.26,2609.93,2850.92,2909.04,2975.28,3033.78,2977.79,2948.27,2931.12,2893.99,2853.0,2855.63,2878.49,2914.39,2938.93,2951.75,2971.81,2988.36,3000.0,2965.31,3009.38,2929.09,2946.88,2973.72,3000.81,3028.15,3055.73,3080.47,2020.0
6307,359,PRI,NGDPRPPPPC,Puerto Rico,"Gross domestic product per capita, constant prices",GDP is expressed in constant international dollars per person. Data are derived by dividing constant price purchasing-power parity (PPP) GDP by total population.,Purchasing power parity; 2017 international dollar,Units,"See notes for:  Gross domestic product, constant prices (National currency) Population (Persons).",16801.89,16842.61,16189.93,16121.45,17142.05,17328.07,18557.26,19270.14,20306.64,21076.31,21653.67,22009.33,22858.01,23750.37,24561.74,25481.32,25861.84,26897.72,28403.1,29389.91,30124.84,32906.42,33577.33,34341.88,35017.11,34370.83,34030.14,33832.14,33403.59,32930.52,32960.84,33224.69,33639.04,33922.3,34070.28,34301.81,34492.82,34627.22,34226.85,34735.43,33808.75,34014.07,34323.91,34636.58,34952.1,35270.48,35556.08,2020.0
6308,359,PRI,NGDPPC,Puerto Rico,"Gross domestic product per capita, current prices",GDP is expressed in current national currency per person. Data are derived by dividing current price GDP by total population.,National currency,Units,"See notes for:  Gross domestic product, current prices (National currency) Population (Persons).",4507.15,4940.78,5146.93,5257.19,5777.44,6058.64,6495.5,6987.4,7579.34,8094.29,8675.58,9093.48,9687.44,10255.53,10942.95,11667.59,12305.02,12968.39,14430.16,15293.18,16192.13,18243.71,18972.77,19820.21,20988.99,21959.32,22935.95,23664.87,24898.34,25768.73,26435.74,27278.85,27944.74,28513.15,28981.34,29755.35,30585.55,31347.27,32789.06,32785.94,32645.4,34143.27,35106.44,35939.72,36693.81,37518.2,38414.45,2020.0
6309,359,PRI,NGDPDPC,Puerto Rico,"Gross domestic product per capita, current prices",GDP is expressed in current U.S. dollars per person. Data are derived by first converting GDP in national currency to U.S. dollars and then dividing it by total population.,U.S. dollars,Units,"See notes for:  Gross domestic product, current prices (National currency) Population (Persons).",4507.15,4940.78,5146.93,5257.19,5777.44,6058.64,6495.5,6987.4,7579.34,8094.29,8675.58,9093.48,9687.44,10255.53,10942.95,11667.59,12305.02,12968.39,14430.16,15293.18,16192.13,18243.71,18972.77,19820.21,20988.99,21959.32,22935.95,23664.87,24898.34,25768.73,26435.74,27278.85,27944.74,28513.15,28981.34,29755.35,30585.55,31347.27,32789.06,32785.94,32645.4,34143.27,35106.44,35939.72,36693.81,37518.2,38414.45,2020.0
6310,359,PRI,PPPPC,Puerto Rico,"Gross domestic product per capita, current prices","Expressed in GDP in PPP dollars per person. Data are derived by dividing GDP in PPP dollars by total population. These data form the basis for the country weights used to generate the World Economic Outlook country group composites for the domestic economy.   The IMF is not a primary source for purchasing power parity (PPP) data. WEO weights have been created from primary sources and are used solely for purposes of generating country group composites. For primary source information, please refer to one of the following sources: the Organization for Economic Cooperation and Development, the World Bank, or the Penn World Tables.  For further information see Box 1.1 in the October 2020 World Economic Outlook, ""Revised Purchasing Power Parity Weights"" in the July 2014 WEO Update, Box A2 in the April 2004 World Economic Outlook, Box A1 in the May 2000 World Economic Outlook, and Annex IV in the May 1993 World Economic Outlook for summaries of the revised PPP-based weights; and Box 1.2 in the September 2003 World Economic Outlook for a discussion on the measurement of global growth. See also Anne Marie Gulde and Marianne Schulze-Ghattas, Purchasing Power Parity Based Weights for the World Economic Outlook, in Staff Studies for the World Economic Outlook (Washington: IMF, December 1993), pp. 106-23.",Purchasing power parity; international dollars,Units,"See notes for:  Gross domestic product, current prices (National currency) Population (Persons).",6926.13,7599.76,7756.65,8026.31,8842.46,9221.03,10073.98,10719.71,11694.65,12613.88,13444.41,14127.39,15006.51,15961.9,16859.79,17857.76,18456.31,19526.55,20851.48,21879.94,22935.17,25617.33,26547.02,27687.39,28989.62,29346.91,29952.59,30583.06,30774.71,30533.32,30928.78,31824.12,32582.63,33172.65,33682.72,34006.72,34300.2,34627.22,35044.47,36201.44,35660.27,37169.69,38540.65,39817.14,41095.66,42370.86,43599.06,2020.0
6312,359,PRI,PPPSH,Puerto Rico,Gross domestic product based on purchasing-power-parity (PPP) share of world total,"Expressed in percent of world GDP in PPP dollars. These data form the basis for the country weights used to generate the World Economic Outlook country group composites for the domestic economy.   The IMF is not a primary source for purchasing power parity (PPP) data. WEO weights have been created from primary sources and are used solely for purposes of generating country group composites. For primary source information, please refer to one of the following sources: the Organization for Economic Cooperation and Development, the World Bank, or the Penn World Tables.  For further information see Box 1.1 in the October 2020 World Economic Outlook, ""Revised Purchasing Power Parity Weights"" in the July 2014 WEO Update, Box A2 in the April 2004 World Economic Outlook, Box A1 in the May 2000 World Economic Outlook, and Annex IV in the May 1993 World Economic Outlook for summaries of the revised PPP-based weights; and Box 1.2 in the September 2003 World Economic Outlook for a discussion on the measurement of global growth. See also Anne Marie Gulde and Marianne Schulze-Ghattas, Purchasing Power Parity Based Weights for the World Economic Outlook, in Staff Studies for the World Economic Outlook (Washington: IMF, December 1993), pp. 106-23.",Percent,,"See notes for:  Gross domestic product, current prices (National currency).",0.166,0.165,0.159,0.156,0.161,0.158,0.166,0.167,0.171,0.173,0.172,0.172,0.162,0.166,0.168,0.17,0.167,0.168,0.175,0.176,0.174,0.186,0.184,0.181,0.176,0.164,0.154,0.144,0.138,0.136,0.128,0.123,0.118,0.113,0.109,0.106,0.101,0.094,0.087,0.086,0.085,0.08,0.076,0.073,0.071,0.068,0.066,2020.0
6313,359,PRI,PPPEX,Puerto Rico,Implied PPP conversion rate,"Expressed in national currency per current international dollar. These data form the basis for the country weights used to generate the World Economic Outlook country group composites for the domestic economy.   The IMF is not a primary source for purchasing power parity (PPP) data. WEO weights have been created from primary sources and are used solely for purposes of generating country group composites. For primary source information, please refer to one of the following sources: the Organization for Economic Cooperation and Development, the World Bank, or the Penn World Tables.  For further information see Box 1.1 in the October 2020 World Economic Outlook, ""Revised Purchasing Power Parity Weights"" in the July 2014 WEO Update, Box A2 in the April 2004 World Economic Outlook, Box A1 in the May 2000 World Economic Outlook, and Annex IV in the May 1993 World Economic Outlook for summaries of the revised PPP-based weights; and Box 1.2 in the September 2003 World Economic Outlook for a discussion on the measurement of global growth. See also Anne Marie Gulde and Marianne Schulze-Ghattas, Purchasing Power Parity Based Weights for the World Economic Outlook, in Staff Studies for the World Economic Outlook (Washington: IMF, December 1993), pp. 106-23.",National currency per current international dollar,,"See notes for:  Gross domestic product, current prices (National currency).",0.651,0.65,0.664,0.655,0.653,0.657,0.645,0.652,0.648,0.642,0.645,0.644,0.646,0.643,0.649,0.653,0.667,0.664,0.692,0.699,0.706,0.712,0.715,0.716,0.724,0.748,0.766,0.774,0.809,0.844,0.855,0.857,0.858,0.86,0.86,0.875,0.892,0.905,0.936,0.906,0.915,0.919,0.911,0.903,0.893,0.885,0.881,2020.0
6314,359,PRI,NID_NGDP,Puerto Rico,Total investment,Expressed as a ratio of total investment in current local currency and GDP in current local currency. Investment or gross capital formation is measured by the total value of the gross fixed capital formation and changes in inventories and acquisitions less disposals of valuables for a unit or sector. [SNA 1993],Percent of GDP,,Source: National Statistics Office. Puerto Rico Planning Board Latest actual data: FY2019/20. FY(t/t+1)=CY(t+1) National accounts manual used: Other GDP valuation: Market prices Start/end months of reporting year: July/June Base year: 1954 Chain-weighted: No Primary domestic currency: US dollar Data last updated: 09/2021,17.136,14.338,9.037,10.108,13.753,12.325,10.281,13.715,15.587,17.277,16.954,15.598,15.453,16.049,16.329,16.869,17.455,18.566,16.918,20.7,19.714,17.453,15.988,15.322,15.317,14.596,13.991,13.391,12.146,10.431,9.16,10.07,10.335,9.529,8.941,8.599,8.075,7.793,14.501,14.31,11.511,10.132,8.892,8.249,7.653,7.522,7.538,2020.0
6316,359,PRI,PCPI,Puerto Rico,"Inflation, average consumer prices","Expressed in averages for the year, not end-of-period data. A consumer price index (CPI) measures changes in the prices of goods and services that households consume. Such changes affect the real purchasing power of consumers' incomes and their welfare. As the prices of different goods and services do not all change at the same rate, a price index can only reflect their average movement. A price index is typically assigned a value of unity, or 100, in some reference period and the values of the index for other periods of time are intended to indicate the average proportionate, or percentage, change in prices from this price reference period. Price indices can also be used to measure differences in price levels between different cities, regions or countries at the same point in time. [CPI Manual 2004, Introduction] For euro countries, consumer prices are calculated based on harmonized prices. For more information see http://epp.eurostat.ec.europa.eu/cache/ITY_OFFPUB/KS-BE-04-001/EN/KS-BE-04-001-EN.PDF.]",Index,,"Source: National Statistics Office Latest actual data: 2020 Harmonized prices: No Frequency of source data: Monthly Base year: 2006. Base year, December 2006. Primary domestic currency: US dollar Data last updated: 09/2021",54.91,60.11,62.06,62.27,63.35,63.484,63.334,64.65,66.316,68.194,71.173,72.766,73.847,74.561,75.633,77.081,79.634,81.136,81.184,81.729,84.244,84.735,84.896,86.074,88.257,93.209,98.041,102.186,107.51,107.809,110.476,113.679,115.209,116.431,117.09,116.211,115.87,117.9,119.4,119.5,118.906,123.611,125.951,127.776,129.28,130.991,133.043,2020.0
6318,359,PRI,PCPIE,Puerto Rico,"Inflation, end of period consumer prices","Expressed in end of the period, not annual average data. A consumer price index (CPI) measures changes in the prices of goods and services that households consume. Such changes affect the real purchasing power of consumers' incomes and their welfare. As the prices of different goods and services do not all change at the same rate, a price index can only reflect their average movement. A price index is typically assigned a value of unity, or 100, in some reference period and the values of the index for other periods of time are intended to indicate the average proportionate, or percentage, change in prices from this price reference period. Price indices can also be used to measure differences in price levels between different cities, regions or countries at the same point in time. [CPI Manual 2004, Introduction] For euro countries, consumer prices are calculated based on harmonized prices. For more information see http://epp.eurostat.ec.europa.eu/cache/ITY_OFFPUB/KS-BE-04-001/EN/KS-BE-04-001-EN.PDF.",Index,,"Source: National Statistics Office Latest actual data: 2020 Harmonized prices: No Frequency of source data: Monthly Base year: 2006. Base year, December 2006. Primary domestic currency: US dollar Data last updated: 09/2021",57.13,61.37,62.21,62.84,63.26,63.369,63.684,65.444,67.301,69.122,73.012,73.66,74.47,74.424,76.046,78.019,81.062,81.361,81.211,82.476,85.387,83.714,85.646,86.109,90.363,95.676,100.0,104.248,105.666,109.792,110.371,113.976,115.289,116.224,116.305,116.12,116.646,118.0,118.672,119.3,119.202,123.919,126.264,128.094,129.602,131.317,133.374,2020.0
6325,359,PRI,LUR,Puerto Rico,Unemployment rate,"Unemployment rate can be defined by either the national definition, the ILO harmonized definition, or the OECD harmonized definition. The OECD harmonized unemployment rate gives the number of unemployed persons as a percentage of the labor force (the total number of people employed plus unemployed). [OECD Main Economic Indicators, OECD, monthly] As defined by the International Labour Organization, unemployed workers are those who are currently not working but are willing and able to work for pay, currently available to work, and have actively searched for work. [ILO, http://www.ilo.org/public/english/bureau/stat/res/index.htm]",Percent of total labor force,,Source: National Statistics Office Latest actual data: 2020 Employment type: National definition. Consistent with U.S. definition Primary domestic currency: US dollar Data last updated: 09/2021,17.1,19.8,22.8,23.4,20.7,21.8,18.9,16.8,15.0,14.6,14.2,16.0,16.7,17.0,14.6,13.7,13.4,13.5,13.3,11.7,10.1,11.4,12.3,12.0,10.6,11.3,10.5,11.2,11.8,15.3,16.4,15.9,14.5,14.3,13.9,12.0,11.8,10.8,9.2,8.3,8.9,8.7,8.5,8.3,8.3,8.3,8.3,2020.0
6326,359,PRI,LE,Puerto Rico,Employment,"Employment can be defined by either the national definition, the ILO harmonized definition, or the OECD harmonized definition. Persons who during a specified brief period such as one week or one day, (a) performed some work for wage or salary in cash or in kind, (b) had a formal attachment to their job but were temporarily not at work during the reference period, (c) performed some work for profit or family gain in cash or in kind, (d) were with an enterprise such as a business, farm or service but who were temporarily not at work during the reference period for any specific reason. [Current International Recommendations on Labour Statistics, 1988 Edition, ILO, Geneva, page 47]",Persons,Millions,Source: National Statistics Office Latest actual data: 2020 Employment type: National definition. Consistent with U.S. definition Primary domestic currency: US dollar Data last updated: 09/2021,0.76,0.742,0.709,0.731,0.773,0.776,0.834,0.88,0.938,0.952,0.972,0.982,0.992,1.01,1.032,1.076,1.112,1.133,1.136,1.142,1.161,1.129,1.159,1.185,1.205,1.222,1.271,1.232,1.187,1.102,1.061,1.027,1.027,1.003,0.986,0.988,0.989,1.0,0.985,0.99,0.966,0.898,0.894,,,,,2020.0
6327,359,PRI,LP,Puerto Rico,Population,"For census purposes, the total population of the country consists of all persons falling within the scope of the census. In the broadest sense, the total may comprise either all usual residents of the country or all persons present in the country at the time of the census. [Principles and Recommendations for Population and Housing Censuses, Revision 1, paragraph 2.42]",Persons,Millions,Source: National Statistics Office Latest actual data: 2020 Primary domestic currency: US dollar Data last updated: 09/2021,3.203,3.229,3.257,3.286,3.317,3.349,3.382,3.417,3.454,3.492,3.528,3.551,3.575,3.6,3.627,3.655,3.685,3.716,3.748,3.782,3.811,3.819,3.824,3.826,3.827,3.821,3.805,3.783,3.761,3.74,3.722,3.679,3.634,3.593,3.535,3.474,3.411,3.3,3.2,3.2,3.159,3.121,3.084,3.047,3.01,2.974,2.939,2020.0
