,WEO Country Code,ISO,WEO Subject Code,Country,Subject Descriptor,Subject Notes,Units,Scale,Country/Series-specific Notes,1980,1981,1982,1983,1984,1985,1986,1987,1988,1989,1990,1991,1992,1993,1994,1995,1996,1997,1998,1999,2000,2001,2002,2003,2004,2005,2006,2007,2008,2009,2010,2011,2012,2013,2014,2015,2016,2017,2018,2019,2020,2021,2022,2023,2024,2025,2026,Estimates Start After
6750,942,SRB,NGDP_R,Serbia,"Gross domestic product, constant prices","Expressed in billions of national currency units; the base year is country-specific. Expenditure-based GDP is total final expenditures at purchasers' prices (including the f.o.b. value of exports of goods and services), less the f.o.b. value of imports of goods and services. [SNA 1993]",National currency,Billions,"Source: National Statistics Office. Statistical Office of the Republic of Serbia Latest actual data: 2020. The country in its current form has been in existence since 1992. Official data are only available from 1999 onward. The data prior to 1992 is presumably for the former SFR Yugoslavia. Metadata analysis available through the statistics office. National accounts manual used: European System of Accounts (ESA) 2010 GDP valuation: Market prices Start/end months of reporting year: January/December Base year: 2015 Chain-weighted: Yes, from 2010 Primary domestic currency: Serbian dinar Data last updated: 09/2021",,,,,,,,,,,,,,,,,,,2671.52,2347.02,2529.13,2655.4,2844.35,2969.94,3238.62,3567.48,3749.7,3991.16,4216.88,4101.69,4131.67,4215.8,4187.07,4308.19,4239.71,4315.02,4459.08,4552.77,4757.43,4959.55,4910.96,5232.14,5467.56,5713.6,5942.15,6182.63,6432.22,2020.0
6751,942,SRB,NGDP_RPCH,Serbia,"Gross domestic product, constant prices","Annual percentages of constant price GDP are year-on-year changes; the base year is country-specific. Expenditure-based GDP is total final expenditures at purchasers' prices (including the f.o.b. value of exports of goods and services), less the f.o.b. value of imports of goods and services. [SNA 1993]",Percent change,,"See notes for:  Gross domestic product, constant prices (National currency).",,,,,,,,,,,,,,,,,,,,-12.147,7.759,4.993,7.116,4.415,9.047,10.154,5.108,6.44,5.656,-2.732,0.731,2.036,-0.682,2.893,-1.59,1.776,3.339,2.101,4.495,4.249,-0.98,6.54,4.5,4.5,4.0,4.047,4.037,2020.0
6752,942,SRB,NGDP,Serbia,"Gross domestic product, current prices","Expressed in billions of national currency units. Expenditure-based GDP is total final expenditures at purchasers' prices (including the f.o.b. value of exports of goods and services), less the f.o.b. value of imports of goods and services. [SNA 1993]",National currency,Billions,"Source: National Statistics Office. Statistical Office of the Republic of Serbia Latest actual data: 2020. The country in its current form has been in existence since 1992. Official data are only available from 1999 onward. The data prior to 1992 is presumably for the former SFR Yugoslavia. Metadata analysis available through the statistics office. National accounts manual used: European System of Accounts (ESA) 2010 GDP valuation: Market prices Start/end months of reporting year: January/December Base year: 2015 Chain-weighted: Yes, from 2010 Primary domestic currency: Serbian dinar Data last updated: 09/2021",,,,,,,,,,,,,,,,,,,,,413.406,821.41,1038.62,1221.0,1452.45,1848.13,2182.54,2525.24,2910.46,3054.25,3252.83,3614.77,3812.69,4124.05,4163.43,4315.02,4528.19,4760.69,5072.93,5417.73,5463.54,5986.37,6427.53,6905.28,7384.8,7901.82,8457.47,2020.0
6753,942,SRB,NGDPD,Serbia,"Gross domestic product, current prices","Values are based upon GDP in national currency converted to U.S. dollars using market exchange rates (yearly average). Exchange rate projections are provided by country economists for the group of other emerging market and developing countries. Exchanges rates for advanced economies are established in the WEO assumptions for each WEO exercise. Expenditure-based GDP is total final expenditures at purchasers' prices (including the f.o.b. value of exports of goods and services), less the f.o.b. value of imports of goods and services. [SNA 1993]",U.S. dollars,Billions,"See notes for:  Gross domestic product, current prices (National currency).",,,,,,,,,,,,,,,,,,,,,9.318,12.321,16.188,21.234,24.76,27.515,32.625,43.425,52.13,45.188,41.397,49.314,43.33,48.428,47.095,39.656,40.693,44.179,50.641,51.475,52.96,60.669,65.697,71.326,76.883,83.069,89.456,2020.0
6754,942,SRB,PPPGDP,Serbia,"Gross domestic product, current prices","These data form the basis for the country weights used to generate the World Economic Outlook country group composites for the domestic economy.   The IMF is not a primary source for purchasing power parity (PPP) data. WEO weights have been created from primary sources and are used solely for purposes of generating country group composites. For primary source information, please refer to one of the following sources: the Organization for Economic Cooperation and Development, the World Bank, or the Penn World Tables.   For further information see Box 1.1 in the October 2020 World Economic Outlook, ""Revised Purchasing Power Parity Weights"" in the July 2014 WEO Update, Box A2 in the April 2004 World Economic Outlook, Box A1 in the May 2000 World Economic Outlook, and Annex IV in the May 1993 World Economic Outlook for summaries of the revised PPP-based weights; and Box 1.2 in the September 2003 World Economic Outlook for a discussion on the measurement of global growth. See also Anne Marie Gulde and Marianne Schulze-Ghattas, Purchasing Power Parity Based Weights for the World Economic Outlook, in Staff Studies for the World Economic Outlook (Washington: IMF, December 1993), pp. 106-23.",Purchasing power parity; international dollars,Billions,"See notes for:  Gross domestic product, current prices (National currency).",,,,,,,,,,,,,,,,,,,,,47.453,50.944,55.42,59.009,66.075,75.067,81.336,88.913,95.743,93.724,95.544,99.515,100.38,104.877,104.603,105.951,111.92,116.697,124.856,132.489,132.772,146.552,157.362,168.356,179.081,190.376,202.166,2020.0
6755,942,SRB,NGDP_D,Serbia,"Gross domestic product, deflator",The GDP deflator is derived by dividing current price GDP by constant price GDP and is considered to be an alternate measure of inflation. Data are expressed in the base year of each country's national accounts.,Index,,"See notes for:  Gross domestic product, constant prices (National currency) Gross domestic product, current prices (National currency).",,,,,,,,,,,,,,,,,,,,,16.346,30.934,36.515,41.112,44.848,51.805,58.206,63.271,69.019,74.463,78.729,85.743,91.059,95.726,98.201,100.0,101.55,104.567,106.632,109.238,111.252,114.415,117.558,120.857,124.278,127.807,131.486,2020.0
6756,942,SRB,NGDPRPC,Serbia,"Gross domestic product per capita, constant prices",GDP is expressed in constant national currency per person. Data are derived by dividing constant price GDP by total population.,National currency,Units,"See notes for:  Gross domestic product, constant prices (National currency) Population (Persons).",,,,,,,,,,,,,,,,,,343309.92,353013.33,311258.9,336483.57,353891.21,379245.31,397019.63,433947.4,479450.0,505924.7,540691.71,573708.06,560277.96,566647.22,582573.49,581416.86,601152.11,594480.66,608144.82,631748.04,648464.01,681325.53,712193.33,708988.91,758390.54,795697.42,834843.74,871724.54,910645.8,951213.49,2020.0
6757,942,SRB,NGDPRPPPPC,Serbia,"Gross domestic product per capita, constant prices",GDP is expressed in constant international dollars per person. Data are derived by dividing constant price purchasing-power parity (PPP) GDP by total population.,Purchasing power parity; 2017 international dollar,Units,"See notes for:  Gross domestic product, constant prices (National currency) Population (Persons).",,,,,,,,,,,,,,,,,,8799.74,9048.46,7978.21,8624.77,9070.96,9720.84,10176.43,11122.97,12289.29,12967.89,13859.04,14705.32,14361.08,14524.33,14932.56,14902.91,15408.77,15237.76,15588.0,16193.0,16621.47,17463.78,18254.98,18172.85,19439.11,20395.36,21398.76,22344.09,23341.73,24381.56,2020.0
6758,942,SRB,NGDPPC,Serbia,"Gross domestic product per capita, current prices",GDP is expressed in current national currency per person. Data are derived by dividing current price GDP by total population.,National currency,Units,"See notes for:  Gross domestic product, current prices (National currency) Population (Persons).",,,,,,,,,,,,,,,,,,18805.97,24251.86,28490.42,55000.96,109471.2,138481.45,163222.91,194616.31,248378.97,294477.87,342100.36,395968.48,417200.79,446116.47,499517.09,529430.62,575458.04,583784.4,608144.83,641539.46,678077.59,726510.1,777988.04,788764.93,867715.85,935403.19,1008966.36,1083365.18,1163868.15,1250712.86,2020.0
6759,942,SRB,NGDPDPC,Serbia,"Gross domestic product per capita, current prices",GDP is expressed in current U.S. dollars per person. Data are derived by first converting GDP in national currency to U.S. dollars and then dividing it by total population.,U.S. dollars,Units,"See notes for:  Gross domestic product, current prices (National currency) Population (Persons).",,,,,,,,,,,,,,,,,,2927.95,2302.29,1508.72,1239.75,1642.08,2158.38,2838.5,3317.62,3697.9,4401.87,5882.94,7092.36,6172.49,5677.55,6814.65,6016.79,6757.47,6603.5,5588.98,5765.2,6292.55,7252.4,7391.84,7645.79,8793.84,9560.92,10421.8,11278.83,12235.27,13228.98,2020.0
6760,942,SRB,PPPPC,Serbia,"Gross domestic product per capita, current prices","Expressed in GDP in PPP dollars per person. Data are derived by dividing GDP in PPP dollars by total population. These data form the basis for the country weights used to generate the World Economic Outlook country group composites for the domestic economy.   The IMF is not a primary source for purchasing power parity (PPP) data. WEO weights have been created from primary sources and are used solely for purposes of generating country group composites. For primary source information, please refer to one of the following sources: the Organization for Economic Cooperation and Development, the World Bank, or the Penn World Tables.  For further information see Box 1.1 in the October 2020 World Economic Outlook, ""Revised Purchasing Power Parity Weights"" in the July 2014 WEO Update, Box A2 in the April 2004 World Economic Outlook, Box A1 in the May 2000 World Economic Outlook, and Annex IV in the May 1993 World Economic Outlook for summaries of the revised PPP-based weights; and Box 1.2 in the September 2003 World Economic Outlook for a discussion on the measurement of global growth. See also Anne Marie Gulde and Marianne Schulze-Ghattas, Purchasing Power Parity Based Weights for the World Economic Outlook, in Staff Studies for the World Economic Outlook (Washington: IMF, December 1993), pp. 106-23.",Purchasing power parity; international dollars,Units,"See notes for:  Gross domestic product, current prices (National currency) Population (Persons).",,,,,,,,,,,,,,,,,,,,,6313.28,6789.48,7389.3,7888.3,8853.46,10088.56,10974.13,12045.22,13025.83,12802.43,13103.6,13751.81,13938.82,14634.22,14667.21,14932.42,15856.45,16621.47,17880.96,19025.43,19168.07,21242.55,22900.96,24599.35,26271.54,28040.7,29896.81,2020.0
6761,942,SRB,NGAP_NPGDP,Serbia,Output gap in percent of potential GDP,"Output gaps for advanced economies are calculated as actual GDP less potential GDP as a percent of potential GDP. Estimates of output gaps are subject to a significant margin of uncertainty. For a discussion of approaches to calculating potential output, see Paula R. De Masi, IMF Estimates of Potential Output: Theory and Practice, in Staff Studies for the World Economic Outlook (Washington: IMF, December 1997), pp. 40-46.",Percent of potential GDP,,,,,,,,,,,,,,,,,,,,,,,,,,,,,,,,,,,,,,,,,,,,,,,,,,
6762,942,SRB,PPPSH,Serbia,Gross domestic product based on purchasing-power-parity (PPP) share of world total,"Expressed in percent of world GDP in PPP dollars. These data form the basis for the country weights used to generate the World Economic Outlook country group composites for the domestic economy.   The IMF is not a primary source for purchasing power parity (PPP) data. WEO weights have been created from primary sources and are used solely for purposes of generating country group composites. For primary source information, please refer to one of the following sources: the Organization for Economic Cooperation and Development, the World Bank, or the Penn World Tables.  For further information see Box 1.1 in the October 2020 World Economic Outlook, ""Revised Purchasing Power Parity Weights"" in the July 2014 WEO Update, Box A2 in the April 2004 World Economic Outlook, Box A1 in the May 2000 World Economic Outlook, and Annex IV in the May 1993 World Economic Outlook for summaries of the revised PPP-based weights; and Box 1.2 in the September 2003 World Economic Outlook for a discussion on the measurement of global growth. See also Anne Marie Gulde and Marianne Schulze-Ghattas, Purchasing Power Parity Based Weights for the World Economic Outlook, in Staff Studies for the World Economic Outlook (Washington: IMF, December 1993), pp. 106-23.",Percent,,"See notes for:  Gross domestic product, current prices (National currency).",,,,,,,,,,,,,,,,,,,,,0.094,0.097,0.101,0.101,0.105,0.11,0.11,0.111,0.114,0.111,0.106,0.104,0.1,0.1,0.096,0.095,0.097,0.096,0.097,0.098,0.101,0.101,0.101,0.102,0.103,0.103,0.104,2020.0
6763,942,SRB,PPPEX,Serbia,Implied PPP conversion rate,"Expressed in national currency per current international dollar. These data form the basis for the country weights used to generate the World Economic Outlook country group composites for the domestic economy.   The IMF is not a primary source for purchasing power parity (PPP) data. WEO weights have been created from primary sources and are used solely for purposes of generating country group composites. For primary source information, please refer to one of the following sources: the Organization for Economic Cooperation and Development, the World Bank, or the Penn World Tables.  For further information see Box 1.1 in the October 2020 World Economic Outlook, ""Revised Purchasing Power Parity Weights"" in the July 2014 WEO Update, Box A2 in the April 2004 World Economic Outlook, Box A1 in the May 2000 World Economic Outlook, and Annex IV in the May 1993 World Economic Outlook for summaries of the revised PPP-based weights; and Box 1.2 in the September 2003 World Economic Outlook for a discussion on the measurement of global growth. See also Anne Marie Gulde and Marianne Schulze-Ghattas, Purchasing Power Parity Based Weights for the World Economic Outlook, in Staff Studies for the World Economic Outlook (Washington: IMF, December 1993), pp. 106-23.",National currency per current international dollar,,"See notes for:  Gross domestic product, current prices (National currency).",,,,,,,,,,,,,,,,,,,,,8.712,16.124,18.741,20.692,21.982,24.62,26.834,28.401,30.399,32.588,34.045,36.324,37.982,39.323,39.802,40.726,40.459,40.795,40.63,40.892,41.15,40.848,40.846,41.016,41.237,41.506,41.834,2020.0
6764,942,SRB,NID_NGDP,Serbia,Total investment,Expressed as a ratio of total investment in current local currency and GDP in current local currency. Investment or gross capital formation is measured by the total value of the gross fixed capital formation and changes in inventories and acquisitions less disposals of valuables for a unit or sector. [SNA 1993],Percent of GDP,,"Source: National Statistics Office. Statistical Office of the Republic of Serbia Latest actual data: 2020. The country in its current form has been in existence since 1992. Official data are only available from 1999 onward. The data prior to 1992 is presumably for the former SFR Yugoslavia. Metadata analysis available through the statistics office. National accounts manual used: European System of Accounts (ESA) 2010 GDP valuation: Market prices Start/end months of reporting year: January/December Base year: 2015 Chain-weighted: Yes, from 2010 Primary domestic currency: Serbian dinar Data last updated: 09/2021",,,,,,,,,,,,,,,,,,18.014,13.058,9.756,10.72,19.35,21.367,22.311,30.104,22.541,21.762,25.07,26.522,18.737,17.814,18.38,19.217,17.317,16.715,18.681,18.078,19.575,22.655,25.104,23.173,24.414,24.153,24.179,24.33,24.457,24.709,2020.0
6765,942,SRB,NGSD_NGDP,Serbia,Gross national savings,"Expressed as a ratio of gross national savings in current local currency and GDP in current local currency. Gross national saving is gross disposable income less final consumption expenditure after taking account of an adjustment for pension funds. [SNA 1993] For many countries, the estimates of national saving are built up from national accounts data on gross domestic investment and from balance of payments-based data on net foreign investment.",Percent of GDP,,"Source: National Statistics Office. Statistical Office of the Republic of Serbia Latest actual data: 2020. The country in its current form has been in existence since 1992. Official data are only available from 1999 onward. The data prior to 1992 is presumably for the former SFR Yugoslavia. Metadata analysis available through the statistics office. National accounts manual used: European System of Accounts (ESA) 2010 GDP valuation: Market prices Start/end months of reporting year: January/December Base year: 2015 Chain-weighted: Yes, from 2010 Primary domestic currency: Serbian dinar Data last updated: 09/2021",,,,,,,,,,,,,,,,,,6.009,4.239,4.666,8.629,21.238,17.231,14.886,16.668,14.294,12.42,8.745,6.369,12.614,11.584,10.056,8.175,11.373,10.922,15.228,15.156,14.345,17.815,18.228,18.909,20.324,19.757,19.578,19.402,19.673,20.079,2020.0
6766,942,SRB,PCPI,Serbia,"Inflation, average consumer prices","Expressed in averages for the year, not end-of-period data. A consumer price index (CPI) measures changes in the prices of goods and services that households consume. Such changes affect the real purchasing power of consumers' incomes and their welfare. As the prices of different goods and services do not all change at the same rate, a price index can only reflect their average movement. A price index is typically assigned a value of unity, or 100, in some reference period and the values of the index for other periods of time are intended to indicate the average proportionate, or percentage, change in prices from this price reference period. Price indices can also be used to measure differences in price levels between different cities, regions or countries at the same point in time. [CPI Manual 2004, Introduction] For euro countries, consumer prices are calculated based on harmonized prices. For more information see http://epp.eurostat.ec.europa.eu/cache/ITY_OFFPUB/KS-BE-04-001/EN/KS-BE-04-001-EN.PDF.]",Index,,"Source: National Statistics Office. Statistical Office of the Republic of Serbia Latest actual data: 2020. There is a discrepancy between annual / quarterly CPI growth rate due to RPI being replaced with CPI starting in 2007. Quarterly CPI for 2006 constructed based on monthly data. Harmonized prices: No. Since January 2007, before retail prices approximating CPI by applying CPI weights. Frequency of source data: Monthly Base year: 2006. For the period, 2010-2014 cost structure weights are taken from the comprehensive results of the survey  Structures of operational income and expenditures of legal entities and unincorporated enterprises . For the years 2015 and onwards weights have been updated with new results obtained through the ad hoc SBS survey. Primary domestic currency: Serbian dinar Data last updated: 09/2021",,,,,,,,,,,,,,,,,,11.124,14.461,20.405,34.688,62.696,68.256,70.236,77.683,90.308,100.0,106.002,119.158,128.83,136.744,151.973,163.114,175.664,179.322,181.819,183.86,189.616,193.333,196.909,200.01,206.029,211.633,216.997,222.674,228.668,235.052,2020.0
6767,942,SRB,PCPIPCH,Serbia,"Inflation, average consumer prices",Annual percentages of average consumer prices are year-on-year changes.,Percent change,,"See notes for:  Inflation, average consumer prices (Index).",,,,,,,,,,,,,,,,,,,30.0,41.1,70.0,80.744,8.868,2.901,10.602,16.253,10.732,6.002,12.411,8.117,6.143,11.137,7.33,7.694,2.082,1.392,1.122,3.131,1.96,1.85,1.575,3.01,2.72,2.534,2.616,2.692,2.792,2020.0
6768,942,SRB,PCPIE,Serbia,"Inflation, end of period consumer prices","Expressed in end of the period, not annual average data. A consumer price index (CPI) measures changes in the prices of goods and services that households consume. Such changes affect the real purchasing power of consumers' incomes and their welfare. As the prices of different goods and services do not all change at the same rate, a price index can only reflect their average movement. A price index is typically assigned a value of unity, or 100, in some reference period and the values of the index for other periods of time are intended to indicate the average proportionate, or percentage, change in prices from this price reference period. Price indices can also be used to measure differences in price levels between different cities, regions or countries at the same point in time. [CPI Manual 2004, Introduction] For euro countries, consumer prices are calculated based on harmonized prices. For more information see http://epp.eurostat.ec.europa.eu/cache/ITY_OFFPUB/KS-BE-04-001/EN/KS-BE-04-001-EN.PDF.",Index,,"Source: National Statistics Office. Statistical Office of the Republic of Serbia Latest actual data: 2020. There is a discrepancy between annual / quarterly CPI growth rate due to RPI being replaced with CPI starting in 2007. Quarterly CPI for 2006 constructed based on monthly data. Harmonized prices: No. Since January 2007, before retail prices approximating CPI by applying CPI weights. Frequency of source data: Monthly Base year: 2006. For the period, 2010-2014 cost structure weights are taken from the comprehensive results of the survey  Structures of operational income and expenditures of legal entities and unincorporated enterprises . For the years 2015 and onwards weights have been updated with new results obtained through the ad hoc SBS survey. Primary domestic currency: Serbian dinar Data last updated: 09/2021",,,,,,,,,,,,,,,,,,11.923,17.218,25.036,53.067,67.001,68.682,71.503,81.657,94.591,100.0,111.025,120.555,128.514,141.68,151.603,170.074,173.808,176.854,179.605,182.356,187.858,191.592,195.137,197.585,205.686,209.8,215.674,221.282,227.256,233.619,2020.0
6769,942,SRB,PCPIEPCH,Serbia,"Inflation, end of period consumer prices",Annual percentages of end of period consumer prices are year-on-year changes.,Percent change,,"See notes for:  Inflation, end of period consumer prices (Index).",,,,,,,,,,,,,,,,,,,44.411,45.408,111.959,26.258,2.508,4.107,14.202,15.839,5.718,11.025,8.584,6.601,10.245,7.004,12.184,2.195,1.752,1.556,1.532,3.017,1.987,1.85,1.255,4.1,2.0,2.8,2.6,2.7,2.8,2020.0
6770,942,SRB,FLIBOR6,Serbia,Six-month London interbank offered rate (LIBOR),,Percent,,,,,,,,,,,,,,,,,,,,,,,,,,,,,,,,,,,,,,,,,,,,,,,,,,
6771,942,SRB,TM_RPCH,Serbia,Volume of imports of goods and services,"Percent change of volume of imports refers to the aggregate change in the quantities of total imports whose characteristics are unchanged. The goods and services and their prices are held constant, therefore changes are due to changes in quantities only. [Export and Import Price Index Manual: Theory and Practice, Glossary]",Percent change,,"Source: National Statistics Office. Serbian Statistical Office Latest actual data: 2020 Base year: 2009 Methodology used to derive volumes: Deflation by unit value indexes (from customs data) Formula used to derive volumes: Fisher, Laspeyres and Paasche formulas are used. Chain-weighted: Yes, from 1989 Trade System: General trade Excluded items in trade: In transit; Other;. Besides transit, excluded are also the temporary commodity transactions (fairs, test samples, etc.). Valuation of exports: Free on board (FOB) Valuation of imports: Cost, insurance, freight (CIF) Primary domestic currency: Serbian dinar Data last updated: 09/2021",,,,,,,,,,,,,,,,,,,,,,34.479,31.29,14.34,22.163,-10.882,10.247,26.478,5.85,-18.891,2.482,6.821,0.99,2.671,3.234,7.877,10.532,10.587,10.175,11.372,-2.559,15.144,7.0,6.238,5.83,6.078,6.08,2020.0
6772,942,SRB,TMG_RPCH,Serbia,Volume of Imports of goods,"Percent change of volume of imports of goods refers to the aggregate change in the quantities of imports of goods whose characteristics are unchanged. The goods and their prices are held constant, therefore changes are due to changes in quantities only. [Export and Import Price Index Manual: Theory and Practice, Glossary]",Percent change,,"Source: National Statistics Office. Serbian Statistical Office Latest actual data: 2020 Base year: 2009 Methodology used to derive volumes: Deflation by unit value indexes (from customs data) Formula used to derive volumes: Fisher, Laspeyres and Paasche formulas are used. Chain-weighted: Yes, from 1989 Trade System: General trade Excluded items in trade: In transit; Other;. Besides transit, excluded are also the temporary commodity transactions (fairs, test samples, etc.). Valuation of exports: Free on board (FOB) Valuation of imports: Cost, insurance, freight (CIF) Primary domestic currency: Serbian dinar Data last updated: 09/2021",,,,,,,,,,,,,,,,,,,,,,34.146,28.451,14.338,20.999,-13.604,7.79,26.014,6.463,-21.743,2.906,8.003,0.753,2.684,1.93,7.175,10.963,9.964,8.945,9.807,-0.254,17.572,6.572,6.072,5.572,5.872,5.872,2020.0
