,WEO Country Code,ISO,WEO Subject Code,Country,Subject Descriptor,Subject Notes,Units,Scale,Country/Series-specific Notes,1980,1981,1982,1983,1984,1985,1986,1987,1988,1989,1990,1991,1992,1993,1994,1995,1996,1997,1998,1999,2000,2001,2002,2003,2004,2005,2006,2007,2008,2009,2010,2011,2012,2013,2014,2015,2016,2017,2018,2019,2020,2021,2022,2023,2024,2025,2026,Estimates Start After
6790,942,SRB,GGXWDG,Serbia,General government gross debt,"Gross debt consists of all liabilities that require payment or payments of interest and/or principal by the debtor to the creditor at a date or dates in the future. This includes debt liabilities in the form of SDRs, currency and deposits, debt securities, loans, insurance, pensions and standardized guarantee schemes, and other accounts payable. Thus, all liabilities in the GFSM 2001 system are debt, except for equity and investment fund shares and financial derivatives and employee stock options. Debt can be valued at current market, nominal, or face values (GFSM 2001, paragraph 7.110).",National currency,Billions,"Source: Ministry of Finance or Treasury. Ministry of Finance Latest actual data: 2020 Notes: Gross debt also includes accounts payable > 60 days and net debt only includes currency and deposits as government assets. Start/end months of reporting year: January/December GFS Manual used: Government Finance Statistics Manual (GFSM) 1986. Combination of GFSM1986 and GFSM2001 Basis of recording: Cash General government includes: Central Government; State Government; Local Government; Social Security Funds; Other;. General government covers the following entities: Central government (Republican Budget, comprising direct budget users covering the three branches of government, President's office, ministries, parliament, judiciary, other budget agencies); Mandatory social insurance funds (Pension Insurance Fund, Health Insurance Fund, Unemployment Fund and Military Health Fund); Extrabudgetary funds (PE Roads of Serbia and Koridori Ltd); Indirect budget users of the Republic; Subnational governments (Autonomous province of Vojvodina; Local government - Cities and Municipalities; Indirect budget users of local governments). Excluded from the data coverage are some indirect budget users of the Republican budget and Local government. Valuation of public debt: Current market value Instruments included in gross and net debt: Currency and Deposits; Securities Other than Shares; Insurance Technical Reserves; Financial Derivatives; Monetary Gold and SDRs; Other;. Recorded on a gross basis. Primary domestic currency: Serbian dinar Data last updated: 09/2021",,,,,,,,,,,,,,,,,,,,,928.492,872.595,790.05,875.573,902.487,947.653,828.179,787.439,888.712,1035.45,1339.73,1588.23,2074.18,2370.03,2811.97,3073.7,3114.14,2792.1,2759.95,2858.87,3188.99,3583.05,3740.38,3830.0,3894.55,3962.2,4042.93,2020.0
6791,942,SRB,GGXWDG_NGDP,Serbia,General government gross debt,"Gross debt consists of all liabilities that require payment or payments of interest and/or principal by the debtor to the creditor at a date or dates in the future. This includes debt liabilities in the form of SDRs, currency and deposits, debt securities, loans, insurance, pensions and standardized guarantee schemes, and other accounts payable. Thus, all liabilities in the GFSM 2001 system are debt, except for equity and investment fund shares and financial derivatives and employee stock options. Debt can be valued at current market, nominal, or face values (GFSM 2001, paragraph 7.110).",Percent of GDP,,See notes for:  General government gross debt (National currency).,,,,,,,,,,,,,,,,,,,,,224.596,106.231,76.068,71.709,62.135,51.276,37.946,31.183,30.535,33.902,41.187,43.937,54.402,57.468,67.54,71.233,68.772,58.649,54.405,52.769,58.369,59.854,58.193,55.465,52.737,50.143,47.803,2020.0
6792,942,SRB,NGDP_FY,Serbia,"Gross domestic product corresponding to fiscal year, current prices","Gross domestic product corresponding to fiscal year is the country's GDP based on the same period during the year as their fiscal data. In the case of countries whose fiscal data are based on a fiscal calendar (e.g., July to June), this series would be the country's GDP over that same period. For countries whose fiscal data are based on a calendar year (i.e., January to December), this series will be the same as their GDP in current prices.",National currency,Billions,"Source: Ministry of Finance or Treasury. Ministry of Finance Latest actual data: 2020 Notes: Gross debt also includes accounts payable > 60 days and net debt only includes currency and deposits as government assets. Start/end months of reporting year: January/December GFS Manual used: Government Finance Statistics Manual (GFSM) 1986. Combination of GFSM1986 and GFSM2001 Basis of recording: Cash General government includes: Central Government; State Government; Local Government; Social Security Funds; Other;. General government covers the following entities: Central government (Republican Budget, comprising direct budget users covering the three branches of government, President's office, ministries, parliament, judiciary, other budget agencies); Mandatory social insurance funds (Pension Insurance Fund, Health Insurance Fund, Unemployment Fund and Military Health Fund); Extrabudgetary funds (PE Roads of Serbia and Koridori Ltd); Indirect budget users of the Republic; Subnational governments (Autonomous province of Vojvodina; Local government - Cities and Municipalities; Indirect budget users of local governments). Excluded from the data coverage are some indirect budget users of the Republican budget and Local government. Valuation of public debt: Current market value Instruments included in gross and net debt: Currency and Deposits; Securities Other than Shares; Insurance Technical Reserves; Financial Derivatives; Monetary Gold and SDRs; Other;. Recorded on a gross basis. Primary domestic currency: Serbian dinar Data last updated: 09/2021",,,,,,,,,,,,,,,,,,142.869,183.532,214.829,413.406,821.41,1038.62,1221.0,1452.45,1848.13,2182.54,2525.24,2910.46,3054.25,3252.83,3614.77,3812.69,4124.05,4163.43,4315.02,4528.19,4760.69,5072.93,5417.73,5463.54,5986.37,6427.53,6905.28,7384.8,7901.82,8457.47,2020.0
6793,942,SRB,BCA,Serbia,Current account balance,"Current account is all transactions other than those in financial and capital items. The major classifications are goods and services, income and current transfers. The focus of the BOP is on transactions (between an economy and the rest of the world) in goods, services, and income.",U.S. dollars,Billions,"Source: Central Bank. National Bank of Serbia Latest actual data: 2020 BOP Manual used: Balance of Payments and International Investment Position Manual, sixth edition (BPM6). NBS introduced BPM6 in April 2014. Primary domestic currency: Serbian dinar Data last updated: 09/2021",,,,,,,,,,,,,,,,,,,-0.469,-0.455,-0.178,0.253,-0.636,-1.527,-3.262,-2.202,-2.96,-6.958,-10.349,-2.66,-2.486,-3.995,-4.674,-2.778,-2.632,-1.369,-1.189,-2.311,-2.451,-3.54,-2.258,-2.481,-2.889,-3.283,-3.791,-3.979,-4.147,2020.0
6794,942,SRB,BCA_NGDPD,Serbia,Current account balance,"Current account is all transactions other than those in financial and capital items. The major classifications are goods and services, income and current transfers. The focus of the BOP is on transactions (between an economy and the rest of the world) in goods, services, and income.",Percent of GDP,,"See notes for:  Gross domestic product, current prices (National currency) Current account balance (U.S. dollars).",,,,,,,,,,,,,,,,,,,,,-1.912,2.053,-3.929,-7.191,-13.173,-8.004,-9.073,-16.024,-19.853,-5.886,-6.004,-8.102,-10.788,-5.737,-5.589,-3.453,-2.922,-5.23,-4.84,-6.876,-4.264,-4.09,-4.397,-4.603,-4.931,-4.79,-4.636,2020.0
