,WEO Country Code,ISO,WEO Subject Code,Country,Subject Descriptor,Subject Notes,Units,Scale,Country/Series-specific Notes,1980,1981,1982,1983,1984,1985,1986,1987,1988,1989,1990,1991,1992,1993,1994,1995,1996,1997,1998,1999,2000,2001,2002,2003,2004,2005,2006,2007,2008,2009,2010,2011,2012,2013,2014,2015,2016,2017,2018,2019,2020,2021,2022,2023,2024,2025,2026,Estimates Start After
6773,942,SRB,TX_RPCH,Serbia,Volume of exports of goods and services,"Percent change of volume of exports refers to the aggregate change in the quantities of total exports whose characteristics are unchanged. The goods and services and their prices are held constant, therefore changes are due to changes in quantities only. [Export and Import Price Index Manual: Theory and Practice, Glossary]",Percent change,,"Source: National Statistics Office. Serbian Statistical Office Latest actual data: 2020 Base year: 2009 Methodology used to derive volumes: Deflation by unit value indexes (from customs data) Formula used to derive volumes: Fisher, Laspeyres and Paasche formulas are used. Chain-weighted: Yes, from 1989 Trade System: General trade Excluded items in trade: In transit; Other;. Besides transit, excluded are also the temporary commodity transactions (fairs, test samples, etc.). Valuation of exports: Free on board (FOB) Valuation of imports: Cost, insurance, freight (CIF) Primary domestic currency: Serbian dinar Data last updated: 09/2021",,,,,,,,,,,,,,,,,,,,,,-1.519,12.869,29.196,9.72,11.708,7.347,17.289,4.882,-5.583,12.054,3.569,-0.073,17.901,4.222,10.832,11.317,9.767,7.876,10.09,-5.691,19.308,6.654,5.904,5.908,5.912,6.287,2020.0
6774,942,SRB,TXG_RPCH,Serbia,Volume of exports of goods,"Percent change of volume of exports of goods refers to the aggregate change in the quantities of exports of goods whose characteristics are unchanged. The goods and their prices are held constant, therefore changes are due to changes in quantities only. [Export and Import Price Index Manual: Theory and Practice, Glossary]",Percent change,,"Source: National Statistics Office. Serbian Statistical Office Latest actual data: 2020 Base year: 2009 Methodology used to derive volumes: Deflation by unit value indexes (from customs data) Formula used to derive volumes: Fisher, Laspeyres and Paasche formulas are used. Chain-weighted: Yes, from 1989 Trade System: General trade Excluded items in trade: In transit; Other;. Besides transit, excluded are also the temporary commodity transactions (fairs, test samples, etc.). Valuation of exports: Free on board (FOB) Valuation of imports: Cost, insurance, freight (CIF) Primary domestic currency: Serbian dinar Data last updated: 09/2021",,,,,,,,,,,,,,,,,,,,,,-7.656,13.231,31.648,5.726,14.442,4.919,17.205,4.218,-8.816,16.825,3.646,-0.836,21.909,1.668,9.614,12.662,8.47,5.699,8.449,-3.105,24.039,6.539,5.539,5.539,5.539,6.039,2020.0
6775,942,SRB,LUR,Serbia,Unemployment rate,"Unemployment rate can be defined by either the national definition, the ILO harmonized definition, or the OECD harmonized definition. The OECD harmonized unemployment rate gives the number of unemployed persons as a percentage of the labor force (the total number of people employed plus unemployed). [OECD Main Economic Indicators, OECD, monthly] As defined by the International Labour Organization, unemployed workers are those who are currently not working but are willing and able to work for pay, currently available to work, and have actively searched for work. [ILO, http://www.ilo.org/public/english/bureau/stat/res/index.htm]",Percent of total labor force,,Source: National Statistics Office. Statistical Office of the Republic of Serbia Latest actual data: 2020 Notes: The Labor Force Survey is conducted every quarter since Q1 2014. Employment type: Harmonized ILO definition. The methodology is harmonized with ILO and Eurostat. Primary domestic currency: Serbian dinar Data last updated: 09/2021,,,,,,,,,,,,,,,,,,12.26,12.8,13.3,12.1,12.2,14.47,16.0,19.53,21.83,21.56,18.8,14.4,16.9,20.0,23.6,24.6,23.0,19.894,18.231,15.917,14.051,13.273,10.909,9.457,9.333,9.273,9.047,8.869,8.641,8.366,2020.0
6776,942,SRB,LE,Serbia,Employment,"Employment can be defined by either the national definition, the ILO harmonized definition, or the OECD harmonized definition. Persons who during a specified brief period such as one week or one day, (a) performed some work for wage or salary in cash or in kind, (b) had a formal attachment to their job but were temporarily not at work during the reference period, (c) performed some work for profit or family gain in cash or in kind, (d) were with an enterprise such as a business, farm or service but who were temporarily not at work during the reference period for any specific reason. [Current International Recommendations on Labour Statistics, 1988 Edition, ILO, Geneva, page 47]",Persons,Millions,,,,,,,,,,,,,,,,,,,,,,,,,,,,,,,,,,,,,,,,,,,,,,,,,
6777,942,SRB,LP,Serbia,Population,"For census purposes, the total population of the country consists of all persons falling within the scope of the census. In the broadest sense, the total may comprise either all usual residents of the country or all persons present in the country at the time of the census. [Principles and Recommendations for Population and Housing Censuses, Revision 1, paragraph 2.42]",Persons,Millions,Source: National Statistics Office. Statistical Office of the Republic of Serbia Latest actual data: 2020 Primary domestic currency: Serbian dinar Data last updated: 09/2021,,,,,,,,,,,,,,,,,,7.597,7.568,7.54,7.516,7.503,7.5,7.481,7.463,7.441,7.412,7.382,7.35,7.321,7.291,7.237,7.201,7.167,7.132,7.095,7.058,7.021,6.983,6.964,6.927,6.899,6.871,6.844,6.817,6.789,6.762,2020.0
6778,942,SRB,GGR,Serbia,General government revenue,"Revenue consists of taxes, social contributions, grants receivable, and other revenue. Revenue increases government's net worth, which is the difference between its assets and liabilities (GFSM 2001, paragraph 4.20). Note: Transactions that merely change the composition of the balance sheet do not change the net worth position, for example, proceeds from sales of nonfinancial and financial assets or incurrence of liabilities.",National currency,Billions,"Source: Ministry of Finance or Treasury. Ministry of Finance Latest actual data: 2020 Notes: Gross debt also includes accounts payable > 60 days and net debt only includes currency and deposits as government assets. Start/end months of reporting year: January/December GFS Manual used: Government Finance Statistics Manual (GFSM) 1986. Combination of GFSM1986 and GFSM2001 Basis of recording: Cash General government includes: Central Government; State Government; Local Government; Social Security Funds; Other;. General government covers the following entities: Central government (Republican Budget, comprising direct budget users covering the three branches of government, President's office, ministries, parliament, judiciary, other budget agencies); Mandatory social insurance funds (Pension Insurance Fund, Health Insurance Fund, Unemployment Fund and Military Health Fund); Extrabudgetary funds (PE Roads of Serbia and Koridori Ltd); Indirect budget users of the Republic; Subnational governments (Autonomous province of Vojvodina; Local government - Cities and Municipalities; Indirect budget users of local governments). Excluded from the data coverage are some indirect budget users of the Republican budget and Local government. Valuation of public debt: Current market value Instruments included in gross and net debt: Currency and Deposits; Securities Other than Shares; Insurance Technical Reserves; Financial Derivatives; Monetary Gold and SDRs; Other;. Recorded on a gross basis. Primary domestic currency: Serbian dinar Data last updated: 09/2021",,,,,,,,,,,,,,,,,,,,,128.89,280.484,418.396,478.844,593.525,754.643,903.603,1043.79,1191.34,1200.83,1279.82,1362.94,1477.2,1537.96,1620.75,1694.84,1842.65,1973.38,2105.24,2278.53,2254.96,2479.92,2647.78,2856.92,3062.53,3273.79,3503.56,2020.0
6779,942,SRB,GGR_NGDP,Serbia,General government revenue,"Revenue consists of taxes, social contributions, grants receivable, and other revenue. Revenue increases government's net worth, which is the difference between its assets and liabilities (GFSM 2001, paragraph 4.20). Note: Transactions that merely change the composition of the balance sheet do not change the net worth position, for example, proceeds from sales of nonfinancial and financial assets or incurrence of liabilities.",Percent of GDP,,See notes for:  General government revenue (National currency).,,,,,,,,,,,,,,,,,,,,,31.178,34.147,40.284,39.217,40.864,40.833,41.401,41.334,40.933,39.317,39.345,37.705,38.744,37.292,38.928,39.278,40.693,41.452,41.5,42.057,41.273,41.426,41.194,41.373,41.471,41.431,41.426,2020.0
6780,942,SRB,GGX,Serbia,General government total expenditure,"Total expenditure consists of total expense and the net acquisition of nonfinancial assets. Note: Apart from being on an accrual basis, total expenditure differs from the GFSM 1986 definition of total expenditure in the sense that it also takes the disposals of nonfinancial assets into account.",National currency,Billions,"Source: Ministry of Finance or Treasury. Ministry of Finance Latest actual data: 2020 Notes: Gross debt also includes accounts payable > 60 days and net debt only includes currency and deposits as government assets. Start/end months of reporting year: January/December GFS Manual used: Government Finance Statistics Manual (GFSM) 1986. Combination of GFSM1986 and GFSM2001 Basis of recording: Cash General government includes: Central Government; State Government; Local Government; Social Security Funds; Other;. General government covers the following entities: Central government (Republican Budget, comprising direct budget users covering the three branches of government, President's office, ministries, parliament, judiciary, other budget agencies); Mandatory social insurance funds (Pension Insurance Fund, Health Insurance Fund, Unemployment Fund and Military Health Fund); Extrabudgetary funds (PE Roads of Serbia and Koridori Ltd); Indirect budget users of the Republic; Subnational governments (Autonomous province of Vojvodina; Local government - Cities and Municipalities; Indirect budget users of local governments). Excluded from the data coverage are some indirect budget users of the Republican budget and Local government. Valuation of public debt: Current market value Instruments included in gross and net debt: Currency and Deposits; Securities Other than Shares; Insurance Technical Reserves; Financial Derivatives; Monetary Gold and SDRs; Other;. Recorded on a gross basis. Primary domestic currency: Serbian dinar Data last updated: 09/2021",,,,,,,,,,,,,,,,,,,,,129.577,277.527,445.279,511.248,592.568,735.352,923.837,1064.84,1243.34,1305.62,1393.11,1504.0,1719.51,1743.71,1864.26,1840.66,1893.32,1908.17,2064.09,2278.78,2653.4,2869.76,2804.78,2934.25,3114.25,3328.66,3563.61,2020.0
6781,942,SRB,GGX_NGDP,Serbia,General government total expenditure,"Total expenditure consists of total expense and the net acquisition of nonfinancial assets. Note: Apart from being on an accrual basis, total expenditure differs from the GFSM 1986 definition of total expenditure in the sense that it also takes the disposals of nonfinancial assets into account.",Percent of GDP,,See notes for:  General government total expenditure (National currency).,,,,,,,,,,,,,,,,,,,,,31.344,33.787,42.872,41.871,40.798,39.789,42.328,42.168,42.72,42.748,42.827,41.607,45.1,42.282,44.777,42.657,41.812,40.082,40.688,42.061,48.565,47.938,43.637,42.493,42.171,42.125,42.136,2020.0
6782,942,SRB,GGXCNL,Serbia,General government net lending/borrowing,"Net lending (+)/ borrowing (-) is calculated as revenue minus total expenditure. This is a core GFS balance that measures the extent to which general government is either putting financial resources at the disposal of other sectors in the economy and nonresidents (net lending), or utilizing the financial resources generated by other sectors and nonresidents (net borrowing). This balance may be viewed as an indicator of the financial impact of general government activity on the rest of the economy and nonresidents (GFSM 2001, paragraph 4.17). Note: Net lending (+)/borrowing (-) is also equal to net acquisition of financial assets minus net incurrence of liabilities.",National currency,Billions,"Source: Ministry of Finance or Treasury. Ministry of Finance Latest actual data: 2020 Notes: Gross debt also includes accounts payable > 60 days and net debt only includes currency and deposits as government assets. Start/end months of reporting year: January/December GFS Manual used: Government Finance Statistics Manual (GFSM) 1986. Combination of GFSM1986 and GFSM2001 Basis of recording: Cash General government includes: Central Government; State Government; Local Government; Social Security Funds; Other;. General government covers the following entities: Central government (Republican Budget, comprising direct budget users covering the three branches of government, President's office, ministries, parliament, judiciary, other budget agencies); Mandatory social insurance funds (Pension Insurance Fund, Health Insurance Fund, Unemployment Fund and Military Health Fund); Extrabudgetary funds (PE Roads of Serbia and Koridori Ltd); Indirect budget users of the Republic; Subnational governments (Autonomous province of Vojvodina; Local government - Cities and Municipalities; Indirect budget users of local governments). Excluded from the data coverage are some indirect budget users of the Republican budget and Local government. Valuation of public debt: Current market value Instruments included in gross and net debt: Currency and Deposits; Securities Other than Shares; Insurance Technical Reserves; Financial Derivatives; Monetary Gold and SDRs; Other;. Recorded on a gross basis. Primary domestic currency: Serbian dinar Data last updated: 09/2021",,,,,,,,,,,,,,,,,,,,,-0.686,2.957,-26.883,-32.403,0.957,19.291,-20.234,-21.043,-52.002,-104.786,-113.281,-141.061,-242.306,-205.754,-243.514,-145.826,-50.674,65.21,41.15,-0.247,-398.437,-389.833,-156.998,-77.327,-51.729,-54.865,-60.058,2020.0
6783,942,SRB,GGXCNL_NGDP,Serbia,General government net lending/borrowing,"Net lending (+)/ borrowing (-) is calculated as revenue minus total expenditure. This is a core GFS balance that measures the extent to which general government is either putting financial resources at the disposal of other sectors in the economy and nonresidents (net lending), or utilizing the financial resources generated by other sectors and nonresidents (net borrowing). This balance may be viewed as an indicator of the financial impact of general government activity on the rest of the economy and nonresidents (GFSM 2001, paragraph 4.17). Note: Net lending (+)/borrowing (-) is also equal to net acquisition of financial assets minus net incurrence of liabilities.",Percent of GDP,,See notes for:  General government net lending/borrowing (National currency).,,,,,,,,,,,,,,,,,,,,,-0.166,0.36,-2.588,-2.654,0.066,1.044,-0.927,-0.833,-1.787,-3.431,-3.483,-3.902,-6.355,-4.989,-5.849,-3.379,-1.119,1.37,0.811,-0.005,-7.293,-6.512,-2.443,-1.12,-0.7,-0.694,-0.71,2020.0
6784,942,SRB,GGSB,Serbia,General government structural balance,"The structural budget balance refers to the general government cyclically adjusted balance adjusted for nonstructural elements beyond the economic cycle. These include temporary financial sector and asset price movements as well as one-off, or temporary, revenue or expenditure items. The cyclically adjusted balance is the fiscal balance adjusted for the effects of the economic cycle; see, for example, A. Fedelino. A. Ivanova and M. Horton ""Computing Cyclically Adjusted Balances and Automatic Stabilizers"" IMF Technical Guidance Note No. 5, http://www.imf.org/external/pubs/ft/tnm/2009/tnm0905.pdf.",National currency,Billions,"Source: Ministry of Finance or Treasury. Ministry of Finance Latest actual data: 2020 Notes: Gross debt also includes accounts payable > 60 days and net debt only includes currency and deposits as government assets. Start/end months of reporting year: January/December GFS Manual used: Government Finance Statistics Manual (GFSM) 1986. Combination of GFSM1986 and GFSM2001 Basis of recording: Cash General government includes: Central Government; State Government; Local Government; Social Security Funds; Other;. General government covers the following entities: Central government (Republican Budget, comprising direct budget users covering the three branches of government, President's office, ministries, parliament, judiciary, other budget agencies); Mandatory social insurance funds (Pension Insurance Fund, Health Insurance Fund, Unemployment Fund and Military Health Fund); Extrabudgetary funds (PE Roads of Serbia and Koridori Ltd); Indirect budget users of the Republic; Subnational governments (Autonomous province of Vojvodina; Local government - Cities and Municipalities; Indirect budget users of local governments). Excluded from the data coverage are some indirect budget users of the Republican budget and Local government. Valuation of public debt: Current market value Instruments included in gross and net debt: Currency and Deposits; Securities Other than Shares; Insurance Technical Reserves; Financial Derivatives; Monetary Gold and SDRs; Other;. Recorded on a gross basis. Primary domestic currency: Serbian dinar Data last updated: 09/2021",,,,,,,,,,,,,,,,,,,,,,,,,,29.245,-38.083,-54.314,-114.705,-118.519,-131.071,-168.619,-211.235,-213.017,-210.49,-136.694,-53.524,49.904,35.223,-27.822,-328.266,-434.324,-225.177,-113.689,-90.322,-102.548,-112.331,2020.0
6785,942,SRB,GGSB_NPGDP,Serbia,General government structural balance,"The structural budget balance refers to the general government cyclically adjusted balance adjusted for nonstructural elements beyond the economic cycle. These include temporary financial sector and asset price movements as well as one-off, or temporary, revenue or expenditure items. The cyclically adjusted balance is the fiscal balance adjusted for the effects of the economic cycle; see, for example, A. Fedelino. A. Ivanova and M. Horton ""Computing Cyclically Adjusted Balances and Automatic Stabilizers"" IMF Technical Guidance Note No. 5, http://www.imf.org/external/pubs/ft/tnm/2009/tnm0905.pdf.",Percent of potential GDP,,See notes for:  General government structural balance (National currency).,,,,,,,,,,,,,,,,,,,,,,,,,,1.548,-1.762,-2.201,-4.114,-3.859,-3.988,-4.678,-5.488,-5.231,-4.991,-3.149,-1.179,1.041,0.694,-0.516,-5.884,-7.221,-3.493,-1.645,-1.222,-1.298,-1.329,2020.0
6786,942,SRB,GGXONLB,Serbia,General government primary net lending/borrowing,Primary net lending/borrowing is net lending (+)/borrowing (-) plus net interest payable/paid (interest expense minus interest revenue).,National currency,Billions,"Source: Ministry of Finance or Treasury. Ministry of Finance Latest actual data: 2020 Notes: Gross debt also includes accounts payable > 60 days and net debt only includes currency and deposits as government assets. Start/end months of reporting year: January/December GFS Manual used: Government Finance Statistics Manual (GFSM) 1986. Combination of GFSM1986 and GFSM2001 Basis of recording: Cash General government includes: Central Government; State Government; Local Government; Social Security Funds; Other;. General government covers the following entities: Central government (Republican Budget, comprising direct budget users covering the three branches of government, President's office, ministries, parliament, judiciary, other budget agencies); Mandatory social insurance funds (Pension Insurance Fund, Health Insurance Fund, Unemployment Fund and Military Health Fund); Extrabudgetary funds (PE Roads of Serbia and Koridori Ltd); Indirect budget users of the Republic; Subnational governments (Autonomous province of Vojvodina; Local government - Cities and Municipalities; Indirect budget users of local governments). Excluded from the data coverage are some indirect budget users of the Republican budget and Local government. Valuation of public debt: Current market value Instruments included in gross and net debt: Currency and Deposits; Securities Other than Shares; Insurance Technical Reserves; Financial Derivatives; Monetary Gold and SDRs; Other;. Recorded on a gross basis. Primary domestic currency: Serbian dinar Data last updated: 09/2021",,,,,,,,,,,,,,,,,,,,,1.508,8.582,-23.921,-21.144,18.67,44.222,9.99,-3.121,-34.809,-82.417,-79.094,-96.269,-174.111,-111.221,-128.342,-15.958,80.929,186.43,149.782,108.689,-288.188,-276.111,-36.0,55.642,87.707,97.564,104.651,2020.0
6787,942,SRB,GGXONLB_NGDP,Serbia,General government primary net lending/borrowing,Primary net lending/borrowing is net lending (+)/borrowing (-) plus net interest payable/paid (interest expense minus interest revenue).,Percent of GDP,,See notes for:  General government primary net lending/borrowing (National currency).,,,,,,,,,,,,,,,,,,,,,0.365,1.045,-2.303,-1.732,1.285,2.393,0.458,-0.124,-1.196,-2.698,-2.432,-2.663,-4.567,-2.697,-3.083,-0.37,1.787,3.916,2.953,2.006,-5.275,-4.612,-0.56,0.806,1.188,1.235,1.237,2020.0
6788,942,SRB,GGXWDN,Serbia,General government net debt,"Net debt is calculated as gross debt minus financial assets corresponding to debt instruments. These financial assets are: monetary gold and SDRs, currency and deposits, debt securities, loans, insurance, pension, and standardized guarantee schemes, and other accounts receivable.",National currency,Billions,"Source: Ministry of Finance or Treasury. Ministry of Finance Latest actual data: 2020 Notes: Gross debt also includes accounts payable > 60 days and net debt only includes currency and deposits as government assets. Start/end months of reporting year: January/December GFS Manual used: Government Finance Statistics Manual (GFSM) 1986. Combination of GFSM1986 and GFSM2001 Basis of recording: Cash General government includes: Central Government; State Government; Local Government; Social Security Funds; Other;. General government covers the following entities: Central government (Republican Budget, comprising direct budget users covering the three branches of government, President's office, ministries, parliament, judiciary, other budget agencies); Mandatory social insurance funds (Pension Insurance Fund, Health Insurance Fund, Unemployment Fund and Military Health Fund); Extrabudgetary funds (PE Roads of Serbia and Koridori Ltd); Indirect budget users of the Republic; Subnational governments (Autonomous province of Vojvodina; Local government - Cities and Municipalities; Indirect budget users of local governments). Excluded from the data coverage are some indirect budget users of the Republican budget and Local government. Valuation of public debt: Current market value Instruments included in gross and net debt: Currency and Deposits; Securities Other than Shares; Insurance Technical Reserves; Financial Derivatives; Monetary Gold and SDRs; Other;. Recorded on a gross basis. Primary domestic currency: Serbian dinar Data last updated: 09/2021",,,,,,,,,,,,,,,,,,,,,919.042,857.424,753.078,828.735,850.281,862.398,665.704,635.06,790.669,886.57,1193.29,1396.53,1852.11,2048.42,2637.63,2931.86,3007.35,2690.42,2654.98,2647.2,2981.69,3453.75,3611.08,3682.7,3727.25,3794.9,3875.63,2020.0
6789,942,SRB,GGXWDN_NGDP,Serbia,General government net debt,"Net debt is calculated as gross debt minus financial assets corresponding to debt instruments. These financial assets are: monetary gold and SDRs, currency and deposits, debt securities, loans, insurance, pension, and standardized guarantee schemes, and other accounts receivable.",Percent of GDP,,See notes for:  General government net debt (National currency).,,,,,,,,,,,,,,,,,,,,,222.31,104.384,72.508,67.873,58.541,46.663,30.501,25.149,27.166,29.027,36.685,38.634,48.578,49.67,63.352,67.946,66.414,56.513,52.336,48.862,54.574,57.694,56.181,53.332,50.472,48.026,45.825,2020.0
