,WEO Country Code,ISO,WEO Subject Code,Country,Subject Descriptor,Subject Notes,Units,Scale,Country/Series-specific Notes,1980,1981,1982,1983,1984,1985,1986,1987,1988,1989,1990,1991,1992,1993,1994,1995,1996,1997,1998,1999,2000,2001,2002,2003,2004,2005,2006,2007,2008,2009,2010,2011,2012,2013,2014,2015,2016,2017,2018,2019,2020,2021,2022,2023,2024,2025,2026,Estimates Start After
7065,726,SOM,NGDP_R,Somalia,"Gross domestic product, constant prices","Expressed in billions of national currency units; the base year is country-specific. Expenditure-based GDP is total final expenditures at purchasers' prices (including the f.o.b. value of exports of goods and services), less the f.o.b. value of imports of goods and services. [SNA 1993]",National currency,Billions,Source: Central Bank Latest actual data: 2019 National accounts manual used: System of National Accounts (SNA) 2008 GDP valuation: Market prices Start/end months of reporting year: January/December Base year: 2013 Chain-weighted: No Primary domestic currency: US dollar Data last updated: 09/2021,,,,,,,,,,,,,,,,,,,,,,,,,,,,,,,,3.776,3.821,3.892,3.984,4.122,4.241,4.3,4.42,4.548,4.517,4.589,4.766,4.938,5.13,5.341,5.57,2019.0
7066,726,SOM,NGDP_RPCH,Somalia,"Gross domestic product, constant prices","Annual percentages of constant price GDP are year-on-year changes; the base year is country-specific. Expenditure-based GDP is total final expenditures at purchasers' prices (including the f.o.b. value of exports of goods and services), less the f.o.b. value of imports of goods and services. [SNA 1993]",Percent change,,"See notes for:  Gross domestic product, constant prices (National currency).",,,,,,,,,,,,,,,,,,,,,,,,,,,,,,,,,1.2,1.86,2.354,3.46,2.894,1.385,2.8,2.9,-0.7,1.6,3.861,3.6,3.9,4.1,4.3,2019.0
7067,726,SOM,NGDP,Somalia,"Gross domestic product, current prices","Expressed in billions of national currency units. Expenditure-based GDP is total final expenditures at purchasers' prices (including the f.o.b. value of exports of goods and services), less the f.o.b. value of imports of goods and services. [SNA 1993]",National currency,Billions,Source: Central Bank Latest actual data: 2019 National accounts manual used: System of National Accounts (SNA) 2008 GDP valuation: Market prices Start/end months of reporting year: January/December Base year: 2013 Chain-weighted: No Primary domestic currency: US dollar Data last updated: 09/2021,,,,,,,,,,,,,,,,,,,,,,,,,,,,,,,,3.499,3.611,3.892,3.964,4.049,4.198,4.509,4.651,5.061,4.99,5.424,5.888,6.611,7.385,8.061,8.764,2019.0
7068,726,SOM,NGDPD,Somalia,"Gross domestic product, current prices","Values are based upon GDP in national currency converted to U.S. dollars using market exchange rates (yearly average). Exchange rate projections are provided by country economists for the group of other emerging market and developing countries. Exchanges rates for advanced economies are established in the WEO assumptions for each WEO exercise. Expenditure-based GDP is total final expenditures at purchasers' prices (including the f.o.b. value of exports of goods and services), less the f.o.b. value of imports of goods and services. [SNA 1993]",U.S. dollars,Billions,"See notes for:  Gross domestic product, current prices (National currency).",,,,,,,,,,,,,,,,,,,,,,,,,,,,,,,,3.499,3.611,3.892,3.964,4.049,4.198,4.509,4.651,5.061,4.99,5.424,5.888,6.611,7.385,8.061,8.764,2019.0
7069,726,SOM,PPPGDP,Somalia,"Gross domestic product, current prices","These data form the basis for the country weights used to generate the World Economic Outlook country group composites for the domestic economy.   The IMF is not a primary source for purchasing power parity (PPP) data. WEO weights have been created from primary sources and are used solely for purposes of generating country group composites. For primary source information, please refer to one of the following sources: the Organization for Economic Cooperation and Development, the World Bank, or the Penn World Tables.   For further information see Box 1.1 in the October 2020 World Economic Outlook, ""Revised Purchasing Power Parity Weights"" in the July 2014 WEO Update, Box A2 in the April 2004 World Economic Outlook, Box A1 in the May 2000 World Economic Outlook, and Annex IV in the May 1993 World Economic Outlook for summaries of the revised PPP-based weights; and Box 1.2 in the September 2003 World Economic Outlook for a discussion on the measurement of global growth. See also Anne Marie Gulde and Marianne Schulze-Ghattas, Purchasing Power Parity Based Weights for the World Economic Outlook, in Staff Studies for the World Economic Outlook (Washington: IMF, December 1993), pp. 106-23.",Purchasing power parity; international dollars,Billions,"See notes for:  Gross domestic product, current prices (National currency).",,,,,,,,,,,,,,,,,,,,,,,,,,,,,,,,13.105,10.156,9.015,9.864,11.346,12.23,12.655,13.32,13.952,14.021,14.759,15.75,16.706,17.753,18.882,20.102,2019.0
7070,726,SOM,NGDP_D,Somalia,"Gross domestic product, deflator",The GDP deflator is derived by dividing current price GDP by constant price GDP and is considered to be an alternate measure of inflation. Data are expressed in the base year of each country's national accounts.,Index,,"See notes for:  Gross domestic product, constant prices (National currency) Gross domestic product, current prices (National currency).",,,,,,,,,,,,,,,,,,,,,,,,,,,,,,,,92.664,94.495,100.0,99.486,98.229,98.994,104.859,105.221,111.275,110.473,118.203,123.546,133.886,143.944,150.932,157.339,2019.0
7071,726,SOM,NGDPRPC,Somalia,"Gross domestic product per capita, constant prices",GDP is expressed in constant national currency per person. Data are derived by dividing constant price GDP by total population.,National currency,Units,"See notes for:  Gross domestic product, constant prices (National currency) Population (Persons).",,,,,,,,,,,,,,,,,,,,,,,,,,,,,,,,,319.249,316.021,314.344,316.054,316.036,311.384,311.081,311.081,300.198,296.405,299.175,301.21,304.137,307.684,311.87,2013.0
7072,726,SOM,NGDPRPPPPC,Somalia,"Gross domestic product per capita, constant prices",GDP is expressed in constant international dollars per person. Data are derived by dividing constant price purchasing-power parity (PPP) GDP by total population.,Purchasing power parity; 2017 international dollar,Units,"See notes for:  Gross domestic product, constant prices (National currency) Population (Persons).",,,,,,,,,,,,,,,,,,,,,,,,,,,,,,,,,939.583,930.084,925.147,930.181,930.128,916.435,915.544,915.544,883.514,872.352,880.503,886.493,895.108,905.546,917.867,2013.0
7073,726,SOM,NGDPPC,Somalia,"Gross domestic product per capita, current prices",GDP is expressed in current national currency per person. Data are derived by dividing current price GDP by total population.,National currency,Units,"See notes for:  Gross domestic product, current prices (National currency) Population (Persons).",,,,,,,,,,,,,,,,,,,,,,,,,,,,,,,,,301.676,316.021,312.727,310.457,312.857,326.515,327.321,346.156,331.637,350.361,369.62,403.277,437.788,464.394,490.693,2013.0
7074,726,SOM,NGDPDPC,Somalia,"Gross domestic product per capita, current prices",GDP is expressed in current U.S. dollars per person. Data are derived by first converting GDP in national currency to U.S. dollars and then dividing it by total population.,U.S. dollars,Units,"See notes for:  Gross domestic product, current prices (National currency) Population (Persons).",,,,,,,,,,,,,,,,,,,,,,,,,,,,,,,,,301.676,316.021,312.727,310.457,312.857,326.515,327.321,346.156,331.637,350.361,369.62,403.277,437.788,464.394,490.693,2013.0
7075,726,SOM,PPPPC,Somalia,"Gross domestic product per capita, current prices","Expressed in GDP in PPP dollars per person. Data are derived by dividing GDP in PPP dollars by total population. These data form the basis for the country weights used to generate the World Economic Outlook country group composites for the domestic economy.   The IMF is not a primary source for purchasing power parity (PPP) data. WEO weights have been created from primary sources and are used solely for purposes of generating country group composites. For primary source information, please refer to one of the following sources: the Organization for Economic Cooperation and Development, the World Bank, or the Penn World Tables.  For further information see Box 1.1 in the October 2020 World Economic Outlook, ""Revised Purchasing Power Parity Weights"" in the July 2014 WEO Update, Box A2 in the April 2004 World Economic Outlook, Box A1 in the May 2000 World Economic Outlook, and Annex IV in the May 1993 World Economic Outlook for summaries of the revised PPP-based weights; and Box 1.2 in the September 2003 World Economic Outlook for a discussion on the measurement of global growth. See also Anne Marie Gulde and Marianne Schulze-Ghattas, Purchasing Power Parity Based Weights for the World Economic Outlook, in Staff Studies for the World Economic Outlook (Washington: IMF, December 1993), pp. 106-23.",Purchasing power parity; international dollars,Units,"See notes for:  Gross domestic product, current prices (National currency) Population (Persons).",,,,,,,,,,,,,,,,,,,,,,,,,,,,,,,,,848.473,731.947,778.269,869.969,911.344,916.435,937.415,954.185,931.899,953.283,988.674,1019.08,1052.44,1087.84,1125.49,2013.0
7076,726,SOM,NGAP_NPGDP,Somalia,Output gap in percent of potential GDP,"Output gaps for advanced economies are calculated as actual GDP less potential GDP as a percent of potential GDP. Estimates of output gaps are subject to a significant margin of uncertainty. For a discussion of approaches to calculating potential output, see Paula R. De Masi, IMF Estimates of Potential Output: Theory and Practice, in Staff Studies for the World Economic Outlook (Washington: IMF, December 1997), pp. 40-46.",Percent of potential GDP,,,,,,,,,,,,,,,,,,,,,,,,,,,,,,,,,,,,,,,,,,,,,,,,,,
7077,726,SOM,PPPSH,Somalia,Gross domestic product based on purchasing-power-parity (PPP) share of world total,"Expressed in percent of world GDP in PPP dollars. These data form the basis for the country weights used to generate the World Economic Outlook country group composites for the domestic economy.   The IMF is not a primary source for purchasing power parity (PPP) data. WEO weights have been created from primary sources and are used solely for purposes of generating country group composites. For primary source information, please refer to one of the following sources: the Organization for Economic Cooperation and Development, the World Bank, or the Penn World Tables.  For further information see Box 1.1 in the October 2020 World Economic Outlook, ""Revised Purchasing Power Parity Weights"" in the July 2014 WEO Update, Box A2 in the April 2004 World Economic Outlook, Box A1 in the May 2000 World Economic Outlook, and Annex IV in the May 1993 World Economic Outlook for summaries of the revised PPP-based weights; and Box 1.2 in the September 2003 World Economic Outlook for a discussion on the measurement of global growth. See also Anne Marie Gulde and Marianne Schulze-Ghattas, Purchasing Power Parity Based Weights for the World Economic Outlook, in Staff Studies for the World Economic Outlook (Washington: IMF, December 1993), pp. 106-23.",Percent,,"See notes for:  Gross domestic product, current prices (National currency).",,,,,,,,,,,,,,,,,,,,,,,,,,,,,,,,0.014,0.01,0.009,0.009,0.01,0.011,0.01,0.01,0.01,0.011,0.01,0.01,0.01,0.01,0.01,0.01,2019.0
7078,726,SOM,PPPEX,Somalia,Implied PPP conversion rate,"Expressed in national currency per current international dollar. These data form the basis for the country weights used to generate the World Economic Outlook country group composites for the domestic economy.   The IMF is not a primary source for purchasing power parity (PPP) data. WEO weights have been created from primary sources and are used solely for purposes of generating country group composites. For primary source information, please refer to one of the following sources: the Organization for Economic Cooperation and Development, the World Bank, or the Penn World Tables.  For further information see Box 1.1 in the October 2020 World Economic Outlook, ""Revised Purchasing Power Parity Weights"" in the July 2014 WEO Update, Box A2 in the April 2004 World Economic Outlook, Box A1 in the May 2000 World Economic Outlook, and Annex IV in the May 1993 World Economic Outlook for summaries of the revised PPP-based weights; and Box 1.2 in the September 2003 World Economic Outlook for a discussion on the measurement of global growth. See also Anne Marie Gulde and Marianne Schulze-Ghattas, Purchasing Power Parity Based Weights for the World Economic Outlook, in Staff Studies for the World Economic Outlook (Washington: IMF, December 1993), pp. 106-23.",National currency per current international dollar,,"See notes for:  Gross domestic product, current prices (National currency).",,,,,,,,,,,,,,,,,,,,,,,,,,,,,,,,0.267,0.356,0.432,0.402,0.357,0.343,0.356,0.349,0.363,0.356,0.368,0.374,0.396,0.416,0.427,0.436,2019.0
7079,726,SOM,NID_NGDP,Somalia,Total investment,Expressed as a ratio of total investment in current local currency and GDP in current local currency. Investment or gross capital formation is measured by the total value of the gross fixed capital formation and changes in inventories and acquisitions less disposals of valuables for a unit or sector. [SNA 1993],Percent of GDP,,,,,,,,,,,,,,,,,,,,,,,,,,,,,,,,,,,,,,,,,,,,,,,,,,
7080,726,SOM,NGSD_NGDP,Somalia,Gross national savings,"Expressed as a ratio of gross national savings in current local currency and GDP in current local currency. Gross national saving is gross disposable income less final consumption expenditure after taking account of an adjustment for pension funds. [SNA 1993] For many countries, the estimates of national saving are built up from national accounts data on gross domestic investment and from balance of payments-based data on net foreign investment.",Percent of GDP,,,,,,,,,,,,,,,,,,,,,,,,,,,,,,,,,,,,,,,,,,,,,,,,,,
7081,726,SOM,PCPI,Somalia,"Inflation, average consumer prices","Expressed in averages for the year, not end-of-period data. A consumer price index (CPI) measures changes in the prices of goods and services that households consume. Such changes affect the real purchasing power of consumers' incomes and their welfare. As the prices of different goods and services do not all change at the same rate, a price index can only reflect their average movement. A price index is typically assigned a value of unity, or 100, in some reference period and the values of the index for other periods of time are intended to indicate the average proportionate, or percentage, change in prices from this price reference period. Price indices can also be used to measure differences in price levels between different cities, regions or countries at the same point in time. [CPI Manual 2004, Introduction] For euro countries, consumer prices are calculated based on harmonized prices. For more information see http://epp.eurostat.ec.europa.eu/cache/ITY_OFFPUB/KS-BE-04-001/EN/KS-BE-04-001-EN.PDF.]",Index,,,,,,,,,,,,,,,,,,,,,,,,,,,,,,,,,,,,,,,,,,,,,,,,,,
7082,726,SOM,PCPIPCH,Somalia,"Inflation, average consumer prices",Annual percentages of average consumer prices are year-on-year changes.,Percent change,,,,,,,,,,,,,,,,,,,,,,,,,,,,,,,,,,,,,,,,,,,,,,,,,,
7083,726,SOM,PCPIE,Somalia,"Inflation, end of period consumer prices","Expressed in end of the period, not annual average data. A consumer price index (CPI) measures changes in the prices of goods and services that households consume. Such changes affect the real purchasing power of consumers' incomes and their welfare. As the prices of different goods and services do not all change at the same rate, a price index can only reflect their average movement. A price index is typically assigned a value of unity, or 100, in some reference period and the values of the index for other periods of time are intended to indicate the average proportionate, or percentage, change in prices from this price reference period. Price indices can also be used to measure differences in price levels between different cities, regions or countries at the same point in time. [CPI Manual 2004, Introduction] For euro countries, consumer prices are calculated based on harmonized prices. For more information see http://epp.eurostat.ec.europa.eu/cache/ITY_OFFPUB/KS-BE-04-001/EN/KS-BE-04-001-EN.PDF.",Index,,Source: Central Bank Latest actual data: 2020 Harmonized prices: No Frequency of source data: Annual Base year: 2014 Primary domestic currency: US dollar Data last updated: 09/2021,,,,,,,,,,,,,,,,,,,,,,,,,,,,,,,,,96.028,98.717,100.0,100.292,101.509,107.692,111.16,114.64,120.18,125.348,130.362,134.625,138.928,143.201,147.497,2020.0
7084,726,SOM,PCPIEPCH,Somalia,"Inflation, end of period consumer prices",Annual percentages of end of period consumer prices are year-on-year changes.,Percent change,,"See notes for:  Inflation, end of period consumer prices (Index).",,,,,,,,,,,,,,,,,,,,,,,,,,,,,,,,,,2.8,1.3,0.292,1.214,6.091,3.221,3.13,4.833,4.3,4.0,3.27,3.196,3.076,3.0,2020.0
7085,726,SOM,FLIBOR6,Somalia,Six-month London interbank offered rate (LIBOR),,Percent,,,,,,,,,,,,,,,,,,,,,,,,,,,,,,,,,,,,,,,,,,,,,,,,,,
7086,726,SOM,TM_RPCH,Somalia,Volume of imports of goods and services,"Percent change of volume of imports refers to the aggregate change in the quantities of total imports whose characteristics are unchanged. The goods and services and their prices are held constant, therefore changes are due to changes in quantities only. [Export and Import Price Index Manual: Theory and Practice, Glossary]",Percent change,,,,,,,,,,,,,,,,,,,,,,,,,,,,,,,,,,,,,,,,,,,,,,,,,,
7087,726,SOM,TMG_RPCH,Somalia,Volume of Imports of goods,"Percent change of volume of imports of goods refers to the aggregate change in the quantities of imports of goods whose characteristics are unchanged. The goods and their prices are held constant, therefore changes are due to changes in quantities only. [Export and Import Price Index Manual: Theory and Practice, Glossary]",Percent change,,,,,,,,,,,,,,,,,,,,,,,,,,,,,,,,,,,,,,,,,,,,,,,,,,
7088,726,SOM,TX_RPCH,Somalia,Volume of exports of goods and services,"Percent change of volume of exports refers to the aggregate change in the quantities of total exports whose characteristics are unchanged. The goods and services and their prices are held constant, therefore changes are due to changes in quantities only. [Export and Import Price Index Manual: Theory and Practice, Glossary]",Percent change,,,,,,,,,,,,,,,,,,,,,,,,,,,,,,,,,,,,,,,,,,,,,,,,,,
7089,726,SOM,TXG_RPCH,Somalia,Volume of exports of goods,"Percent change of volume of exports of goods refers to the aggregate change in the quantities of exports of goods whose characteristics are unchanged. The goods and their prices are held constant, therefore changes are due to changes in quantities only. [Export and Import Price Index Manual: Theory and Practice, Glossary]",Percent change,,,,,,,,,,,,,,,,,,,,,,,,,,,,,,,,,,,,,,,,,,,,,,,,,,
7090,726,SOM,LUR,Somalia,Unemployment rate,"Unemployment rate can be defined by either the national definition, the ILO harmonized definition, or the OECD harmonized definition. The OECD harmonized unemployment rate gives the number of unemployed persons as a percentage of the labor force (the total number of people employed plus unemployed). [OECD Main Economic Indicators, OECD, monthly] As defined by the International Labour Organization, unemployed workers are those who are currently not working but are willing and able to work for pay, currently available to work, and have actively searched for work. [ILO, http://www.ilo.org/public/english/bureau/stat/res/index.htm]",Percent of total labor force,,,,,,,,,,,,,,,,,,,,,,,,,,,,,,,,,,,,,,,,,,,,,,,,,,
7091,726,SOM,LE,Somalia,Employment,"Employment can be defined by either the national definition, the ILO harmonized definition, or the OECD harmonized definition. Persons who during a specified brief period such as one week or one day, (a) performed some work for wage or salary in cash or in kind, (b) had a formal attachment to their job but were temporarily not at work during the reference period, (c) performed some work for profit or family gain in cash or in kind, (d) were with an enterprise such as a business, farm or service but who were temporarily not at work during the reference period for any specific reason. [Current International Recommendations on Labour Statistics, 1988 Edition, ILO, Geneva, page 47]",Persons,Millions,,,,,,,,,,,,,,,,,,,,,,,,,,,,,,,,,,,,,,,,,,,,,,,,,
7092,726,SOM,LP,Somalia,Population,"For census purposes, the total population of the country consists of all persons falling within the scope of the census. In the broadest sense, the total may comprise either all usual residents of the country or all persons present in the country at the time of the census. [Principles and Recommendations for Population and Housing Censuses, Revision 1, paragraph 2.42]",Persons,Millions,Source: UNFPA Latest actual data: 2013 Primary domestic currency: US dollar Data last updated: 09/2021,,,,,,,,,,,,,,,,,,,,,,,,,,,,,,,,,11.97,12.317,12.674,13.042,13.42,13.809,14.209,14.622,15.046,15.482,15.931,16.393,16.868,17.357,17.861,2013.0
7093,726,SOM,GGR,Somalia,General government revenue,"Revenue consists of taxes, social contributions, grants receivable, and other revenue. Revenue increases government's net worth, which is the difference between its assets and liabilities (GFSM 2001, paragraph 4.20). Note: Transactions that merely change the composition of the balance sheet do not change the net worth position, for example, proceeds from sales of nonfinancial and financial assets or incurrence of liabilities.",National currency,Billions,Source: Ministry of Finance or Treasury Latest actual data: 2019 Fiscal assumptions: IMF staff estimates Start/end months of reporting year: January/December GFS Manual used: Government Finance Statistics Manual (GFSM) 2001 Basis of recording: Cash General government includes: Central Government; Valuation of public debt: Nominal value Primary domestic currency: US dollar Data last updated: 09/2021,,,,,,,,,,,,,,,,,,,,,,,,,,,,,,,,,,0.111,0.145,0.141,0.171,0.269,0.27,0.338,0.497,0.311,0.515,0.633,0.671,0.797,0.932,2019.0
7094,726,SOM,GGR_NGDP,Somalia,General government revenue,"Revenue consists of taxes, social contributions, grants receivable, and other revenue. Revenue increases government's net worth, which is the difference between its assets and liabilities (GFSM 2001, paragraph 4.20). Note: Transactions that merely change the composition of the balance sheet do not change the net worth position, for example, proceeds from sales of nonfinancial and financial assets or incurrence of liabilities.",Percent of GDP,,See notes for:  General government revenue (National currency).,,,,,,,,,,,,,,,,,,,,,,,,,,,,,,,,,,2.847,3.665,3.487,4.074,5.956,5.809,6.684,9.959,5.725,8.742,9.577,9.089,9.889,10.638,2019.0
7095,726,SOM,GGX,Somalia,General government total expenditure,"Total expenditure consists of total expense and the net acquisition of nonfinancial assets. Note: Apart from being on an accrual basis, total expenditure differs from the GFSM 1986 definition of total expenditure in the sense that it also takes the disposals of nonfinancial assets into account.",National currency,Billions,,,,,,,,,,,,,,,,,,,,,,,,,,,,,,,,,,,,,,,,,,,,,,,,,
7096,726,SOM,GGX_NGDP,Somalia,General government total expenditure,"Total expenditure consists of total expense and the net acquisition of nonfinancial assets. Note: Apart from being on an accrual basis, total expenditure differs from the GFSM 1986 definition of total expenditure in the sense that it also takes the disposals of nonfinancial assets into account.",Percent of GDP,,,,,,,,,,,,,,,,,,,,,,,,,,,,,,,,,,,,,,,,,,,,,,,,,,
7097,726,SOM,GGXCNL,Somalia,General government net lending/borrowing,"Net lending (+)/ borrowing (-) is calculated as revenue minus total expenditure. This is a core GFS balance that measures the extent to which general government is either putting financial resources at the disposal of other sectors in the economy and nonresidents (net lending), or utilizing the financial resources generated by other sectors and nonresidents (net borrowing). This balance may be viewed as an indicator of the financial impact of general government activity on the rest of the economy and nonresidents (GFSM 2001, paragraph 4.17). Note: Net lending (+)/borrowing (-) is also equal to net acquisition of financial assets minus net incurrence of liabilities.",National currency,Billions,,,,,,,,,,,,,,,,,,,,,,,,,,,,,,,,,,,,,,,,,,,,,,,,,
7098,726,SOM,GGXCNL_NGDP,Somalia,General government net lending/borrowing,"Net lending (+)/ borrowing (-) is calculated as revenue minus total expenditure. This is a core GFS balance that measures the extent to which general government is either putting financial resources at the disposal of other sectors in the economy and nonresidents (net lending), or utilizing the financial resources generated by other sectors and nonresidents (net borrowing). This balance may be viewed as an indicator of the financial impact of general government activity on the rest of the economy and nonresidents (GFSM 2001, paragraph 4.17). Note: Net lending (+)/borrowing (-) is also equal to net acquisition of financial assets minus net incurrence of liabilities.",Percent of GDP,,,,,,,,,,,,,,,,,,,,,,,,,,,,,,,,,,,,,,,,,,,,,,,,,,
