,WEO Country Code,ISO,WEO Subject Code,Country,Subject Descriptor,Subject Notes,Units,Scale,Country/Series-specific Notes,1980,1981,1982,1983,1984,1985,1986,1987,1988,1989,1990,1991,1992,1993,1994,1995,1996,1997,1998,1999,2000,2001,2002,2003,2004,2005,2006,2007,2008,2009,2010,2011,2012,2013,2014,2015,2016,2017,2018,2019,2020,2021,2022,2023,2024,2025,2026,Estimates Start After
7245,524,LKA,NGDP_R,Sri Lanka,"Gross domestic product, constant prices","Expressed in billions of national currency units; the base year is country-specific. Expenditure-based GDP is total final expenditures at purchasers' prices (including the f.o.b. value of exports of goods and services), less the f.o.b. value of imports of goods and services. [SNA 1993]",National currency,Billions,Source: National Statistics Office. Department of Census and Statistics Latest actual data: 2019 National accounts manual used: System of National Accounts (SNA) 2008 GDP valuation: Market prices Start/end months of reporting year: January/December Base year: 2010. Staff used splicing method for the historical series. Chain-weighted: No Primary domestic currency: Sri Lankan rupee Data last updated: 09/2021,1436.56,1513.35,1592.54,1645.32,1755.97,1843.01,1921.92,1949.85,2002.47,2047.53,2173.94,2409.17,2333.64,2508.12,2709.66,2873.63,3223.12,3554.82,3496.31,3596.98,3899.76,3823.79,3966.29,4201.9,4430.7,4707.26,5068.22,5412.7,5734.76,5937.7,6413.67,6952.72,7588.52,7846.2,8235.43,8647.83,9035.83,9359.15,9665.38,9883.35,9530.61,9878.22,10203.79,10603.61,11042.52,11500.09,11976.78,2019.0
7246,524,LKA,NGDP_RPCH,Sri Lanka,"Gross domestic product, constant prices","Annual percentages of constant price GDP are year-on-year changes; the base year is country-specific. Expenditure-based GDP is total final expenditures at purchasers' prices (including the f.o.b. value of exports of goods and services), less the f.o.b. value of imports of goods and services. [SNA 1993]",Percent change,,"See notes for:  Gross domestic product, constant prices (National currency).",5.847,5.345,5.233,3.314,6.725,4.957,4.281,1.454,2.698,2.25,6.174,10.821,-3.135,7.477,8.036,6.051,12.162,10.291,-1.646,2.879,8.418,-1.948,3.727,5.94,5.445,6.242,7.668,6.797,5.95,3.539,8.016,8.405,9.145,3.396,4.961,5.008,4.487,3.578,3.272,2.255,-3.569,3.647,3.296,3.918,4.139,4.144,4.145,2019.0
7247,524,LKA,NGDP,Sri Lanka,"Gross domestic product, current prices","Expressed in billions of national currency units. Expenditure-based GDP is total final expenditures at purchasers' prices (including the f.o.b. value of exports of goods and services), less the f.o.b. value of imports of goods and services. [SNA 1993]",National currency,Billions,Source: National Statistics Office. Department of Census and Statistics Latest actual data: 2019 National accounts manual used: System of National Accounts (SNA) 2008 GDP valuation: Market prices Start/end months of reporting year: January/December Base year: 2010. Staff used splicing method for the historical series. Chain-weighted: No Primary domestic currency: Sri Lankan rupee Data last updated: 09/2021,83.073,100.615,117.462,143.931,181.979,192.193,212.432,232.849,262.746,298.147,380.875,440.721,503.381,591.304,685.425,790.4,909.185,1053.76,1204.93,1309.06,1488.59,1665.85,1872.38,2085.74,2392.88,2807.11,3363.2,4095.66,5047.85,5533.8,6413.67,7219.11,8732.46,9592.13,10361.15,10950.62,11996.08,13328.1,14290.91,15012.95,14972.99,16264.02,17808.06,19708.72,21807.31,24016.82,26325.48,2019.0
7248,524,LKA,NGDPD,Sri Lanka,"Gross domestic product, current prices","Values are based upon GDP in national currency converted to U.S. dollars using market exchange rates (yearly average). Exchange rate projections are provided by country economists for the group of other emerging market and developing countries. Exchanges rates for advanced economies are established in the WEO assumptions for each WEO exercise. Expenditure-based GDP is total final expenditures at purchasers' prices (including the f.o.b. value of exports of goods and services), less the f.o.b. value of imports of goods and services. [SNA 1993]",U.S. dollars,Billions,"See notes for:  Gross domestic product, current prices (National currency).",5.024,5.228,5.644,6.093,7.142,7.064,7.571,7.884,8.24,8.271,9.468,10.367,11.176,11.948,13.781,14.635,16.051,17.94,18.429,18.519,19.355,18.609,19.579,21.624,23.628,27.939,32.357,37.023,46.608,48.129,56.732,65.265,68.381,74.253,79.312,80.557,82.39,87.422,87.922,83.978,80.7,80.785,83.315,88.909,94.971,101.438,108.343,2019.0
7249,524,LKA,PPPGDP,Sri Lanka,"Gross domestic product, current prices","These data form the basis for the country weights used to generate the World Economic Outlook country group composites for the domestic economy.   The IMF is not a primary source for purchasing power parity (PPP) data. WEO weights have been created from primary sources and are used solely for purposes of generating country group composites. For primary source information, please refer to one of the following sources: the Organization for Economic Cooperation and Development, the World Bank, or the Penn World Tables.   For further information see Box 1.1 in the October 2020 World Economic Outlook, ""Revised Purchasing Power Parity Weights"" in the July 2014 WEO Update, Box A2 in the April 2004 World Economic Outlook, Box A1 in the May 2000 World Economic Outlook, and Annex IV in the May 1993 World Economic Outlook for summaries of the revised PPP-based weights; and Box 1.2 in the September 2003 World Economic Outlook for a discussion on the measurement of global growth. See also Anne Marie Gulde and Marianne Schulze-Ghattas, Purchasing Power Parity Based Weights for the World Economic Outlook, in Staff Studies for the World Economic Outlook (Washington: IMF, December 1993), pp. 106-23.",Purchasing power parity; international dollars,Billions,"See notes for:  Gross domestic product, current prices (National currency).",16.339,18.841,21.051,22.601,24.991,27.06,28.786,29.927,31.818,33.81,37.241,42.666,42.271,46.508,51.318,55.565,63.464,71.202,70.818,73.884,81.918,82.132,86.52,93.469,101.204,110.893,123.081,134.998,145.774,151.9,166.048,183.744,210.688,223.39,233.895,242.361,259.19,269.854,285.34,296.995,289.846,311.244,330.351,351.464,374.354,398.335,423.443,2019.0
7250,524,LKA,NGDP_D,Sri Lanka,"Gross domestic product, deflator",The GDP deflator is derived by dividing current price GDP by constant price GDP and is considered to be an alternate measure of inflation. Data are expressed in the base year of each country's national accounts.,Index,,"See notes for:  Gross domestic product, constant prices (National currency) Gross domestic product, current prices (National currency).",5.783,6.649,7.376,8.748,10.364,10.428,11.053,11.942,13.121,14.561,17.52,18.294,21.571,23.576,25.296,27.505,28.208,29.643,34.463,36.393,38.171,43.565,47.207,49.638,54.007,59.634,66.359,75.668,88.022,93.198,100.0,103.831,115.075,122.252,125.812,126.628,132.761,142.407,147.857,151.901,157.104,164.645,174.524,185.868,197.485,208.84,219.804,2019.0
7251,524,LKA,NGDPRPC,Sri Lanka,"Gross domestic product per capita, constant prices",GDP is expressed in constant national currency per person. Data are derived by dividing constant price GDP by total population.,National currency,Units,"See notes for:  Gross domestic product, constant prices (National currency) Population (Persons).",92362.84,96003.44,99771.55,101889.57,107584.79,111818.07,115462.11,115984.52,117931.09,119379.38,125474.04,137386.22,131570.39,139924.18,149750.81,157520.31,175481.72,192455.0,188332.2,192730.23,207681.43,202191.67,208067.97,218575.47,228537.89,240842.03,257322.68,272789.23,286967.61,295062.95,316540.93,340841.83,371530.77,381161.14,396353.36,412390.7,426158.09,436445.95,446025.8,453302.3,434790.37,448243.24,460545.19,476036.42,493094.91,510786.26,529119.45,2019.0
7252,524,LKA,NGDPRPPPPC,Sri Lanka,"Gross domestic product per capita, constant prices",GDP is expressed in constant international dollars per person. Data are derived by dividing constant price purchasing-power parity (PPP) GDP by total population.,Purchasing power parity; 2017 international dollar,Units,"See notes for:  Gross domestic product, constant prices (National currency) Population (Persons).",2663.11,2768.08,2876.73,2937.8,3102.01,3224.07,3329.13,3344.2,3400.32,3442.08,3617.81,3961.28,3793.59,4034.45,4317.79,4541.8,5059.69,5549.08,5430.21,5557.02,5988.11,5829.82,5999.25,6302.22,6589.46,6944.23,7419.42,7865.37,8274.18,8507.59,9126.87,9827.54,10712.4,10990.07,11428.11,11890.52,12287.47,12584.1,12860.32,13070.13,12536.37,12924.26,13278.96,13725.62,14217.47,14727.57,15256.17,2019.0
7253,524,LKA,NGDPPC,Sri Lanka,"Gross domestic product per capita, current prices",GDP is expressed in current national currency per person. Data are derived by dividing current price GDP by total population.,National currency,Units,"See notes for:  Gross domestic product, current prices (National currency) Population (Persons).",5341.12,6382.8,7358.91,8913.23,11149.55,11660.63,12762.2,13850.7,15473.87,17383.22,21983.17,25132.76,28380.55,32987.97,37880.35,43326.39,49500.21,57049.74,64904.49,70140.92,79274.54,88085.39,98223.17,108496.47,123426.17,143622.95,170755.68,206413.32,252594.54,274991.58,316540.88,353900.82,427537.97,465976.44,498659.69,522204.15,565772.96,621530.64,659478.91,688572.81,683074.54,738011.57,803762.12,884799.92,973787.83,1066727.3,1163027.65,2019.0
7254,524,LKA,NGDPDPC,Sri Lanka,"Gross domestic product per capita, current prices",GDP is expressed in current U.S. dollars per person. Data are derived by first converting GDP in national currency to U.S. dollars and then dividing it by total population.,U.S. dollars,Units,"See notes for:  Gross domestic product, current prices (National currency) Population (Persons).",323.039,331.643,353.59,377.293,437.552,428.611,454.825,468.952,485.277,482.238,546.464,591.178,630.112,666.574,761.606,802.204,873.9,971.235,992.717,992.283,1030.76,984.014,1027.09,1124.83,1218.73,1429.45,1642.83,1865.88,2332.26,2391.7,2799.96,3199.48,3347.89,3607.15,3817.13,3841.52,3885.76,4076.75,4057.33,3851.67,3681.55,3665.77,3760.38,3991.48,4240.87,4505.44,4786.45,2019.0
7255,524,LKA,PPPPC,Sri Lanka,"Gross domestic product per capita, current prices","Expressed in GDP in PPP dollars per person. Data are derived by dividing GDP in PPP dollars by total population. These data form the basis for the country weights used to generate the World Economic Outlook country group composites for the domestic economy.   The IMF is not a primary source for purchasing power parity (PPP) data. WEO weights have been created from primary sources and are used solely for purposes of generating country group composites. For primary source information, please refer to one of the following sources: the Organization for Economic Cooperation and Development, the World Bank, or the Penn World Tables.  For further information see Box 1.1 in the October 2020 World Economic Outlook, ""Revised Purchasing Power Parity Weights"" in the July 2014 WEO Update, Box A2 in the April 2004 World Economic Outlook, Box A1 in the May 2000 World Economic Outlook, and Annex IV in the May 1993 World Economic Outlook for summaries of the revised PPP-based weights; and Box 1.2 in the September 2003 World Economic Outlook for a discussion on the measurement of global growth. See also Anne Marie Gulde and Marianne Schulze-Ghattas, Purchasing Power Parity Based Weights for the World Economic Outlook, in Staff Studies for the World Economic Outlook (Washington: IMF, December 1993), pp. 106-23.",Purchasing power parity; international dollars,Units,"See notes for:  Gross domestic product, current prices (National currency) Population (Persons).",1050.49,1195.2,1318.86,1399.6,1531.17,1641.74,1729.38,1780.17,1873.88,1971.27,2149.45,2433.11,2383.21,2594.6,2836.13,3045.83,3455.26,3854.81,3814.69,3958.78,4362.53,4342.9,4538.77,4862.09,5220.16,5673.72,6249.02,6803.65,7294.53,7548.38,8195.17,9007.66,10315.18,10852.06,11256.86,11557.49,12224.22,12584.1,13167.53,13621.75,13222.92,14123.29,14910.3,15778.55,16716.49,17692.41,18707.21,2019.0
7257,524,LKA,PPPSH,Sri Lanka,Gross domestic product based on purchasing-power-parity (PPP) share of world total,"Expressed in percent of world GDP in PPP dollars. These data form the basis for the country weights used to generate the World Economic Outlook country group composites for the domestic economy.   The IMF is not a primary source for purchasing power parity (PPP) data. WEO weights have been created from primary sources and are used solely for purposes of generating country group composites. For primary source information, please refer to one of the following sources: the Organization for Economic Cooperation and Development, the World Bank, or the Penn World Tables.  For further information see Box 1.1 in the October 2020 World Economic Outlook, ""Revised Purchasing Power Parity Weights"" in the July 2014 WEO Update, Box A2 in the April 2004 World Economic Outlook, Box A1 in the May 2000 World Economic Outlook, and Annex IV in the May 1993 World Economic Outlook for summaries of the revised PPP-based weights; and Box 1.2 in the September 2003 World Economic Outlook for a discussion on the measurement of global growth. See also Anne Marie Gulde and Marianne Schulze-Ghattas, Purchasing Power Parity Based Weights for the World Economic Outlook, in Staff Studies for the World Economic Outlook (Washington: IMF, December 1993), pp. 106-23.",Percent,,"See notes for:  Gross domestic product, current prices (National currency).",0.122,0.126,0.133,0.134,0.137,0.139,0.14,0.137,0.134,0.132,0.135,0.146,0.128,0.134,0.141,0.144,0.156,0.165,0.158,0.157,0.163,0.156,0.157,0.16,0.16,0.163,0.166,0.168,0.173,0.18,0.185,0.193,0.21,0.212,0.214,0.218,0.224,0.222,0.221,0.22,0.22,0.215,0.212,0.213,0.214,0.216,0.218,2019.0
7258,524,LKA,PPPEX,Sri Lanka,Implied PPP conversion rate,"Expressed in national currency per current international dollar. These data form the basis for the country weights used to generate the World Economic Outlook country group composites for the domestic economy.   The IMF is not a primary source for purchasing power parity (PPP) data. WEO weights have been created from primary sources and are used solely for purposes of generating country group composites. For primary source information, please refer to one of the following sources: the Organization for Economic Cooperation and Development, the World Bank, or the Penn World Tables.  For further information see Box 1.1 in the October 2020 World Economic Outlook, ""Revised Purchasing Power Parity Weights"" in the July 2014 WEO Update, Box A2 in the April 2004 World Economic Outlook, Box A1 in the May 2000 World Economic Outlook, and Annex IV in the May 1993 World Economic Outlook for summaries of the revised PPP-based weights; and Box 1.2 in the September 2003 World Economic Outlook for a discussion on the measurement of global growth. See also Anne Marie Gulde and Marianne Schulze-Ghattas, Purchasing Power Parity Based Weights for the World Economic Outlook, in Staff Studies for the World Economic Outlook (Washington: IMF, December 1993), pp. 106-23.",National currency per current international dollar,,"See notes for:  Gross domestic product, current prices (National currency).",5.084,5.34,5.58,6.368,7.282,7.103,7.38,7.781,8.258,8.818,10.227,10.329,11.909,12.714,13.356,14.225,14.326,14.8,17.014,17.718,18.172,20.283,21.641,22.315,23.644,25.314,27.325,30.339,34.628,36.431,38.625,39.289,41.447,42.939,44.298,45.183,46.283,49.39,50.084,50.55,51.658,52.255,53.907,56.076,58.253,60.293,62.17,2019.0
7259,524,LKA,NID_NGDP,Sri Lanka,Total investment,Expressed as a ratio of total investment in current local currency and GDP in current local currency. Investment or gross capital formation is measured by the total value of the gross fixed capital formation and changes in inventories and acquisitions less disposals of valuables for a unit or sector. [SNA 1993],Percent of GDP,,Source: National Statistics Office. Department of Census and Statistics Latest actual data: 2019 National accounts manual used: System of National Accounts (SNA) 2008 GDP valuation: Market prices Start/end months of reporting year: January/December Base year: 2010. Staff used splicing method for the historical series. Chain-weighted: No Primary domestic currency: Sri Lankan rupee Data last updated: 09/2021,44.622,27.353,29.016,24.382,23.571,22.084,21.501,21.203,22.089,20.572,25.938,25.902,31.543,30.025,31.499,30.518,30.116,26.923,27.36,28.445,29.277,23.282,23.895,23.197,26.336,28.026,30.207,30.213,29.698,28.411,30.352,33.364,39.056,33.249,32.31,31.181,27.852,31.595,29.852,26.845,25.384,23.355,23.508,23.662,23.817,23.972,24.126,2019.0
7260,524,LKA,NGSD_NGDP,Sri Lanka,Gross national savings,"Expressed as a ratio of gross national savings in current local currency and GDP in current local currency. Gross national saving is gross disposable income less final consumption expenditure after taking account of an adjustment for pension funds. [SNA 1993] For many countries, the estimates of national saving are built up from national accounts data on gross domestic investment and from balance of payments-based data on net foreign investment.",Percent of GDP,,Source: National Statistics Office. Department of Census and Statistics Latest actual data: 2019 National accounts manual used: System of National Accounts (SNA) 2008 GDP valuation: Market prices Start/end months of reporting year: January/December Base year: 2010. Staff used splicing method for the historical series. Chain-weighted: No Primary domestic currency: Sri Lankan rupee Data last updated: 09/2021,26.356,13.22,13.519,15.305,21.615,15.012,12.958,13.822,12.965,12.579,21.957,19.921,26.583,24.918,24.383,23.788,24.626,23.963,25.447,24.819,23.768,22.318,22.69,22.857,23.592,25.859,25.572,26.429,21.363,27.964,28.458,26.293,33.234,29.83,29.803,28.846,25.737,28.953,26.674,24.645,24.044,20.186,20.594,21.198,21.409,21.504,21.719,2019.0
7261,524,LKA,PCPI,Sri Lanka,"Inflation, average consumer prices","Expressed in averages for the year, not end-of-period data. A consumer price index (CPI) measures changes in the prices of goods and services that households consume. Such changes affect the real purchasing power of consumers' incomes and their welfare. As the prices of different goods and services do not all change at the same rate, a price index can only reflect their average movement. A price index is typically assigned a value of unity, or 100, in some reference period and the values of the index for other periods of time are intended to indicate the average proportionate, or percentage, change in prices from this price reference period. Price indices can also be used to measure differences in price levels between different cities, regions or countries at the same point in time. [CPI Manual 2004, Introduction] For euro countries, consumer prices are calculated based on harmonized prices. For more information see http://epp.eurostat.ec.europa.eu/cache/ITY_OFFPUB/KS-BE-04-001/EN/KS-BE-04-001-EN.PDF.]",Index,,Source: National Statistics Office. CPI Colombo Latest actual data: 2020 Harmonized prices: No Frequency of source data: Monthly Base year: 2013. The current base year is 2013. The previous base year was Jan.2006-Dec.2007=100. The authorities issue data from Jan 2008 onward for this base year. We use previous base year data (2002=100) and (1952=100) to calculate historical data prior 2008. Therefore the average from Jan.2006 to Dec.2007 may not equal to 100. Primary domestic currency: Sri Lankan rupee Data last updated: 09/2021,4.123,4.863,5.39,6.142,7.164,7.271,7.85,8.456,9.639,10.755,13.066,14.658,16.327,18.245,19.786,21.305,24.7,27.063,29.599,30.988,32.902,37.56,41.148,44.838,48.879,54.247,59.683,69.138,75.8,78.4,83.3,88.9,95.6,102.233,105.058,107.408,111.692,119.042,124.125,129.467,135.367,142.29,151.184,161.01,171.074,180.91,190.408,2020.0
7262,524,LKA,PCPIPCH,Sri Lanka,"Inflation, average consumer prices",Annual percentages of average consumer prices are year-on-year changes.,Percent change,,"See notes for:  Inflation, average consumer prices (Index).",26.145,17.969,10.826,13.964,16.638,1.481,7.976,7.717,13.992,11.568,21.495,12.186,11.383,11.747,8.448,7.675,15.937,9.565,9.371,4.692,6.176,14.158,9.551,8.969,9.011,10.983,10.02,15.842,9.636,3.43,6.25,6.723,7.537,6.939,2.763,2.237,3.988,6.581,4.27,4.303,4.557,5.115,6.25,6.5,6.25,5.75,5.25,2020.0
7263,524,LKA,PCPIE,Sri Lanka,"Inflation, end of period consumer prices","Expressed in end of the period, not annual average data. A consumer price index (CPI) measures changes in the prices of goods and services that households consume. Such changes affect the real purchasing power of consumers' incomes and their welfare. As the prices of different goods and services do not all change at the same rate, a price index can only reflect their average movement. A price index is typically assigned a value of unity, or 100, in some reference period and the values of the index for other periods of time are intended to indicate the average proportionate, or percentage, change in prices from this price reference period. Price indices can also be used to measure differences in price levels between different cities, regions or countries at the same point in time. [CPI Manual 2004, Introduction] For euro countries, consumer prices are calculated based on harmonized prices. For more information see http://epp.eurostat.ec.europa.eu/cache/ITY_OFFPUB/KS-BE-04-001/EN/KS-BE-04-001-EN.PDF.",Index,,Source: National Statistics Office. CPI Colombo Latest actual data: 2020 Harmonized prices: No Frequency of source data: Monthly Base year: 2013. The current base year is 2013. The previous base year was Jan.2006-Dec.2007=100. The authorities issue data from Jan 2008 onward for this base year. We use previous base year data (2002=100) and (1952=100) to calculate historical data prior 2008. Therefore the average from Jan.2006 to Dec.2007 may not equal to 100. Primary domestic currency: Sri Lankan rupee Data last updated: 09/2021,3.792,4.485,4.727,5.74,6.284,6.377,6.956,7.663,8.815,10.146,12.137,13.231,15.059,16.613,17.312,19.305,22.549,24.971,25.901,26.933,29.852,33.081,36.815,41.3,46.7,50.2,56.9,67.6,77.0,80.9,86.4,90.6,99.0,103.6,105.0,109.8,114.7,122.9,126.3,132.4,138.0,146.28,155.788,165.914,175.869,185.542,194.819,2020.0
7264,524,LKA,PCPIEPCH,Sri Lanka,"Inflation, end of period consumer prices",Annual percentages of end of period consumer prices are year-on-year changes.,Percent change,,"See notes for:  Inflation, end of period consumer prices (Index).",24.672,18.27,5.388,21.435,9.482,1.482,9.074,10.167,15.03,15.103,19.622,9.015,13.815,10.32,4.21,11.512,16.801,10.741,3.724,3.984,10.837,10.817,11.289,12.182,13.075,7.495,13.347,18.805,13.905,5.065,6.799,4.861,9.272,4.646,1.351,4.571,4.463,7.149,2.766,4.83,4.23,6.0,6.5,6.5,6.0,5.5,5.0,2020.0
7268,524,LKA,TX_RPCH,Sri Lanka,Volume of exports of goods and services,"Percent change of volume of exports refers to the aggregate change in the quantities of total exports whose characteristics are unchanged. The goods and services and their prices are held constant, therefore changes are due to changes in quantities only. [Export and Import Price Index Manual: Theory and Practice, Glossary]",Percent change,,"Source: National Statistics Office. Department of Census and Statistics Latest actual data: 2019 Base year: 2005 Methodology used to derive volumes: Deflation by unit value indexes (from customs data) Formula used to derive volumes: Laspeyres-type Chain-weighted: No Trade System: General trade Valuation of exports: Free on board (FOB) Valuation of imports: Cost, insurance, freight (CIF) Primary domestic currency: Sri Lankan rupee Data last updated: 09/2021",4.425,4.054,5.195,-4.938,16.883,11.111,5.0,-0.952,-2.885,1.98,16.5,1.2,4.0,14.3,9.4,7.16,4.147,10.619,-1.5,5.076,18.261,11.341,-13.515,8.383,7.7,-0.578,4.667,2.31,-2.271,-16.346,13.791,-11.016,-8.3,16.658,13.579,3.632,9.542,3.928,6.08,-2.119,-29.544,9.017,21.956,10.666,6.862,4.621,4.798,2019.0
7269,524,LKA,TXG_RPCH,Sri Lanka,Volume of exports of goods,"Percent change of volume of exports of goods refers to the aggregate change in the quantities of exports of goods whose characteristics are unchanged. The goods and their prices are held constant, therefore changes are due to changes in quantities only. [Export and Import Price Index Manual: Theory and Practice, Glossary]",Percent change,,"Source: National Statistics Office. Department of Census and Statistics Latest actual data: 2019 Base year: 2005 Methodology used to derive volumes: Deflation by unit value indexes (from customs data) Formula used to derive volumes: Laspeyres-type Chain-weighted: No Trade System: General trade Valuation of exports: Free on board (FOB) Valuation of imports: Cost, insurance, freight (CIF) Primary domestic currency: Sri Lankan rupee Data last updated: 09/2021",-0.994,4.054,5.195,-4.938,16.883,11.111,5.0,-0.952,-2.885,1.98,16.5,1.2,4.0,14.3,9.4,7.16,4.147,10.619,-1.5,5.076,18.261,11.341,-13.515,8.383,7.7,-0.578,4.667,2.31,-2.271,-16.346,13.791,-11.016,-8.3,16.658,13.579,3.632,9.542,3.928,6.08,-2.119,-29.544,9.017,21.956,10.666,6.862,4.621,4.798,2019.0
