,WEO Country Code,ISO,WEO Subject Code,Country,Subject Descriptor,Subject Notes,Units,Scale,Country/Series-specific Notes,1980,1981,1982,1983,1984,1985,1986,1987,1988,1989,1990,1991,1992,1993,1994,1995,1996,1997,1998,1999,2000,2001,2002,2003,2004,2005,2006,2007,2008,2009,2010,2011,2012,2013,2014,2015,2016,2017,2018,2019,2020,2021,2022,2023,2024,2025,2026,Estimates Start After
7764,738,TZA,TXG_RPCH,Tanzania,Volume of exports of goods,"Percent change of volume of exports of goods refers to the aggregate change in the quantities of exports of goods whose characteristics are unchanged. The goods and their prices are held constant, therefore changes are due to changes in quantities only. [Export and Import Price Index Manual: Theory and Practice, Glossary]",Percent change,,"Source: Central Bank Latest actual data: 2020 Base year: 2002. The base year is FY 2002, so in CY2002, the deflator is not equal to 100. Methodology used to derive volumes: Deflation by survey-based price indexes Formula used to derive volumes: Laspeyres-type Chain-weighted: Yes, from 2002 Trade System: General trade Valuation of exports: Free on board (FOB) Valuation of imports: Cost, insurance, freight (CIF) Primary domestic currency: Tanzanian shilling Data last updated: 09/2021",13.2,12.7,1.8,-17.4,-2.4,-3.5,-5.8,7.7,10.7,16.9,8.6,-11.195,19.88,-5.076,7.194,33.938,19.538,-10.999,-14.458,-18.517,27.453,25.644,29.672,17.975,17.758,9.512,-2.083,-0.413,-1.944,-2.245,7.508,6.664,2.987,1.771,7.039,13.911,-2.014,-11.788,10.887,9.447,-0.928,2.782,3.907,5.485,5.85,6.532,3.323,2020.0
7767,738,TZA,LP,Tanzania,Population,"For census purposes, the total population of the country consists of all persons falling within the scope of the census. In the broadest sense, the total may comprise either all usual residents of the country or all persons present in the country at the time of the census. [Principles and Recommendations for Population and Housing Censuses, Revision 1, paragraph 2.42]",Persons,Millions,Source: National Statistics Office Latest actual data: 2012 Primary domestic currency: Tanzanian shilling Data last updated: 09/2021,18.034,18.601,19.187,19.791,20.402,21.036,21.68,22.336,23.016,23.737,24.507,25.336,26.216,27.116,27.997,28.829,29.603,30.33,31.014,31.751,32.544,33.406,34.328,35.302,36.314,37.354,38.421,39.522,40.64,41.824,43.06,44.348,45.688,47.076,48.511,49.989,51.51,53.074,54.68,56.322,58.001,59.73,61.51,63.343,65.231,67.175,69.177,2012.0
7782,738,TZA,NGDP_FY,Tanzania,"Gross domestic product corresponding to fiscal year, current prices","Gross domestic product corresponding to fiscal year is the country's GDP based on the same period during the year as their fiscal data. In the case of countries whose fiscal data are based on a fiscal calendar (e.g., July to June), this series would be the country's GDP over that same period. For countries whose fiscal data are based on a calendar year (i.e., January to December), this series will be the same as their GDP in current prices.",National currency,Billions,"Source: Ministry of Finance or Treasury Latest actual data: 2020 Start/end months of reporting year: January/December GFS Manual used: Government Finance Statistics Manual (GFSM) 1986 Basis of recording: Cash General government includes: Central Government; Local Government; Valuation of public debt: Nominal value Instruments included in gross and net debt: Securities Other than Shares; Loans; Shares and Other Equity; Other Accounts Receivable/Payable;. Stocks, T-bonds (special bonds, 2-y, 5-y, 7-y, 10-y, and 15-y), T-bills, other (tax reserve certificates) Primary domestic currency: Tanzanian shilling Data last updated: 09/2021",89.277,106.74,129.113,149.294,175.945,224.432,295.983,400.119,614.998,769.622,1008.78,1319.15,1663.55,2095.47,2791.71,3668.05,4575.36,5718.08,7631.15,8770.96,9900.61,11051.22,12683.64,14702.61,16966.87,19387.99,23633.85,27155.84,33236.64,38269.96,44467.11,53522.18,62318.66,72977.2,82603.39,94349.32,108362.32,118744.5,129014.83,139893.8,148522.11,160268.17,175021.27,192010.66,211330.23,233018.14,256910.35,2020.0
7783,738,TZA,BCA,Tanzania,Current account balance,"Current account is all transactions other than those in financial and capital items. The major classifications are goods and services, income and current transfers. The focus of the BOP is on transactions (between an economy and the rest of the world) in goods, services, and income.",U.S. dollars,Billions,"Source: Central Bank Latest actual data: 2020 BOP Manual used: Balance of Payments and International Investment Position Manual, sixth edition (BPM6) Primary domestic currency: Tanzanian shilling Data last updated: 09/2021",-0.521,-0.407,-0.523,-0.305,-0.359,-0.375,-0.321,-0.407,-0.357,-0.335,-0.559,-0.737,-0.714,-0.895,-0.637,-0.59,-0.413,-0.436,-0.704,-0.777,-0.397,-0.309,-0.174,-0.16,-0.5,-0.907,-1.343,-1.831,-2.126,-2.179,-2.352,-3.571,-4.586,-4.891,-4.897,-3.67,-2.103,-1.407,-1.735,-1.543,-1.144,-2.241,-2.861,-2.531,-2.511,-2.521,-2.634,2020.0
7784,738,TZA,BCA_NGDPD,Tanzania,Current account balance,"Current account is all transactions other than those in financial and capital items. The major classifications are goods and services, income and current transfers. The focus of the BOP is on transactions (between an economy and the rest of the world) in goods, services, and income.",Percent of GDP,,"See notes for:  Gross domestic product, current prices (National currency) Current account balance (U.S. dollars).",-4.793,-3.126,-3.504,-1.992,-2.58,-2.987,-2.023,-5.209,-4.77,-5.2,-10.807,-12.252,-12.782,-17.306,-11.636,-9.241,-5.232,-4.67,-6.135,-6.599,-3.213,-2.45,-1.327,-1.131,-3.211,-5.282,-7.118,-8.394,-7.659,-7.516,-7.457,-10.481,-11.565,-10.707,-9.794,-7.745,-4.225,-2.644,-3.059,-2.537,-1.776,-3.237,-3.838,-3.161,-2.913,-2.712,-2.629,2020.0
