,WEO Country Code,ISO,WEO Subject Code,Country,Subject Descriptor,Subject Notes,Units,Scale,Country/Series-specific Notes,1980,1981,1982,1983,1984,1985,1986,1987,1988,1989,1990,1991,1992,1993,1994,1995,1996,1997,1998,1999,2000,2001,2002,2003,2004,2005,2006,2007,2008,2009,2010,2011,2012,2013,2014,2015,2016,2017,2018,2019,2020,2021,2022,2023,2024,2025,2026,Estimates Start After
8100,925,TKM,NGDP_R,Turkmenistan,"Gross domestic product, constant prices","Expressed in billions of national currency units; the base year is country-specific. Expenditure-based GDP is total final expenditures at purchasers' prices (including the f.o.b. value of exports of goods and services), less the f.o.b. value of imports of goods and services. [SNA 1993]",National currency,Billions,"Source: IMF Staff Estimates. Staff estimates, compiled in line with international (System of National Accounts) methodologies, using official estimates and sources, as well as UN and World Bank databases. The Turkmenistan authorities' estimate of real GDP growth in 2020 is 5.9 percent. Latest actual data: 2020 National accounts manual used: Not applicable GDP valuation: Market prices Start/end months of reporting year: January/December Base year: 2006 Chain-weighted: Yes, from 2007 Primary domestic currency: New Turkmen manat Data last updated: 08/2021",,,,,,,,,,,,,31.51,28.359,23.453,21.764,20.306,18.012,19.218,22.389,26.551,31.964,37.004,43.331,49.697,56.177,62.338,69.231,79.441,84.313,96.596,109.859,117.131,117.678,123.059,124.966,119.12,119.689,121.276,111.913,108.159,113.06,114.952,116.943,119.038,121.243,123.56,2020.0
8101,925,TKM,NGDP_RPCH,Turkmenistan,"Gross domestic product, constant prices","Annual percentages of constant price GDP are year-on-year changes; the base year is country-specific. Expenditure-based GDP is total final expenditures at purchasers' prices (including the f.o.b. value of exports of goods and services), less the f.o.b. value of imports of goods and services. [SNA 1993]",Percent change,,"See notes for:  Gross domestic product, constant prices (National currency).",,,,,,,,,,,,,,-10.0,-17.3,-7.2,-6.7,-11.3,6.7,16.499,18.587,20.391,15.768,17.095,14.692,13.04,10.967,11.057,14.747,6.133,14.569,13.73,6.619,0.467,4.572,1.55,-4.678,0.478,1.326,-7.721,-3.355,4.532,1.673,1.732,1.791,1.852,1.912,2020.0
8102,925,TKM,NGDP,Turkmenistan,"Gross domestic product, current prices","Expressed in billions of national currency units. Expenditure-based GDP is total final expenditures at purchasers' prices (including the f.o.b. value of exports of goods and services), less the f.o.b. value of imports of goods and services. [SNA 1993]",National currency,Billions,"Source: IMF Staff Estimates. Staff estimates, compiled in line with international (System of National Accounts) methodologies, using official estimates and sources, as well as UN and World Bank databases. The Turkmenistan authorities' estimate of real GDP growth in 2020 is 5.9 percent. Latest actual data: 2020 National accounts manual used: Not applicable GDP valuation: Market prices Start/end months of reporting year: January/December Base year: 2006 Chain-weighted: Yes, from 2007 Primary domestic currency: New Turkmen manat Data last updated: 08/2021",,,,,,,,,,,,,,0.003,0.03,0.223,2.656,3.806,4.795,6.872,8.948,12.353,15.501,20.354,25.293,30.598,38.116,46.256,84.75,98.697,99.401,128.685,147.505,151.402,165.005,147.567,134.758,144.849,142.667,161.923,159.63,185.806,210.921,233.206,258.523,287.251,319.82,2020.0
8103,925,TKM,NGDPD,Turkmenistan,"Gross domestic product, current prices","Values are based upon GDP in national currency converted to U.S. dollars using market exchange rates (yearly average). Exchange rate projections are provided by country economists for the group of other emerging market and developing countries. Exchanges rates for advanced economies are established in the WEO assumptions for each WEO exercise. Expenditure-based GDP is total final expenditures at purchasers' prices (including the f.o.b. value of exports of goods and services), less the f.o.b. value of imports of goods and services. [SNA 1993]",U.S. dollars,Billions,"See notes for:  Gross domestic product, current prices (National currency).",,,,,,,,,,,,,1.629,9.187,7.781,10.063,4.076,4.593,4.903,6.608,8.604,11.878,14.904,19.571,24.32,29.421,36.65,44.476,36.861,34.63,34.877,45.153,51.756,53.124,57.897,42.162,38.502,41.385,40.762,46.264,45.609,53.087,60.263,66.63,73.864,82.072,91.377,2020.0
8104,925,TKM,PPPGDP,Turkmenistan,"Gross domestic product, current prices","These data form the basis for the country weights used to generate the World Economic Outlook country group composites for the domestic economy.   The IMF is not a primary source for purchasing power parity (PPP) data. WEO weights have been created from primary sources and are used solely for purposes of generating country group composites. For primary source information, please refer to one of the following sources: the Organization for Economic Cooperation and Development, the World Bank, or the Penn World Tables.   For further information see Box 1.1 in the October 2020 World Economic Outlook, ""Revised Purchasing Power Parity Weights"" in the July 2014 WEO Update, Box A2 in the April 2004 World Economic Outlook, Box A1 in the May 2000 World Economic Outlook, and Annex IV in the May 1993 World Economic Outlook for summaries of the revised PPP-based weights; and Box 1.2 in the September 2003 World Economic Outlook for a discussion on the measurement of global growth. See also Anne Marie Gulde and Marianne Schulze-Ghattas, Purchasing Power Parity Based Weights for the World Economic Outlook, in Staff Studies for the World Economic Outlook (Washington: IMF, December 1993), pp. 106-23.",Purchasing power parity; international dollars,Billions,"See notes for:  Gross domestic product, current prices (National currency).",,,,,,,,,,,,,17.745,16.349,13.81,13.084,12.431,11.216,12.103,14.298,17.34,21.346,25.097,29.967,35.292,41.146,47.067,53.684,62.782,67.06,77.753,90.266,93.486,92.651,98.098,89.733,83.556,89.247,92.591,86.971,85.066,92.126,96.245,100.243,104.364,108.606,112.975,2020.0
8105,925,TKM,NGDP_D,Turkmenistan,"Gross domestic product, deflator",The GDP deflator is derived by dividing current price GDP by constant price GDP and is considered to be an alternate measure of inflation. Data are expressed in the base year of each country's national accounts.,Index,,"See notes for:  Gross domestic product, constant prices (National currency) Gross domestic product, current prices (National currency).",,,,,,,,,,,,,,0.012,0.127,1.026,13.08,21.132,24.951,30.694,33.701,38.647,41.888,46.975,50.895,54.467,61.143,66.813,106.683,117.059,102.903,117.136,125.931,128.658,134.086,118.086,113.128,121.021,117.638,144.687,147.589,164.342,183.486,199.418,217.176,236.922,258.837,2020.0
8106,925,TKM,NGDPRPC,Turkmenistan,"Gross domestic product per capita, constant prices",GDP is expressed in constant national currency per person. Data are derived by dividing constant price GDP by total population.,National currency,Units,"See notes for:  Gross domestic product, constant prices (National currency) Population (Persons).",,,,,,,,,,,,,7927.02,7063.0,5693.35,5166.74,4730.56,4129.91,4347.16,5002.77,5864.12,6981.76,7997.59,9268.38,10519.57,11763.72,12907.71,14167.81,16061.12,16835.87,18988.11,21232.74,22235.19,21929.24,22512.54,22454.55,21111.43,20962.7,21019.64,19110.15,18197.56,18834.84,18958.89,19095.9,19247.68,19409.99,19583.03,2004.0
8107,925,TKM,NGDPRPPPPC,Turkmenistan,"Gross domestic product per capita, constant prices",GDP is expressed in constant international dollars per person. Data are derived by dividing constant price purchasing-power parity (PPP) GDP by total population.,Purchasing power parity; 2017 international dollar,Units,"See notes for:  Gross domestic product, constant prices (National currency) Population (Persons).",,,,,,,,,,,,,5910.87,5266.6,4245.31,3852.63,3527.4,3079.52,3241.51,3730.37,4372.64,5206.03,5963.49,6911.07,7844.03,8771.74,9624.78,10564.38,11976.15,12553.85,14158.69,15832.42,16579.91,16351.78,16786.72,16743.48,15741.97,15631.07,15673.52,14249.69,13569.21,14044.41,14136.91,14239.06,14352.24,14473.27,14602.3,2004.0
8108,925,TKM,NGDPPC,Turkmenistan,"Gross domestic product per capita, current prices",GDP is expressed in current national currency per person. Data are derived by dividing current price GDP by total population.,National currency,Units,"See notes for:  Gross domestic product, current prices (National currency) Population (Persons).",,,,,,,,,,,,,0.033,0.824,7.253,53.033,618.742,872.739,1084.65,1535.56,1976.27,2698.23,3350.07,4353.78,5353.9,6407.34,7892.21,9465.94,17134.41,19707.98,19539.32,24871.23,28001.04,28213.67,30186.24,26515.59,23882.99,25369.3,24727.09,27649.87,26857.59,30953.54,34786.89,38080.69,41801.35,45986.57,50688.16,2004.0
8109,925,TKM,NGDPDPC,Turkmenistan,"Gross domestic product per capita, current prices",GDP is expressed in current U.S. dollars per person. Data are derived by first converting GDP in national currency to U.S. dollars and then dividing it by total population.,U.S. dollars,Units,"See notes for:  Gross domestic product, current prices (National currency) Population (Persons).",,,,,,,,,,,,,409.7,2288.15,1888.79,2388.87,949.573,1053.19,1109.02,1476.5,1900.26,2594.45,3221.22,4186.32,5147.98,6160.91,7588.66,9101.87,7452.44,6915.08,6855.9,8726.75,9824.93,9899.53,10591.66,7575.88,6823.71,7248.37,7064.88,7899.96,7673.6,8843.87,9939.11,10880.2,11943.24,13139.02,14482.33,2004.0
8110,925,TKM,PPPPC,Turkmenistan,"Gross domestic product per capita, current prices","Expressed in GDP in PPP dollars per person. Data are derived by dividing GDP in PPP dollars by total population. These data form the basis for the country weights used to generate the World Economic Outlook country group composites for the domestic economy.   The IMF is not a primary source for purchasing power parity (PPP) data. WEO weights have been created from primary sources and are used solely for purposes of generating country group composites. For primary source information, please refer to one of the following sources: the Organization for Economic Cooperation and Development, the World Bank, or the Penn World Tables.  For further information see Box 1.1 in the October 2020 World Economic Outlook, ""Revised Purchasing Power Parity Weights"" in the July 2014 WEO Update, Box A2 in the April 2004 World Economic Outlook, Box A1 in the May 2000 World Economic Outlook, and Annex IV in the May 1993 World Economic Outlook for summaries of the revised PPP-based weights; and Box 1.2 in the September 2003 World Economic Outlook for a discussion on the measurement of global growth. See also Anne Marie Gulde and Marianne Schulze-Ghattas, Purchasing Power Parity Based Weights for the World Economic Outlook, in Staff Studies for the World Economic Outlook (Washington: IMF, December 1993), pp. 106-23.",Purchasing power parity; international dollars,Units,"See notes for:  Gross domestic product, current prices (National currency) Population (Persons).",,,,,,,,,,,,,4464.18,4071.87,3352.37,3106.08,2895.94,2571.83,2737.58,3194.84,3829.75,4662.39,5424.0,6409.91,7470.52,8616.03,9745.64,10986.13,12693.08,13390.64,15283.98,17445.84,17746.48,17265.47,17946.21,16123.67,14808.53,15631.07,16047.93,14851.1,14312.32,15347.36,15873.64,16368.79,16874.95,17386.91,17905.43,2004.0
8111,925,TKM,NGAP_NPGDP,Turkmenistan,Output gap in percent of potential GDP,"Output gaps for advanced economies are calculated as actual GDP less potential GDP as a percent of potential GDP. Estimates of output gaps are subject to a significant margin of uncertainty. For a discussion of approaches to calculating potential output, see Paula R. De Masi, IMF Estimates of Potential Output: Theory and Practice, in Staff Studies for the World Economic Outlook (Washington: IMF, December 1997), pp. 40-46.",Percent of potential GDP,,,,,,,,,,,,,,,,,,,,,,,,,,,,,,,,,,,,,,,,,,,,,,,,,,
8112,925,TKM,PPPSH,Turkmenistan,Gross domestic product based on purchasing-power-parity (PPP) share of world total,"Expressed in percent of world GDP in PPP dollars. These data form the basis for the country weights used to generate the World Economic Outlook country group composites for the domestic economy.   The IMF is not a primary source for purchasing power parity (PPP) data. WEO weights have been created from primary sources and are used solely for purposes of generating country group composites. For primary source information, please refer to one of the following sources: the Organization for Economic Cooperation and Development, the World Bank, or the Penn World Tables.  For further information see Box 1.1 in the October 2020 World Economic Outlook, ""Revised Purchasing Power Parity Weights"" in the July 2014 WEO Update, Box A2 in the April 2004 World Economic Outlook, Box A1 in the May 2000 World Economic Outlook, and Annex IV in the May 1993 World Economic Outlook for summaries of the revised PPP-based weights; and Box 1.2 in the September 2003 World Economic Outlook for a discussion on the measurement of global growth. See also Anne Marie Gulde and Marianne Schulze-Ghattas, Purchasing Power Parity Based Weights for the World Economic Outlook, in Staff Studies for the World Economic Outlook (Washington: IMF, December 1993), pp. 106-23.",Percent,,"See notes for:  Gross domestic product, current prices (National currency).",,,,,,,,,,,,,0.054,0.047,0.038,0.034,0.031,0.026,0.027,0.03,0.034,0.041,0.046,0.051,0.056,0.06,0.064,0.067,0.075,0.08,0.087,0.095,0.093,0.088,0.09,0.081,0.072,0.073,0.072,0.064,0.064,0.064,0.062,0.061,0.06,0.059,0.058,2020.0
8113,925,TKM,PPPEX,Turkmenistan,Implied PPP conversion rate,"Expressed in national currency per current international dollar. These data form the basis for the country weights used to generate the World Economic Outlook country group composites for the domestic economy.   The IMF is not a primary source for purchasing power parity (PPP) data. WEO weights have been created from primary sources and are used solely for purposes of generating country group composites. For primary source information, please refer to one of the following sources: the Organization for Economic Cooperation and Development, the World Bank, or the Penn World Tables.  For further information see Box 1.1 in the October 2020 World Economic Outlook, ""Revised Purchasing Power Parity Weights"" in the July 2014 WEO Update, Box A2 in the April 2004 World Economic Outlook, Box A1 in the May 2000 World Economic Outlook, and Annex IV in the May 1993 World Economic Outlook for summaries of the revised PPP-based weights; and Box 1.2 in the September 2003 World Economic Outlook for a discussion on the measurement of global growth. See also Anne Marie Gulde and Marianne Schulze-Ghattas, Purchasing Power Parity Based Weights for the World Economic Outlook, in Staff Studies for the World Economic Outlook (Washington: IMF, December 1993), pp. 106-23.",National currency per current international dollar,,"See notes for:  Gross domestic product, current prices (National currency).",,,,,,,,,,,,,,,0.002,0.017,0.214,0.339,0.396,0.481,0.516,0.579,0.618,0.679,0.717,0.744,0.81,0.862,1.35,1.472,1.278,1.426,1.578,1.634,1.682,1.645,1.613,1.623,1.541,1.862,1.877,2.017,2.191,2.326,2.477,2.645,2.831,2020.0
8114,925,TKM,NID_NGDP,Turkmenistan,Total investment,Expressed as a ratio of total investment in current local currency and GDP in current local currency. Investment or gross capital formation is measured by the total value of the gross fixed capital formation and changes in inventories and acquisitions less disposals of valuables for a unit or sector. [SNA 1993],Percent of GDP,,,,,,,,,,,,,,,,,,,,,,,,,,,,,,,,,,,,,,,,,,,,,,,,,,
8115,925,TKM,NGSD_NGDP,Turkmenistan,Gross national savings,"Expressed as a ratio of gross national savings in current local currency and GDP in current local currency. Gross national saving is gross disposable income less final consumption expenditure after taking account of an adjustment for pension funds. [SNA 1993] For many countries, the estimates of national saving are built up from national accounts data on gross domestic investment and from balance of payments-based data on net foreign investment.",Percent of GDP,,,,,,,,,,,,,,,,,,,,,,,,,,,,,,,,,,,,,,,,,,,,,,,,,,
8116,925,TKM,PCPI,Turkmenistan,"Inflation, average consumer prices","Expressed in averages for the year, not end-of-period data. A consumer price index (CPI) measures changes in the prices of goods and services that households consume. Such changes affect the real purchasing power of consumers' incomes and their welfare. As the prices of different goods and services do not all change at the same rate, a price index can only reflect their average movement. A price index is typically assigned a value of unity, or 100, in some reference period and the values of the index for other periods of time are intended to indicate the average proportionate, or percentage, change in prices from this price reference period. Price indices can also be used to measure differences in price levels between different cities, regions or countries at the same point in time. [CPI Manual 2004, Introduction] For euro countries, consumer prices are calculated based on harmonized prices. For more information see http://epp.eurostat.ec.europa.eu/cache/ITY_OFFPUB/KS-BE-04-001/EN/KS-BE-04-001-EN.PDF.]",Index,,"Source: National Statistics Office. Turkmenistan authorities and IMF staff estimates and projections. Latest actual data: 2020 Harmonized prices: No Frequency of source data: Monthly Base year: 1998. The base year for PCPICO and PCPICO_EOP is 2001, which is different than the base year for headline CPI data, which is 1998. Primary domestic currency: New Turkmen manat Data last updated: 08/2021",,,,,,,,,,,,,0.001,0.022,0.404,4.461,48.731,89.529,104.545,129.077,139.455,155.676,169.303,178.762,189.282,209.551,226.644,240.83,275.844,268.474,280.413,295.21,310.897,332.081,352.034,378.101,391.884,423.395,479.706,504.13,542.36,609.884,689.169,758.086,833.895,917.284,1009.01,2020.0
8117,925,TKM,PCPIPCH,Turkmenistan,"Inflation, average consumer prices",Annual percentages of average consumer prices are year-on-year changes.,Percent change,,"See notes for:  Inflation, average consumer prices (Index).",,,,,,,,,,,,,,3102.4,1748.3,1005.26,992.389,83.722,16.771,23.465,8.04,11.632,8.753,5.587,5.885,10.708,8.157,6.259,14.539,-2.672,4.447,5.277,5.314,6.814,6.009,7.405,3.646,8.041,13.3,5.092,7.583,12.45,13.0,10.0,10.0,10.0,10.0,2020.0
8118,925,TKM,PCPIE,Turkmenistan,"Inflation, end of period consumer prices","Expressed in end of the period, not annual average data. A consumer price index (CPI) measures changes in the prices of goods and services that households consume. Such changes affect the real purchasing power of consumers' incomes and their welfare. As the prices of different goods and services do not all change at the same rate, a price index can only reflect their average movement. A price index is typically assigned a value of unity, or 100, in some reference period and the values of the index for other periods of time are intended to indicate the average proportionate, or percentage, change in prices from this price reference period. Price indices can also be used to measure differences in price levels between different cities, regions or countries at the same point in time. [CPI Manual 2004, Introduction] For euro countries, consumer prices are calculated based on harmonized prices. For more information see http://epp.eurostat.ec.europa.eu/cache/ITY_OFFPUB/KS-BE-04-001/EN/KS-BE-04-001-EN.PDF.",Index,,"Source: National Statistics Office. Turkmenistan authorities and IMF staff estimates and projections. Latest actual data: 2020 Harmonized prices: No Frequency of source data: Monthly Base year: 1998. The base year for PCPICO and PCPICO_EOP is 2001, which is different than the base year for headline CPI data, which is 1998. Primary domestic currency: New Turkmen manat Data last updated: 08/2021",,,,,,,,,,,,,,0.069,0.992,13.507,73.717,89.554,107.308,128.918,138.421,154.68,166.753,171.855,187.322,206.717,221.389,240.534,262.028,262.415,274.94,290.249,312.98,325.506,339.887,360.299,382.521,422.377,452.788,481.163,523.986,607.824,668.606,735.467,809.014,889.915,978.907,2020.0
8119,925,TKM,PCPIEPCH,Turkmenistan,"Inflation, end of period consumer prices",Annual percentages of end of period consumer prices are year-on-year changes.,Percent change,,"See notes for:  Inflation, end of period consumer prices (Index).",,,,,,,,,,,,,,,1327.95,1261.54,445.756,21.483,19.826,20.138,7.372,11.746,7.805,3.059,9.0,10.354,7.098,8.648,8.936,0.148,4.773,5.568,7.832,4.002,4.418,6.005,6.168,10.419,7.2,6.267,8.9,16.0,10.0,10.0,10.0,10.0,10.0,2020.0
8120,925,TKM,FLIBOR6,Turkmenistan,Six-month London interbank offered rate (LIBOR),,Percent,,,,,,,,,,,,,,,,,,,,,,,,,,,,,,,,,,,,,,,,,,,,,,,,,,
8121,925,TKM,TM_RPCH,Turkmenistan,Volume of imports of goods and services,"Percent change of volume of imports refers to the aggregate change in the quantities of total imports whose characteristics are unchanged. The goods and services and their prices are held constant, therefore changes are due to changes in quantities only. [Export and Import Price Index Manual: Theory and Practice, Glossary]",Percent change,,"Source: National Statistics Office Latest actual data: 2020 Base year: 1997 Chain-weighted: No Oil coverage: Primary or unrefined products; Valuation of exports: Free on board (FOB) Valuation of imports: Cost, insurance, freight (CIF) Primary domestic currency: New Turkmen manat Data last updated: 08/2021",,,,,,,,,,,,,,,,,,,16.582,14.055,14.363,19.583,-12.167,31.908,8.985,-9.865,-17.639,26.361,52.353,59.305,-6.241,23.385,17.625,8.437,1.326,-12.73,-14.918,-22.767,-48.763,9.088,4.878,-0.2,9.24,7.231,6.339,6.723,9.549,2020.0
8122,925,TKM,TMG_RPCH,Turkmenistan,Volume of Imports of goods,"Percent change of volume of imports of goods refers to the aggregate change in the quantities of imports of goods whose characteristics are unchanged. The goods and their prices are held constant, therefore changes are due to changes in quantities only. [Export and Import Price Index Manual: Theory and Practice, Glossary]",Percent change,,"Source: National Statistics Office Latest actual data: 2020 Base year: 1997 Chain-weighted: No Oil coverage: Primary or unrefined products; Valuation of exports: Free on board (FOB) Valuation of imports: Cost, insurance, freight (CIF) Primary domestic currency: New Turkmen manat Data last updated: 08/2021",,,,,,,,,,,,,,0.0,,,0.0,,20.067,24.23,26.251,25.176,-12.978,30.805,10.573,-11.276,-22.891,36.756,36.157,64.716,-10.444,32.857,21.567,17.12,3.789,-12.98,-1.188,-22.767,-48.763,9.088,4.878,-0.2,9.24,7.231,6.339,6.723,7.421,2020.0
8123,925,TKM,TX_RPCH,Turkmenistan,Volume of exports of goods and services,"Percent change of volume of exports refers to the aggregate change in the quantities of total exports whose characteristics are unchanged. The goods and services and their prices are held constant, therefore changes are due to changes in quantities only. [Export and Import Price Index Manual: Theory and Practice, Glossary]",Percent change,,"Source: National Statistics Office Latest actual data: 2020 Base year: 1997 Chain-weighted: No Oil coverage: Primary or unrefined products; Valuation of exports: Free on board (FOB) Valuation of imports: Cost, insurance, freight (CIF) Primary domestic currency: New Turkmen manat Data last updated: 08/2021",,,,,,,,,,,,,,0.0,,,0.0,,-6.426,41.265,69.438,5.474,3.993,16.672,1.033,3.422,1.405,8.99,-8.346,-45.313,16.798,17.458,15.712,3.176,11.062,-5.771,-1.237,-15.192,10.452,-11.051,-8.147,20.079,-6.641,1.267,1.21,1.121,1.047,2020.0
8124,925,TKM,TXG_RPCH,Turkmenistan,Volume of exports of goods,"Percent change of volume of exports of goods refers to the aggregate change in the quantities of exports of goods whose characteristics are unchanged. The goods and their prices are held constant, therefore changes are due to changes in quantities only. [Export and Import Price Index Manual: Theory and Practice, Glossary]",Percent change,,"Source: National Statistics Office Latest actual data: 2020 Base year: 1997 Chain-weighted: No Oil coverage: Primary or unrefined products; Valuation of exports: Free on board (FOB) Valuation of imports: Cost, insurance, freight (CIF) Primary domestic currency: New Turkmen manat Data last updated: 08/2021",,,,,,,,,,,,,,,,,,,-8.76,65.632,81.042,6.384,5.94,16.822,-0.692,6.131,2.951,9.226,-8.33,-46.159,17.131,19.2,15.868,2.619,11.091,-7.712,-4.64,-14.259,14.87,-11.546,-8.874,20.459,-7.743,0.955,0.893,0.853,0.827,2020.0
8125,925,TKM,LUR,Turkmenistan,Unemployment rate,"Unemployment rate can be defined by either the national definition, the ILO harmonized definition, or the OECD harmonized definition. The OECD harmonized unemployment rate gives the number of unemployed persons as a percentage of the labor force (the total number of people employed plus unemployed). [OECD Main Economic Indicators, OECD, monthly] As defined by the International Labour Organization, unemployed workers are those who are currently not working but are willing and able to work for pay, currently available to work, and have actively searched for work. [ILO, http://www.ilo.org/public/english/bureau/stat/res/index.htm]",Percent of total labor force,,,,,,,,,,,,,,,,,,,,,,,,,,,,,,,,,,,,,,,,,,,,,,,,,,
