,WEO Country Code,ISO,WEO Subject Code,Country,Subject Descriptor,Subject Notes,Units,Scale,Country/Series-specific Notes,1980,1981,1982,1983,1984,1985,1986,1987,1988,1989,1990,1991,1992,1993,1994,1995,1996,1997,1998,1999,2000,2001,2002,2003,2004,2005,2006,2007,2008,2009,2010,2011,2012,2013,2014,2015,2016,2017,2018,2019,2020,2021,2022,2023,2024,2025,2026,Estimates Start After
8415,298,URY,NGDP_R,Uruguay,"Gross domestic product, constant prices","Expressed in billions of national currency units; the base year is country-specific. Expenditure-based GDP is total final expenditures at purchasers' prices (including the f.o.b. value of exports of goods and services), less the f.o.b. value of imports of goods and services. [SNA 1993]",National currency,Billions,"Source: Central Bank Latest actual data: 2020 Notes: Data for years between 2016 and last actual for these series are reported by national authorities. Data prior to 2016 are the staff's estimates, representing best effort to preserve the previously reported growth rates and avoid structural breaks. National accounts manual used: System of National Accounts (SNA) 2008 GDP valuation: Market prices Start/end months of reporting year: January/December Base year: 2016 Chain-weighted: No Primary domestic currency: Uruguayan peso Data last updated: 09/2021",723.718,737.469,668.587,646.651,639.588,649.025,706.506,762.554,773.738,782.28,784.606,812.371,876.805,900.107,965.647,951.668,1004.75,1055.47,1100.64,1068.01,1049.05,1012.74,941.332,963.24,1007.93,1076.53,1120.65,1193.96,1279.64,1333.94,1438.03,1512.26,1565.77,1638.38,1691.45,1697.72,1726.4,1754.51,1762.89,1769.07,1665.43,1717.06,1772.0,1819.85,1865.34,1906.25,1948.19,2020.0
8416,298,URY,NGDP_RPCH,Uruguay,"Gross domestic product, constant prices","Annual percentages of constant price GDP are year-on-year changes; the base year is country-specific. Expenditure-based GDP is total final expenditures at purchasers' prices (including the f.o.b. value of exports of goods and services), less the f.o.b. value of imports of goods and services. [SNA 1993]",Percent change,,"See notes for:  Gross domestic product, constant prices (National currency).",5.975,1.9,-9.34,-3.281,-1.092,1.475,8.857,7.933,1.467,1.104,0.297,3.539,7.932,2.658,7.281,-1.448,5.578,5.048,4.28,-2.965,-1.776,-3.461,-7.051,2.327,4.64,6.806,4.099,6.542,7.176,4.243,7.803,5.162,3.538,4.638,3.239,0.371,1.69,1.628,0.478,0.35,-5.859,3.1,3.2,2.7,2.5,2.193,2.2,2020.0
8417,298,URY,NGDP,Uruguay,"Gross domestic product, current prices","Expressed in billions of national currency units. Expenditure-based GDP is total final expenditures at purchasers' prices (including the f.o.b. value of exports of goods and services), less the f.o.b. value of imports of goods and services. [SNA 1993]",National currency,Billions,"Source: Central Bank Latest actual data: 2020 Notes: Data for years between 2016 and last actual for these series are reported by national authorities. Data prior to 2016 are the staff's estimates, representing best effort to preserve the previously reported growth rates and avoid structural breaks. National accounts manual used: System of National Accounts (SNA) 2008 GDP valuation: Market prices Start/end months of reporting year: January/December Base year: 2016 Chain-weighted: No Primary domestic currency: Uruguayan peso Data last updated: 09/2021",0.111,0.147,0.154,0.21,0.325,0.574,1.068,1.993,3.27,5.806,13.047,27.127,46.735,70.935,105.746,146.994,196.213,245.859,288.791,295.442,299.995,302.386,314.206,369.129,426.768,461.714,512.04,596.911,691.076,776.215,877.848,1006.34,1131.11,1280.07,1445.38,1581.55,1726.41,1842.0,1982.25,2158.73,2253.12,2576.13,2807.5,2978.54,3166.5,3370.48,3582.39,2020.0
8418,298,URY,NGDPD,Uruguay,"Gross domestic product, current prices","Values are based upon GDP in national currency converted to U.S. dollars using market exchange rates (yearly average). Exchange rate projections are provided by country economists for the group of other emerging market and developing countries. Exchanges rates for advanced economies are established in the WEO assumptions for each WEO exercise. Expenditure-based GDP is total final expenditures at purchasers' prices (including the f.o.b. value of exports of goods and services), less the f.o.b. value of imports of goods and services. [SNA 1993]",U.S. dollars,Billions,"See notes for:  Gross domestic product, current prices (National currency).",12.165,13.578,11.1,6.093,5.794,5.662,7.029,8.794,9.098,9.589,11.156,13.445,15.451,17.999,20.965,23.152,24.613,26.044,27.587,26.066,24.804,22.712,14.809,13.109,14.892,18.901,21.314,25.486,32.988,34.395,43.763,52.103,55.692,62.499,62.178,57.874,57.237,64.234,64.766,61.931,56.577,60.108,63.741,65.862,68.59,71.617,74.554,2020.0
8419,298,URY,PPPGDP,Uruguay,"Gross domestic product, current prices","These data form the basis for the country weights used to generate the World Economic Outlook country group composites for the domestic economy.   The IMF is not a primary source for purchasing power parity (PPP) data. WEO weights have been created from primary sources and are used solely for purposes of generating country group composites. For primary source information, please refer to one of the following sources: the Organization for Economic Cooperation and Development, the World Bank, or the Penn World Tables.   For further information see Box 1.1 in the October 2020 World Economic Outlook, ""Revised Purchasing Power Parity Weights"" in the July 2014 WEO Update, Box A2 in the April 2004 World Economic Outlook, Box A1 in the May 2000 World Economic Outlook, and Annex IV in the May 1993 World Economic Outlook for summaries of the revised PPP-based weights; and Box 1.2 in the September 2003 World Economic Outlook for a discussion on the measurement of global growth. See also Anne Marie Gulde and Marianne Schulze-Ghattas, Purchasing Power Parity Based Weights for the World Economic Outlook, in Staff Studies for the World Economic Outlook (Washington: IMF, December 1993), pp. 106-23.",Purchasing power parity; international dollars,Billions,"See notes for:  Gross domestic product, current prices (National currency).",13.57,15.136,14.57,14.644,15.007,15.71,17.445,19.295,20.268,21.296,22.158,23.718,26.183,27.516,30.15,30.337,32.615,34.852,36.753,36.166,36.329,35.861,33.852,35.324,37.955,41.809,44.866,49.093,53.625,56.258,61.377,65.887,66.779,70.438,74.226,74.939,76.887,79.077,81.353,83.098,79.173,84.568,89.677,94.289,98.85,103.212,107.668,2020.0
8420,298,URY,NGDP_D,Uruguay,"Gross domestic product, deflator",The GDP deflator is derived by dividing current price GDP by constant price GDP and is considered to be an alternate measure of inflation. Data are expressed in the base year of each country's national accounts.,Index,,"See notes for:  Gross domestic product, constant prices (National currency) Gross domestic product, current prices (National currency).",0.015,0.02,0.023,0.033,0.051,0.088,0.151,0.261,0.423,0.742,1.663,3.339,5.33,7.881,10.951,15.446,19.529,23.294,26.238,27.663,28.597,29.858,33.379,38.322,42.341,42.889,45.691,49.994,54.006,58.19,61.045,66.545,72.24,78.13,85.452,93.157,100.0,104.987,112.443,122.026,135.288,150.032,158.437,163.67,169.754,176.812,183.883,2020.0
8421,298,URY,NGDPRPC,Uruguay,"Gross domestic product per capita, constant prices",GDP is expressed in constant national currency per person. Data are derived by dividing constant price GDP by total population.,National currency,Units,"See notes for:  Gross domestic product, constant prices (National currency) Population (Persons).",246279.77,249246.43,224511.02,215755.79,212042.68,213812.25,231440.7,248405.0,250565.75,251932.13,251292.87,258680.72,277533.01,283209.33,300982.3,294782.93,309304.61,321207.54,332310.55,320183.68,313227.0,302176.77,281273.63,288533.4,301647.65,321125.76,333724.85,355472.04,380497.95,394880.39,423360.59,443136.73,456963.8,476252.77,489750.91,489671.94,496061.49,502263.12,502824.19,502783.46,471670.48,484629.6,498465.05,510253.68,521351.41,531146.64,541214.29,2015.0
8422,298,URY,NGDPRPPPPC,Uruguay,"Gross domestic product per capita, constant prices",GDP is expressed in constant international dollars per person. Data are derived by dividing constant price purchasing-power parity (PPP) GDP by total population.,Purchasing power parity; 2017 international dollar,Units,"See notes for:  Gross domestic product, constant prices (National currency) Population (Persons).",11099.98,11233.69,10118.85,9724.25,9556.9,9636.65,10431.18,11195.77,11293.16,11354.74,11325.93,11658.9,12508.59,12764.42,13565.46,13286.05,13940.55,14477.03,14977.44,14430.88,14117.34,13619.3,12677.18,13004.38,13595.45,14473.34,15041.19,16021.35,17149.28,17797.51,19081.13,19972.45,20595.64,21465.01,22073.38,22069.82,22357.8,22637.31,22662.6,22660.77,21258.48,21842.56,22466.13,22997.45,23497.63,23939.11,24392.87,2015.0
8423,298,URY,NGDPPC,Uruguay,"Gross domestic product per capita, current prices",GDP is expressed in current national currency per person. Data are derived by dividing current price GDP by total population.,National currency,Units,"See notes for:  Gross domestic product, current prices (National currency) Population (Persons).",37.673,49.653,51.848,70.219,107.801,189.178,349.964,649.342,1058.92,1869.79,4178.68,8637.83,14792.87,22318.88,32959.96,45531.93,60402.68,74821.37,87192.98,88572.03,89573.38,90224.32,93885.84,110570.68,127720.73,137728.39,152483.34,177715.77,205490.26,229779.8,258440.93,294885.66,330109.29,372095.97,418504.21,456164.16,496062.07,527309.17,565389.49,613527.3,638113.87,727098.67,789752.35,835132.26,885017.2,939131.6,995200.2,2015.0
8424,298,URY,NGDPDPC,Uruguay,"Gross domestic product per capita, current prices",GDP is expressed in current U.S. dollars per person. Data are derived by first converting GDP in national currency to U.S. dollars and then dividing it by total population.,U.S. dollars,Units,"See notes for:  Gross domestic product, current prices (National currency) Population (Persons).",4139.89,4588.98,3727.41,2032.97,1920.9,1865.11,2302.54,2864.7,2946.36,3088.01,3573.1,4281.11,4890.51,5663.12,6534.6,7171.51,7577.01,7925.92,8329.08,7814.55,7405.97,6776.82,4425.12,3926.71,4456.8,5637.98,6347.28,7587.88,9808.92,10181.7,12883.88,15267.78,16253.47,18167.34,18003.21,16692.65,16446.23,18388.31,18472.86,17601.27,16023.35,16965.08,17930.51,18466.47,19170.47,19954.91,20711.26,2015.0
8425,298,URY,PPPPC,Uruguay,"Gross domestic product per capita, current prices","Expressed in GDP in PPP dollars per person. Data are derived by dividing GDP in PPP dollars by total population. These data form the basis for the country weights used to generate the World Economic Outlook country group composites for the domestic economy.   The IMF is not a primary source for purchasing power parity (PPP) data. WEO weights have been created from primary sources and are used solely for purposes of generating country group composites. For primary source information, please refer to one of the following sources: the Organization for Economic Cooperation and Development, the World Bank, or the Penn World Tables.  For further information see Box 1.1 in the October 2020 World Economic Outlook, ""Revised Purchasing Power Parity Weights"" in the July 2014 WEO Update, Box A2 in the April 2004 World Economic Outlook, Box A1 in the May 2000 World Economic Outlook, and Annex IV in the May 1993 World Economic Outlook for summaries of the revised PPP-based weights; and Box 1.2 in the September 2003 World Economic Outlook for a discussion on the measurement of global growth. See also Anne Marie Gulde and Marianne Schulze-Ghattas, Purchasing Power Parity Based Weights for the World Economic Outlook, in Staff Studies for the World Economic Outlook (Washington: IMF, December 1993), pp. 106-23.",Purchasing power parity; international dollars,Units,"See notes for:  Gross domestic product, current prices (National currency) Population (Persons).",4617.82,5115.59,4892.64,4885.97,4975.19,5175.33,5714.83,6285.43,6563.67,6858.26,7096.86,7552.58,8287.67,8657.61,9397.46,9396.88,10040.34,10606.5,11096.64,10842.35,10847.08,10700.16,10115.21,10581.08,11358.96,12471.65,13360.89,14616.15,15945.18,16653.95,18069.71,19306.76,19489.13,20475.34,21491.93,21614.47,22092.55,22637.31,23203.97,23617.16,22422.69,23868.98,25226.12,26437.16,27627.84,28758.35,29910.67,2015.0
8427,298,URY,PPPSH,Uruguay,Gross domestic product based on purchasing-power-parity (PPP) share of world total,"Expressed in percent of world GDP in PPP dollars. These data form the basis for the country weights used to generate the World Economic Outlook country group composites for the domestic economy.   The IMF is not a primary source for purchasing power parity (PPP) data. WEO weights have been created from primary sources and are used solely for purposes of generating country group composites. For primary source information, please refer to one of the following sources: the Organization for Economic Cooperation and Development, the World Bank, or the Penn World Tables.  For further information see Box 1.1 in the October 2020 World Economic Outlook, ""Revised Purchasing Power Parity Weights"" in the July 2014 WEO Update, Box A2 in the April 2004 World Economic Outlook, Box A1 in the May 2000 World Economic Outlook, and Annex IV in the May 1993 World Economic Outlook for summaries of the revised PPP-based weights; and Box 1.2 in the September 2003 World Economic Outlook for a discussion on the measurement of global growth. See also Anne Marie Gulde and Marianne Schulze-Ghattas, Purchasing Power Parity Based Weights for the World Economic Outlook, in Staff Studies for the World Economic Outlook (Washington: IMF, December 1993), pp. 106-23.",Percent,,"See notes for:  Gross domestic product, current prices (National currency).",0.101,0.102,0.092,0.087,0.082,0.081,0.085,0.088,0.086,0.083,0.08,0.081,0.079,0.08,0.083,0.079,0.08,0.081,0.082,0.077,0.072,0.068,0.062,0.06,0.06,0.061,0.061,0.061,0.064,0.067,0.068,0.069,0.067,0.067,0.068,0.067,0.067,0.065,0.063,0.062,0.06,0.058,0.058,0.057,0.057,0.056,0.055,2020.0
8428,298,URY,PPPEX,Uruguay,Implied PPP conversion rate,"Expressed in national currency per current international dollar. These data form the basis for the country weights used to generate the World Economic Outlook country group composites for the domestic economy.   The IMF is not a primary source for purchasing power parity (PPP) data. WEO weights have been created from primary sources and are used solely for purposes of generating country group composites. For primary source information, please refer to one of the following sources: the Organization for Economic Cooperation and Development, the World Bank, or the Penn World Tables.  For further information see Box 1.1 in the October 2020 World Economic Outlook, ""Revised Purchasing Power Parity Weights"" in the July 2014 WEO Update, Box A2 in the April 2004 World Economic Outlook, Box A1 in the May 2000 World Economic Outlook, and Annex IV in the May 1993 World Economic Outlook for summaries of the revised PPP-based weights; and Box 1.2 in the September 2003 World Economic Outlook for a discussion on the measurement of global growth. See also Anne Marie Gulde and Marianne Schulze-Ghattas, Purchasing Power Parity Based Weights for the World Economic Outlook, in Staff Studies for the World Economic Outlook (Washington: IMF, December 1993), pp. 106-23.",National currency per current international dollar,,"See notes for:  Gross domestic product, current prices (National currency).",0.008,0.01,0.011,0.014,0.022,0.037,0.061,0.103,0.161,0.273,0.589,1.144,1.785,2.578,3.507,4.845,6.016,7.054,7.858,8.169,8.258,8.432,9.282,10.45,11.244,11.043,11.413,12.159,12.887,13.797,14.302,15.274,16.938,18.173,19.473,21.105,22.454,23.294,24.366,25.978,28.458,30.462,31.307,31.589,32.034,32.656,33.272,2020.0
8429,298,URY,NID_NGDP,Uruguay,Total investment,Expressed as a ratio of total investment in current local currency and GDP in current local currency. Investment or gross capital formation is measured by the total value of the gross fixed capital formation and changes in inventories and acquisitions less disposals of valuables for a unit or sector. [SNA 1993],Percent of GDP,,"Source: Central Bank Latest actual data: 2020 Notes: Data for years between 2016 and last actual for these series are reported by national authorities. Data prior to 2016 are the staff's estimates, representing best effort to preserve the previously reported growth rates and avoid structural breaks. National accounts manual used: System of National Accounts (SNA) 2008 GDP valuation: Market prices Start/end months of reporting year: January/December Base year: 2016 Chain-weighted: No Primary domestic currency: Uruguayan peso Data last updated: 09/2021",19.172,17.087,16.092,15.734,13.263,12.38,12.223,15.442,14.447,12.561,13.531,16.542,16.902,17.23,17.422,16.827,16.728,16.845,17.338,15.075,14.457,14.328,13.073,15.206,17.468,17.699,17.677,17.654,17.632,17.61,17.588,17.566,17.544,17.521,17.499,17.477,17.455,15.829,14.953,14.639,16.998,15.988,15.305,15.07,15.422,15.82,16.328,2020.0
8430,298,URY,NGSD_NGDP,Uruguay,Gross national savings,"Expressed as a ratio of gross national savings in current local currency and GDP in current local currency. Gross national saving is gross disposable income less final consumption expenditure after taking account of an adjustment for pension funds. [SNA 1993] For many countries, the estimates of national saving are built up from national accounts data on gross domestic investment and from balance of payments-based data on net foreign investment.",Percent of GDP,,"Source: Central Bank Latest actual data: 2020 Notes: Data for years between 2016 and last actual for these series are reported by national authorities. Data prior to 2016 are the staff's estimates, representing best effort to preserve the previously reported growth rates and avoid structural breaks. National accounts manual used: System of National Accounts (SNA) 2008 GDP valuation: Market prices Start/end months of reporting year: January/December Base year: 2016 Chain-weighted: No Primary domestic currency: Uruguayan peso Data last updated: 09/2021",8.639,9.325,12.316,8.766,7.624,7.561,10.355,10.468,11.26,10.646,11.837,12.922,12.075,11.683,11.139,11.925,11.755,14.403,14.236,12.901,11.025,10.998,14.613,13.332,16.101,16.516,16.075,17.109,16.119,16.956,16.195,16.7,13.887,14.295,14.542,17.223,18.202,15.801,14.435,15.983,16.336,14.699,15.041,14.862,14.395,14.214,14.314,2020.0
8431,298,URY,PCPI,Uruguay,"Inflation, average consumer prices","Expressed in averages for the year, not end-of-period data. A consumer price index (CPI) measures changes in the prices of goods and services that households consume. Such changes affect the real purchasing power of consumers' incomes and their welfare. As the prices of different goods and services do not all change at the same rate, a price index can only reflect their average movement. A price index is typically assigned a value of unity, or 100, in some reference period and the values of the index for other periods of time are intended to indicate the average proportionate, or percentage, change in prices from this price reference period. Price indices can also be used to measure differences in price levels between different cities, regions or countries at the same point in time. [CPI Manual 2004, Introduction] For euro countries, consumer prices are calculated based on harmonized prices. For more information see http://epp.eurostat.ec.europa.eu/cache/ITY_OFFPUB/KS-BE-04-001/EN/KS-BE-04-001-EN.PDF.]",Index,,Source: National Statistics Office Latest actual data: 2020 Harmonized prices: No Frequency of source data: Monthly Base year: 2010. Index Dec-2010=100. Primary domestic currency: Uruguayan peso Data last updated: 09/2021,0.018,0.024,0.029,0.043,0.067,0.116,0.204,0.334,0.542,0.978,2.078,4.197,7.069,10.893,15.766,22.426,28.782,34.487,38.214,40.378,42.3,44.147,50.313,60.063,65.563,68.645,73.037,78.963,85.183,91.199,97.308,105.183,113.701,123.451,134.41,146.058,160.138,170.095,183.033,197.46,216.725,233.012,247.309,260.644,272.837,285.118,297.943,2020.0
8432,298,URY,PCPIPCH,Uruguay,"Inflation, average consumer prices",Annual percentages of average consumer prices are year-on-year changes.,Percent change,,"See notes for:  Inflation, average consumer prices (Index).",63.475,34.046,18.991,49.198,55.305,72.222,76.38,63.567,62.192,80.447,112.526,101.972,68.456,54.081,44.736,42.248,28.342,19.819,10.809,5.661,4.761,4.366,13.967,19.379,9.159,4.7,6.398,8.115,7.877,7.062,6.699,8.093,8.098,8.575,8.877,8.666,9.639,6.218,7.607,7.882,9.756,7.515,6.136,5.392,4.678,4.501,4.498,2020.0
8433,298,URY,PCPIE,Uruguay,"Inflation, end of period consumer prices","Expressed in end of the period, not annual average data. A consumer price index (CPI) measures changes in the prices of goods and services that households consume. Such changes affect the real purchasing power of consumers' incomes and their welfare. As the prices of different goods and services do not all change at the same rate, a price index can only reflect their average movement. A price index is typically assigned a value of unity, or 100, in some reference period and the values of the index for other periods of time are intended to indicate the average proportionate, or percentage, change in prices from this price reference period. Price indices can also be used to measure differences in price levels between different cities, regions or countries at the same point in time. [CPI Manual 2004, Introduction] For euro countries, consumer prices are calculated based on harmonized prices. For more information see http://epp.eurostat.ec.europa.eu/cache/ITY_OFFPUB/KS-BE-04-001/EN/KS-BE-04-001-EN.PDF.",Index,,Source: National Statistics Office Latest actual data: 2020 Harmonized prices: No Frequency of source data: Monthly Base year: 2010. Index Dec-2010=100. Primary domestic currency: Uruguayan peso Data last updated: 09/2021,0.021,0.027,0.033,0.049,0.082,0.15,0.256,0.403,0.681,1.288,2.949,5.351,8.504,13.001,18.733,25.372,31.545,36.33,39.46,41.11,43.18,44.73,56.34,62.08,66.79,70.06,74.53,80.87,88.31,93.52,100.0,108.6,116.72,126.67,137.13,150.07,162.23,172.86,186.62,203.02,222.13,238.123,251.935,264.531,276.435,288.875,301.874,2020.0
8434,298,URY,PCPIEPCH,Uruguay,"Inflation, end of period consumer prices",Annual percentages of end of period consumer prices are year-on-year changes.,Percent change,,"See notes for:  Inflation, end of period consumer prices (Index).",42.82,29.361,20.532,51.511,66.125,83.001,70.652,57.285,69.007,89.177,128.954,81.449,58.911,52.882,44.091,35.443,24.328,15.169,8.615,4.181,5.035,3.59,25.956,10.188,7.587,4.896,6.38,8.507,9.2,5.9,6.929,8.6,7.477,8.525,8.258,9.436,8.103,6.552,7.96,8.788,9.413,7.2,5.8,5.0,4.5,4.5,4.5,2020.0
8442,298,URY,LP,Uruguay,Population,"For census purposes, the total population of the country consists of all persons falling within the scope of the census. In the broadest sense, the total may comprise either all usual residents of the country or all persons present in the country at the time of the census. [Principles and Recommendations for Population and Housing Censuses, Revision 1, paragraph 2.42]",Persons,Millions,Source: National Statistics Office. And World Bank World Development Indicators. Latest actual data: 2015 Primary domestic currency: Uruguayan peso Data last updated: 09/2021,2.939,2.959,2.978,2.997,3.016,3.035,3.053,3.07,3.088,3.105,3.122,3.14,3.159,3.178,3.208,3.228,3.248,3.286,3.312,3.336,3.349,3.351,3.347,3.338,3.341,3.352,3.358,3.359,3.363,3.378,3.397,3.413,3.426,3.44,3.454,3.467,3.48,3.493,3.506,3.519,3.531,3.543,3.555,3.567,3.578,3.589,3.6,2015.0
